how can you save the reelection of the president of the united states when he is blamed in the media for having sexual contact with an underage firefly girl two weeks before the elections that is the question which is asked in the beginning of the film with the answer the director barry levinson achieved a nomination for the oscar and the golden globe award but this success is a result of the good performance of many great actors like dustin hoffman as a star especially in the comedy genre robert de niro or denis leary toothe us president michael belson is hoping of a reelection but two weeks before the election a report of a sexual contact with him and an underage firefly girl in the oval office is intended to print on the front page of the washington post the adviser of the president winifred ames anne heche does ones utmost to prevent this she invites the spin doctor conrad brean robert de niro tot he white house he is supposed to manipulate the media and publish rumors he creates the following plan the report oft he sexual contact has to be replaced by an bigger topic which concerns the whole country so mr brean invent a b3bomber and a entire war against albanian and let a spokesman publish it for this plan he gets help by the big hollywood producer stanley motss dustin hoffman who creates for example video footage which is then shown in the mediathe message of the movie is clear the politician uses the media by manipulating and faking the truth to improve the image of themselves because thats the most important thing which matters in an presidential elections and because of the great performance for example of dustin hoffman who is perfectly cast with the role of stanley motss as the producer who is always relaxed funny but also focused on his work the movie reaches to convey this message in a quite funny way the movie is full of criticism of the own political system criticism of the movie is that it drift away from the imaginable reality some circumstances which are direct by the team are overdone and its not imaginable that the truth wont come outalthough i finally would rate the film with four out of five stars its a great movie and i can recommend it to everyone who like to watch how the media can be used to manipulate an image for example in films like thank you for smoking ,black_comedy
is the blend of politics and media that may be true but is generally accepted ignored or disbelieved although the portrayal in this film is surely exaggerated it is sadly probably not far from the markas is wellknown now this film came out around the same time president clinton had a sex scandal of his own to deal with some have accused him of deflecting criticism by talking up violence towards iraq the fact this film was made just before such an event makes it even more importantwith a great early performance by kirsten dunst and the winning combination of william h macy dustin hoffman and robert deniro can this film really ask for more oh and theres denis leary willie nelson and shooter jennings too,black_comedy
despite being an oscar contender and its imposing credentials i had missed out on this one back in the day i can see how it may be construed as having dated in the interim  dealing as it does with an attempt to coverup a presidential sex scandal actually anticipating the official disclosure of bill clintons alleged affair with monica lewinsky which needless to say could jeopardize his chances at the upcoming elections right now i do not recall if clintons underlings came up with some fantastic ruse to divert attention from the incident but this being the cinema it is naturally taken to extremes  since a hollywood bigwig reportedly based on robert evans is actually recruited to produce a fictitious war evidently the key here is satire and the script which received one of the films two oscar nods certainly manages to be inventive throughoutbut somehow the end result turns out to be a bit too lowkey for its own good and therefore not quite as scathing as it could and should have been we are left however with a handful of excellent performances led by an oscarnominated dustin hoffman as the diminutive but undeniably resourceful and confident producer who comes with his own team of collaborators and ultimately grows recalcitrant when his baby is taken away from him robert de niro as the spin doctor to whom the white house turns for help when the crisis surfaces and who prompts the obviously hushhush involvement of hollywood and anne heche who surprisingly holds her own in their company as the presidential aide overseeing the elaborate hoax also on hand is countrysinger willie nelson assigned the task of concocting an anthem for this latest show of strength by the usa and there are nice cameos by the likes of william h macy as a cia operative who smells a rat kirsten dunst as an aspiring actress chosen to interpret a harassed albanian in the makebelieve conflict and especially woody harrelson as a wouldbe stranded soldier afforded heroic status but who eventually displays lessthanadmirable qualities that hilariously prove his untimely undoing the film also gives one a rare behindthescenes look at the creation of visual effects  it is at once interesting and amusing but not necessarily coming across as a deliberate deconstruction of the moviemaking magic incidentally hoffman had won his second oscar for rain main 1988 under levinsons direction the two of them and de niro had actually already worked together on sleepers 1996 which i have yet to check out whereas levinson and de niro would eventually reunite for the nottoodissimilar if decidedly inferior what just happened 2008 see my review elsewhere,black_comedy
interesting i enjoyed this the films basic idea is that of a shadow government engineering the american presidents pr during the critical days leading up to the election and with the aid of a hollywood producer  no less the film wears out its basic premise in about the first 30 minutes really you could very well stop watching it at that point  from there it hammers the same points over and over  the easy manipulation of mass media and public herd mentality the general gullibility of people to believe whatever they are told to believe the conscious nihilism of powerful men blah blah blah blah blahthe first twist in the tale arrives at about the 39minute mark in the form of a cia sleuth played by william h macy this is the only twist in the whole film that makes sense and macy in his tiny role is very good barry levinson is a thoughtful filmmaker but he was not the right choice for this story after a promising start the film feels slow plodding and predictable just imagine what oliver stone or scorsese would have done with this material they would have made the interactions so much more powerfuljust because de niro produced this movie tribeca does it therefore become inevitable that he must star in it  the guy does absolutely nothing here its yet another youdontarguewithme performance,black_comedy
i wanted to like this movie but about 30 minutes in i just gave up i had to suspend too much disbelief to buy the phony war scam the characters were pulling off i dont know what a phony computer generated war would look like but it would have to be more compelling that the image of kirsten dunst clutching a kitty part of my problem with this movie was casting just too many actors that i find annoying robert deniro is just robert denirothe same robert deniro hes been in his last half dozen or so movies dustin hoffman is simply a chore to look at and listen to and then theres anne im a lesbian oh wait no im not heche they even throw in the grating dennis leary for good measure and why was willie nelson in this movie it was around the time that nelson was having the jam session with the black musician that i realized that this was simply levinson doing a watered down altman schtick silly and unengaging rent bob roberts instead,black_comedy
this is easily the most accurate political satire ever committed to film it shows the potential for government to manipulate media during times of crisis whether political scandal or war  this film has repeatedly come true since it came out first during the monica lewinsky scandal and now in the war on terrorism and iraq  furthermore the film is extremely funny with great performances from willie nelson and woody harrelson everyone should see it,black_comedy
rarely in hollywood cinema do you find a film so honest and critical of the media  is a brutally dark comedy that touches viewers because well we suspect its true  the idea that political figures would go so far as to invent a fictional war to distract the public from a personal scandal is not so farfetched  in fact the structure of our society is such that if this tale had been true and the truth had been revealed that we bought into this fantasy as depicted in the movie most people would secretly admire the mastermind of the plot just as viewers of this film cant help but admire robert deniros character  deniro and his costar dustin hoffman are such masters that their performances in this film although certainly not their most impressive work are more than believable and entirely engrossing  aided by a hilariously earnest supporting cast and concise intelligent scripting they make this film an entertaining and thoughtprovoking diversion  7 stars,black_comedy
one of the best films ever made it is not really the film itself but the idea which the film represents  i believe now  in war times  it is even more comprehensiblei think every voter should see this film in order not to be driven away by lies and political interests so that he or she can make a better decision on who to elect and on what basis,black_comedy
the further i am away from seeing this movie the better more relevant it gets i just cannot help to draw parallels with anthrax scare abouttobeunleashed war with iraq including the man left behind bit poor state of economy and upcoming elections the movie this good at predicting real events has to be praised 810 should be watched as a double feature with bowling for columbine,black_comedy
if the tail were smarter than the dog the tail would clever sarcastic cinic the movie shows how to manipulate the public opinion and how to redirect the feelings of masses de niro and hoffman are simply great and they dominate the whole movie with their presence that was a cool movie,black_comedy
i had to watch this movie for critical thinking class when we were talking about fallacies and this movie basically deals in the red herring fallacy overall the movie was quite entertaining it was pretty funny to see how the public was manipulated  its also interesting to note that the movie was released so close to the clintonlewinsky fiasco  still there were a lot of dull slow moments and thats why i wouldnt give this movie a higher score,black_comedy
i love this one because it shows how dangerous it can be if only one country concentrates all the power enough to not start but fake a war in an independent country even if it is a cover up on a sexual harassment case involving the president or any economic or political reasons and also hits hard when it shows how easy is to manipulate the masses thru television and media funny yes intelligent too original sure but the point must never be forgotten after all nobody can be sure that it wont become reality810,black_comedy
you have two screen legends robert deniro and dustin hoffman onpaper you might think they will try to outdo each other when you watch the movie you will find that they work great together the writing is superb and delivered at a machine gun speed you have to pay attention at all times or you will miss some jokes the plot is great the movies running time is short and snappy and the supporting players are well cast denis leary was a nice choice for the quick speed of the dialog i wouldnt be a bit surprised to learn that there are people like the characters in this movie how much can we really trust the government and what they will and wont tell us anyway a definite must see,black_comedy
i first saw years ago when it first came out but having just seen it again i cant help seeing parallels with the events of 911if bush didnt engineer those events the facts are emerging that he let it happen  and look what its done for his ratings  look how patriotism and finding a convenient culprit albanians afghans talibans or osamas can play into schemes and plots of an illegitimate regimefor me this film has gone from merely poignant to quite chilling,black_comedy
if youre a hoffman fan like me then this is a must see he is simply magnificent in it his character an unappreciated so he thinks hollywood producer is perfect for him  he adds the exact amount of wit uncertainty spontaneity and unease that one would expect from someone if this insane plot were for real the president of the united states making it with a firefly girl come on  maybe a girl scout but even our presidents have their limit but hoffman takes us to the limit in this movie and sends us back he is so natural in this role you forget its him but thats hoffman at his best the other characters are good really good de niro is great as the man in the shadows who cleans up everyones messes heche is perfect as the somewhat nervous but always forward moving presidential assistant and even denis leary with a bit part as a movie stylist or something the fad king is a riot i mean with willie nelson belting out a madeforcover folk song how can you go wronghoffman rules,black_comedy
this was absolutely one of the best movies of 1998 and remains one of my favorites it is a perfect example of a film working in all aspects script acting directingname it its all done right the story begins during the current presidents reelection campaign and we are almost immediately swept into the behindthescenes look of things we soon learn that the president has been accused of sexual assault on a young girl enter conrad breendeniro his job is to find a way of keeping the american public distracted from that story as long as possible so he goes to hollywood superproducer stanley mottshoffman and together they will lead america to war are you interested yet hmmmmm still not sure what if i were to tell you that the war they have the public believing is going on in albania is actually all taking place on a hollywood sound stage yup its all been setup through press leaks gossip and fake video footage to make the president seemwellpresidential and believe me when i say that that is just the beginning of this fast and funny flick dustin hoffman received a well deserved oscar nomination for his performance in this film this being his second nomination under the direction of barry levinsonrain man deniro is equally fantastic in this film so funny and laid back a way i hadnt seen him since midnight run you will i promise love these performances even the supporting cast most notably anne heche as the frantic press secretary helping de niro and hoffman do what they got to do is perfect you cant take your eyes off it from beginning to end sometimes the film may seem a little impossible but it just looks so serious and believable that you will be second guessing yourself the whole way through much like the characters in the film even the final consequences leave you wondering about what goes on in your everyday life that you really dont know about by the end of this film you have not only experienced some funny and unbelievable situations but gotten to know the main characters in a personal way youll know exactly what motivates each one of these characters through this whole situation and exactly what they plan on getting out of this coverup i think that by the end of this movie you probably wont care much about the outcome of the presidential election but more of what these characters must now deal with i wont spoil it for you but this film definitely works and you will love it if you give it a chance so dont shy away from the political twists in this plot theres definitely nothing there you cant handle i think that anyone over the age of 13 with at least some kind of sense of humor will dig this flick then again even i enjoyed it,black_comedy
adapted from larry beinharts novel american hero this  seemed to be intended as an airy semipolitical comedy to me it just seemed like a lazily assembled collage of soft extended skits on engineering a media war you may notice several badly handled leaps in the story this is a muddled mess and it could have been such a great movie because its premise is exceptionalunfortunately de niro heche and hoffman three actors i really appreciate and the main reason why i watched this movie couldnt help it but then  what to do with such a script,black_comedy
a great performance from dustin hoffman in the lead and a quietly confident effort form di nero makes this an over looked comedy from 97 funny small roles from woody harrelson willie nelson william h macy  dennis leary if you like a smarter sorta comedy over the usuall crapthis is worth your time,black_comedy
most people know the plot of this outrageously funny movie by now a political spin doctor conrad brean robert de niro and a hollywood producer stanley motss dustin hoffman both well endowed with chutzpah set out to create the illusion that the usa has gone to war with albania as a distraction from a presidential sexual peccadillo made and released before the clintonlewinsky scandal broke it is not clear whether the movies makers had great insight or inside knowledge either way that episode adds to the interest and relevance of the film    de niro and hoffman are both brilliant though understandably the latter seems especially to relish lampooning a filmworld type he must have encountered many times in his career anne heche is just right as a presidential aide who previously thought she was streetwise but faced with brean and motss realises shes a tyro in the kidology game and woody harrelson has a wonderful role as the man picked to play the war hero who just happens to be a psychotic convict willy nelson is also in the movie apparently playing himself but in reality as a character called johnny dean he also wrote and performs some of the great songs including the stirring i guard the canadian border i guard the american dream  among the targets of the satire are clearly the us political establishment the broadcasting media and hollywood but there is a danger that the primary target may be overlooked and it is worthwhile remembering the derivation of the films title normally the dog wags the tail because the dogs smarter than the tail but if the tail was smarter it would and there can be little doubt that the dog being wagged by brean and motss is the viewing and voting public,black_comedy
is an intelligent satire and an interesting commentary on the media and how it could be and is used by governmentsare we suckers do we understand what really goes on in the political world we are fed lies the film brings up interesting questions this is one of the best satires in a long time the film has gutsthe acting is pretty good de niro and hoffman are reliable heche is good but dont expect anything new from leary harrelson is hilarious as the convictthe direction is good as is the screenplay although de niros character goes a little too quiet in the middle of the filmhas always see it in widescreen intelligent and fun well done,black_comedy
oh my dear goodness  id heard of this film when it came out andduringafter the monica thingie  last night this was on the tv so idecided to view itforget clinton leave that in the basement of your library  thisdeserves to be given status as eternal legend  we should especiallypeople of the us should view this film time and again just to remindourthemselves what the 21 inch box in front of you could be doing toyouan effective satire with capable performers taking us through youshall enjoy it  ill never see cnn the same way ever again ,black_comedy
one of the smartest and funniest satires ever made  truly bites the performances not surprisingly are brilliant  hoffman de niro  heche what did you expectthe screenplay is extremely funny the situations a little bizarre and exaggerated but hey its a satire  everything goes  as long as it resembles reality and is funy  and boy  does it ever work on both these countsthe fact that this movie reflected reality so much was a major turnoff for most people but leaving that aside its still a sharp and funny movie  well worth watching does get silly at times but hey  rent the movie ge some friends over and howl away to laughter singing along to good ole shoes a smart and witty 9,black_comedy
thinking mans comedy and one of the best at that robert de niro dustin hoffman at their best  never could understand how movies like this could get sidelined and not noticed  the movie is scary in a way because you wonder if the whole media hoodwinking the public thing is fictional or is it really happening ,black_comedy
this movie given the political events of the time may have had the most timelysome might say freaky and prophetic release date of any film  it features wonderful satire not only of politics but of culture and hollywood  but its greatest attributes are the performances especially those of de niro and hoffman which are simply outstanding and a pleasure to watch  i also loved the title and i thinks its a far better one than something more obvious or descriptive like the fake war or the spinmaster,black_comedy
a very wicked satire on hollywood politics and the supreme power of media spoilers q whats good about conjuring up a fake international crisis a it can distract the public from the real one and being fake its very easy to resolve moreover you can  do it without any loss of american lives which is always a big plus if one is concerned about the presidential approval ratings at first glance the very idea behind the movie seems ridiculous however it turned out to be so prophetic its freaky mr clinton and his advisors probably watched it to learn from the masters of course instead of an albanian village we had a sudaneese medical factory which was elevated to the status of a chemical weapons plant and promptly destroyed just in time to help the president ease off the impeachment pressures to be fair democrats werent the only ones to engage in such practices in fact what probably inspired the movie was the invasion of grenada conveniently launched while reagan was taking a huge hit on account of loosing all those american lives to a terrorist bomb in lebanonone might think that a film like would be too much tied to the politics of the moment  that it would loose all appeal a year past its release however ive just watched the film on tv and i liked it no less than when i watched in theater  few years ago in part this is due to a very snappy script and very good acting jobs by the lead actors  de niro heche and especially hoffman also woody harellson is simply hilarious as a paranoiac convict who is enlisted to play a role of a war hero of the albanian campaignthe movie is intentionally extremely cynical in the way it delivers its message and  some people might find that offensive but i believe it to be one of its major strengths my main complaint is that on a few occasions it pushes the boundaries of believability so far that it turns from satire to farce which i dont think it intended to be another drawback is that none of characters good or bad  well they are all bad is engaging enough to make you care at all about what happens to them thats why nobody is going to shed any tears for hoffmans character the most engaging of them all who gets killed in the end when it becomes apparent that he wants to disclose the whole affair in his vain desire to get recognitionhowever overall this is a pretty good film well worth your time to watch it,black_comedy
the point of the film is byandlarge how gullible the mainstream media is during the clinton years the powers that be could have said the sky was green  anyone who said otherwise a rightwing conspiracist  and basically the lapdog media corps would have marvelled at the spin  now we see just how much the clintonestas fooled the press and this film seems more like allegory than fantasy,black_comedy
this movie is an intelligent one its funny but it pops a few questions about todays governments and the manipulation of information its kind of freaky to see how its possible to create an entire story even a war from scratch and imagination i think we live these kind of situations every day but at a lower level dustin hoffman is excellent in this one7 out of 10,black_comedy
i thought the acting was great and the story was fun i think politics are boring but this movie held my interest several memorable oneliners amusing scenes and numerous fuzzy kittens all of which came together to make a great movie for smilingi thought it was ironic how this movie was clearly a comedy while the cast of characters within the movie is trying to film a drama as a result you find yourself laughing at several scenes within the movie which are completely dramatic to the audience within the movie it was strange and interestingmy only quibble is that it seemed to end rather abruptly and left a few loose ends dangling i was watching the television edit so its possible they were trying to cram it into an insufficient time slot im not sure,black_comedy
