i was expecting this movie to be a clever satire however there really was nothing clever about it it was just one south park style gag after another with about as much connection to reality as your average south park episode at least south park manages to be genuinely funny a lot of the time thoughthis movie doesnt its just stupid and contrived i did not laugh once or even chuckle watching this its just really stupid from start to finishwhat is the big satirical message here that politicians start wars as distractions that many people are very gullible when it comes to cheesy patriotism unless you are very naive the fact that these things happen should not come as news to youi guess from the high ratings some people saw some really deep subtext in this movie or thought the gags were hilarious or both but sorry i just dont see that,black_comedy
this file is not succesful its a comedy and we dont laugh its a satire and its incredible its too simple ok for the beginning ok for the play of dustin hofmann bravo  ok for the process of creation but the role of de niro is too narrow and why theres only two actors in the film  denis leary and  woody harelson cant play among others but the idea was good ,black_comedy
its two weeks before the presidents reelection and hes far ahead in the polls a sex scandal allegation with an underage firefly girl erupts threatening his lead spin doctor conrad brean robert de niro comes up with an idea to redirect the talk to albania along with winifred ames anne heche he recruits hollywood producer stanley motss dustin hoffman to manufacture a fake warthis is a brilliant satire with just enough realism for the audience to question whether this is actual reality de niro and hoffman are absolutely wonderful the humor is biting it hits both politics and hollywood the title literally infects the popular lexicon its a wonderfully funny satire,black_comedy
a political satire at its best i first watched this movie shortly after it was released and must admit i got much more out of it the second and third time at the least it makes you think even if you are not a conspiracy theorist i did not give this movie a higher rating because the top rated cast  de niro hoffman and heche only gave average performances and the direction was also average there was enough entertainment though to keep you interested until the end watch it and watch it again just to remind yourself that things are not always what they seem which is the one truth illustrated by this movie the rest of course is satire we would hope,black_comedy
i saw this movie with my dad when it came out on vhs being a very political minded man he instilled family values as well as pride for our country we loved this movie as he also taught us when we were kids big brother is always watching and told us we as citizens of this nation should not walk blindly through life take nothing for granted especially to not accept the idea that the government and media wouldnt possibly lie to usthere are reasons we do not know everythingi laughed so much during this movie and told him he was correct i thought this movie was very well done and would absolutely love to see a remake come out in the very near future given the state of our government today and how many sheeple are in existence who need to wake up and see things for what they really are i wish i had just a dollar for every time in my life i have said all i will say is wag the dog,black_comedy
i love this film the performances by de niro and hoffman are stunning and as a moving image professional i find the scene in the edit suite as they build up the poor girl in the war torn village shot so amusing and yet with so close to truth in many ways it is funny near the knuckle and scary because the undertones are so powerful if even a fraction of the spin doctor tactics coupled with political actions are true i think more people should see it i am amazed that it hasnt been on tv more i saw it at an arthouse cinema in berlin when i was going out with a german girl i have not seen it since anywhere maybe that is the powers that be pulling the strings in the background again they dont want anyone to see something that is so close to the truth i am a video producer and i want to tell you this is someones best wor,black_comedy
barry levinsons film is a political satire about a political spin doctor and hollywood producer who stage a war in albania to cover up the presidents sex scandal during the upcoming election we the audience are shown how conrad brean played by robert deniro and stanley motts played by dustin hoffman create an outlandish fake plot to distract the american public from sexual allegations made by the president after albanian war is created fake news footage is created within a studio create fads throwing shoes onto tree branches in support of a false war and catchy sayings with theme songs are created by famous country singers in support of their fake war hero sgt schumann who turns out to be psychotic resulting in his own death after that they stage a funeral procession for schuman its amazing how this whole big sham becomes breans best work because its so convincing and looks so authentic he is so proud and enamored with his own creative work he decides he wants credit and his greed and pride lead to his death the secret service take care of him good example of how the government can easily dispose of someone who gets in their way and no one would ever know the obvious message is americans believe what they are told and hate whom they are told to hate the american public is very gullible and too lazy to find out the whole situation and facts themselves in the film we see how people jumped on the bandwagon without giving the situation much thought i notice americans have become very complacent and comfortable within their overprotected lives we should be aware of global and national politics on a much larger scale we are so behind compared to other countries we should get more involved by questioning our government corruption exists in many government systems but the american people is the only country i know of that is either unaware or okay with that it was very frustrating to watch everyone go along with the diversion i am sure there is much we do not know i was actually rooting for brean and motts to fail but i am sure the outcome rings truethere are so many examples in american politics that resonate without own because american government has initialized wars iraq war and also created false sense of patriotism to get americans to back up their country even when the motives seem somewhat blurry weapons of mass destruction even when a conflict is real and necessary the gulf war for example the packaging of them is invariably shallow and unquestioning like sportswriters war correspondents abandon any pretense of objectivity and detachment and cheerfully root for our side at one point in the film levinson asks why does a dog wag its tail we are told because a dog is smarter than its tail to the film director the tail is smarter and we the viewers and american people are taken for a ride and invited to be that easily manipulated dog the message is clearly to be more aware of the government and become proactive by questioning what is going on and dont just accept everything the government tells you to be true learn the facts from both sides,black_comedy
after the us president is implicated in a sex scandal at the white house with less than two weeks to go before he faces reelection for his secondterm in office a professional mr fixit is called upon by a presidential adviser to do a fast spin on the problem determining that the nations attention must be diverted to more pressings matters he enlists the aid of an experienced movie producer and his troupe to fake a mediacovered war with albanian terrorists acerbic political satire one which blessedly doesnt condescend to its audience in this universe were all wildly corrupt the effect might have been rancid or tasteless however the allstar cast is comfortably selfamused and most of the targets are detonated with witty aplomb the screenplay by hilary henkin and david mamet from larry beinharts book american hero ingeniously namedrops reallife political figures without amassing needless newsreel footage or forrest gumpstyled razzledazzle the scenario simply doesnt warrant it the president and his party remain anonymous throughout a decision which gives a great deal of nondated cache as a relevant political skewering though the final act does go off the rails the remainder of the film is extremely freshperhaps not for the ages but certainly for this era 12 from ,black_comedy
just watched the film and i have very mixed feelings about it on the one hand it cannot be said that the film is bad it started out as a clever comedy it made its point about corrupt governments and general public believing anything they see on television all hints were clear all actors seemed okay dialogs were smart everything was fine closer to the end it felt like the writers got carried away and lost control to a certain extent becoming more illogical and absurd with each scene but considering that the film was a comedy it could be forgivenbut the ending just completely puzzled me i sat bewildered for five more minutes staring at the titles i did not understand what they wanted to say by thisthe first part of the film was a satire but it was funny all the inconsistencies exaggerations lack of logics and broad generalizations seen in the first part of the movie could be accepted only if the film posed as a satirical comedy i hate talking about happy endings but a more or less happy ending could help this movie stay a satirical comedy but the abrupt and cruel ending suddenly claimed that the film was politically realistic if so it rendered the rest of the movie almost totally ridiculous i do not want to say that a movie cannot or must not be funny and serious at the same time but in there is an abyss with a very thin bridge between the two aspects and it is not very good for stylei am not going to argue whether americans or other nations are actually so stupid en masse as to be so ignorant of the outside world and to believe everything their politicians say on tv maybe they are after all though i personally would like to hope they arent distract attention scenarios are quite popular nowadays even on the family scale to say nothing about politicians and governments manipulating the public opinion maybe it is actually possible to fake a war only the process would not be as simple as in the movie and would not involve so many people hundreds of potential leaks so basically from the viewpoint of credibility the scheme outlined in the film maybe holds water but the filmmakers should have been more careful about what they actually wanted if they wanted a cynical satire it should not have an ending like this and vice versa if they wanted a serious political warning of sorts all absurdities and inconsistencies in the first part should not stick out that much the movie and the ending just dont fit with each other and it leaves the impression of something not very carefully thought out and produced hurriedly with a mere aim of shocking the audience and making moneybut striking out the ending the film does give food for thought even though every idea in it is exaggerated to the point of absurd its not the best political satire in history but not the worst either just maybe it would be better to read the book after all,black_comedy
i had high hopes going into the cinema for this particular movie especially with the like of de niro and hoffman on the poster i knew it was going to be great and it actually wasthe movie itself is based on a novel and the screenplay adaptation really deserved accoladethe movie was up for 2 academy awards best actor hoffman  bestadapted screenplay whilst it didnt win either of them it really deserved tothe story actually isnt that hard to understand the president touches a young girl and the press are onto it like hotcakes so the presidents right hand man or in the case girl heche gets the presidential adviser de niro in to help fix the problem and with election on in 11 days it isnt going to be easy to fixde niro gets cutthroat  eccentric hollywood producer hoffman in on the scene and to divert the countries attention away from the sex scandal they decide to create a war hiring actresses to play young girls in the bombed wreckage and bringing in singers to create fullhearted songs to bring america back on the presidents side the three amigos heche de niro and hoffman actually do a magnificent jobwatch the movies for the laughs watch the movies for the music which unfortunately is not on cd but overall watch the movie to escape reality and to have a great hour and a halfan amazing movie a solid 910i would like to personally congratulate the actors on a remarkable performance,black_comedy
watching the movie has been an absolute delight aside from the fact that the leading actors are renowned as they are robert de niro dustin hoffman and denis leary played their parts terrifically the movie starts with anarchy in the white house as the president has been accused of molesting a young scoutgirl the special man de niro has been called to divert the eyes of the cia the opposition leader and the whole nations by starting a mystical war with albania qwhy albania a the question you should be asking is why not albania the plot thickens when a hollywood director is called to help orchestrate the biggest show blind the entire nation as old shoe or private shoemaker who inconveniently was a psychopath was declared a hero of their ongoing orchestration i dont want to spoil the whole movie for you guys but its safe to say there were a lot of cracks in the movie that made it a classic,black_comedy
i am commenting just now because i cant believe some people didnt get how brilliant this film isi heard this film was shot in 29 days and if that is the casewell you can forgive any imperfection keep that rushed schedule in mind looks like they were trying to release it before the actual zippergate brokei work in the film industry so i appreciate the jaded hollywood characters it was right on the money  i remember walking out of the theatre thinkingthat was really entertaining910,black_comedy
is one of my favourite films because it contains nothing except well known actors a typical hollywoodmovie should contain there are no special effects there is no love story and there are no big emotions but thats exactly why the movie is so cool it is full of latent jokes although it wasnt a very successful film i think dustin hofmann robert de niro anne heche and especially woody harrelson were fantastic,black_comedy
why does a dog wag its tail because a dog is smarter than its tail if the tail were smarter than the dog the tail would so say the opening credits of barry levinsons political satire one of the best bites at american politics ever made levinson diner rain man has made some great films in his career is one of his most charismatic and energeticthe film concerns itself with the medias close links with the government in it a veteran spin doctor hires a hollywood megaproducer to help start a false war in an effort to divert attention from the presidents alleged underage affair with a firefly girl the spin doctor is played by robert de niro the bigshot hollywood producer is dustin hoffman together de niro and hoffman create one of the best teams in ages  and hoffmans performance in particular is scenestealingconrad brean de niro is under pressure to resurrect the presidents chances at being reelected so he and stanley motss hoffman start using any means necessary to jumpstart their phony war along with the help of an associate anne heche they travel around the country stirring up controversy about the war creating false war heroes alerting america of possible attacks by albania their false war target in todays day and age it almost seems uncannily close to realitythe movie has extremely funny scenes all very realistic in nature people who appreciate films will love because of its hollywood references did you know theres no academy award for producing motss asks brean throughout the movie he relates unexpected and overwhelming incidents to his past this is nothing compared to when one of my projects had its funding canceled after four months motss says everyone rolls their eyes theyve heard the story beforethen theres the part where we meet up with the fake war hero that brean has hired hes played by woody harrelson and is a convict what did he do someone asks murdered a nun is the reply then we find out that the convict is running low on medication which results in some very funny jokesi have to admit that im surprised some scenes were present in the finished cut such as the indication that a presidents staff is corrupt enough to actually do such things as those we see in the film is bold enough to actually use scenes such as this to its advantage what might come across as rude or possibly irreverent becomes quite hilarious in a film crammed with celebrity cameos ranging from denis leary to craig t nelson willie nelson shows up and is hired to write a patriotic war song albania albania he croons yeah that rhymes motss saysthroughout the movie hoffmans performance is frantic and wild resulting in a rather hyperactive character who is constantly talking moving yelling or worrying although de niro stole the show in analyze this hoffman does the same in creating a very memorable character to add to his resumethe movie was written by david mamet and hilary henken mamet has an ear for great dialogue always has and undoubtedly most of the solid dialogue in could be attributed to his credit as cowriter mamet also wrote the script for de niros were no angels which costarred sean penn and was a fairly enjoyable and underrated comedy about two convicts who escape from jail and try to cross the canadian border only to be mistaken for catholic priests it wasnt a great movie but due to mamet de niro and penn it succeeded as light entertainment what was missing was the solid dialogue present in mamets other scripts and theres plenty of it in there are a handful of quotes from this film that i will probably never forgetmovies such as dont come around very often and when they do theyre usually a lot tamer this is a film that i believe the majority of americans will enjoy because theyll find themselves realizing how realistic and yet also farfetched the jokes are personally i also loved the little digs targeted at hollywood in a subtler way the film bites at hollywood in the same way that get shorty and adaptation didwith barry levinsons career now being harmed by disasters such as envy is good proof that he still can direct a very solid comedy  he just needs to learn to turn down certain scripts in favor of better ones,black_comedy
i remember when this movie came out and i couldnt wait to see it i was disappointed though which is surprising as this is one i actually expected to love in fact i expected to love this so much i was kind of baffled when i didnt i did love the plot unfortunately it doesnt unfold in a very interesting way there was just something missing from this it should have had more impact in the way it enfolded given the subject matter but there was something missing and im not even sure i know whati think this could have been an oscar winning film i mean it had a great cast a really interesting plot i think had this really been done well or better people would have been flocking to itbut word of mouth kind of spreads and truth be told this just wasnt great the films pace was awful and there was no sense of excitement which is needed in a movie to hook the viewer also with a plot like this the whole movie should have been riveting but it wasnt in this case there was no tension to the movieto sum up great cast great plot but not so great enfolding and ultimately disappointing,black_comedy
considering the clever plot line and the highly talented cast i still marvel at the fact that i rewound the video before the movie was completed perhaps i expected too much but this movie peaked at the beginning and went down hill from there,black_comedy
sure that sounded interesting at first a movie about spinmeisters starring robert de niro and dustin hoffman thats actually the only thing to be remembered one good idea buried under mass ineptitudethe biggest mistake is in the tone who wants to see a movie where the main characters are babbling about fooling their fellow citizens and having fun along the way somebody wanted to compare this to such a welltailored political satire as dr strangelove well thats an outrage kubrick masters black humor in this movie whereas only circles inwards around the starting pointthe story only gets duller as new elements unfold to make the movie longer and we never care about this stuff supposed to occur in the final days leading to a presidential election no suspense no rhythm nothing all in all a general failure where nothing is to be saved even dustin hoffmans work is just as painfully ridiculous as the whole wouldbedeepandfunny fumbled fable,black_comedy
the worst film ive seen since highlander ii flimsy plotline ham acting from deniro and hoffman i almost fell asleep and should have walked out a number of people around 15  left in midfilm that says it all  levinsons worst ever film and to think people will get this turkey out on video seeing as it was hyped and advertised to make it seem watchable i voted 1 out of 10  if only a zero score had been available,black_comedy
there was a lot of talent wasted in this movie i must say that my wife and had a difficult time watching it all after 45 minutes we were no longer engaged in the story i was expecting satire but not silly slapstick they could have done so much with this movie and this cast a lot of time was spent drilling down on minute aspects of the scheme and i felt they were flogging a point endlessly for example the producer wanted a kitten in a scene and several minutes was spent on him complaining until he got the kitten he was looking for the movie develops very slowly almost painfully so the conflict between the conspirators and the cia was very artificial with a conclusion that made no sense i am guessing the idea was to make all government agencies as well as politicians look foolishthe movie succeeded in doing so this but in the end the whole story was pretty foolish and lacked anything that would maintain interest,black_comedy
i first watched this film when it was first shown on cable over here in the uk and i switched it over after about 45 minutes i just couldnt take any more of the mind numbing drivel it was on again yesterday and as nothing else decent was on at the time i thought i would give it another chance oh how i regret that how such acting heavyweights as hoffman and deniro ever got involved in such a pitifully boring film as this i will never know an absolutely ridiculous plot  yes i know it was satire but come on  hardly any action worth talking about and script writers that must have been absolutely steaming drunk or stoned out their heads when writing it or theyve never lived in the real world as i said i know its satire and i dont mind satire but this film takes satire to knew levels a really really bad film,black_comedy
this is a political satire done right these can be hilarious but is not done right granted this might have been made as a response to the clinton sex scandal but if it was done better it could have been a stinging comment on the bush administration or any corrupt government entity as well however doesnt take any risks and all the potshots that it takes are broad and tiredtwelve days before the election the president is caught in a huge scandal to find a way out and still keep the presidency he asks conrad brean robert deniro for help brean decides that the best way to get past this is to distract the public with a phony war with albania to accomplish this he hires bigtime hollywood producer stanley motss dustin hoffman to pull it offthe problem with this movie is that its a onejoke movie and its really not that funny the joke is that politicians are full of crap and the public is too stupid and easily distracted to pay attention to anything thats not in the front page headlines i wont necessarily disagree with either of those comments but both have been done to death and the way barry levinson chooses to meld the two isnt very interesting and certainly not funnyhoffman and deniro are two of the most celebrated actors around but this movie just isnt a good use of their talents they play their parts well but its all for naught anne heche is good as their political liaison but again the movie is below her talent level woody harrelson is amusing in his small role but little elsethe film isnt a total waste there are a few amusing bits here and there but certainly not worth a recommendation,black_comedy
