levinson once such a fine naturalistic director seems to have come unstuck with this film the signs werent good with sleepers and was a bigger disappointment whilst a good comedy satire such as the player or dr strangelove allows the viewer to feel involved without being pushy wag is relentless in making sure you get the joke  its too claustrophobic the visual style is too hurried and is trying to hard to come across as naturalistic and instead becomes intrusive and annoyingbut there are some good gags and hoffman and de niro do well with under  written roles sadly heche the most under used actress in hollywood struggles with dialogue that mamet tries to convince us we all really useoh and the ending and this may be a spoiler but probably not is badly handled with the tone and rhythm of the film disturbed not that ive got anything against shifts in tone  la confidential does it brilliantly but seems to stick the ending on for no important reason other than to tell us were being serious 6 out of 10,black_comedy
this is a very well produced movie the pace is fast and the script is by far one of the most original to come on screen in a while the acting is superb and the title that opener about the dog and the tail is one of the best ive seen it immediately captures your attention at the crucial beginning although i generally find dark comedy quite watchable i had problems with this one i think to really enjoy this movie you need to get over the selfishness and lack of ethics from almost all of the characters i found them all to be extremely deplorable and in the end that kind of soured the movie for me hoffman is at his best here as is de niro and surprisingly heche too,black_comedy
judging from the imdb rating this movie has garnered i can only assume that most of imdbs raters are those who are easily bored if 10 minutes go by without something blowing up  if youre not one of those action movie junkies then you might just love this movieit has some of the best and funniest dialog of any movie of the late 90s the acting is fantastic  rare in an age when acting normally means trying to look frightened while staring at a blue screen where the special effects will gothis movie definitely isnt comparable to movies like independence day or airforce one but fortunately that means it isnt comparable to independence day or air force one  definitely not for the faint of mind,black_comedy
is a funny and engrossing stylized political satire see bulworth for anyone who has not killed all of his brain cells i just saw the film although i had intended to see it during the theatrical release for those of you who were expecting a slack jaw comedy shame on you do your research before you fly off to see a film and maybe you wont be disappointed so often wtd is not meant to be realistic besides that is fairly impossible when ones intent is absolute and biting satire the only things that keep wtd out of the  to 12 category out of  is the calculated use of deniro and the disappointing finalethe casting of deniro was a highly obscene use of box office drawing power because of the superficial way in which his character is drawn which is to be expected in this kind of film anyone could have been wasted as conrad more than anything i suspect that deniro was paired with hoffman to increase tenfold any draw that hoffman would have achieved alone as the star of the filmbut what killed this film and all of its noteworthy effortso entertaining and thoughtprovoking a film on the cusp of greatnesswas the unforgivably lackluster ending unfortunately the writing talents of this film ran out along with its credibility towards the end,black_comedy
is too familiar and simple and the general public is too sophisticated these days to fall for trite cinema that falls apart too easily like a soiled diaper familiar but who wants the smell ive been given reports probably untrue that the film is really a remake of a hoffman home video the cast and director simply can not pull off this impostor of a filmthe camera moves here and there no story outside the immediate scene no substance just burlesque i shook my head in sadness even the 800 number shown on screen is bogus 8005550199 you might as well see the camera everyone knows any phone number except the last four digits containing 555 is a dead giveaway what are we idiots its not real sure we know but do we have to be constantly remindedis dull stupid and boring and it insults our intelligence go ahead see it siskel and ebert gave it two thumbs up way up sure the story idea was interesting i looked forward to it seemed like great fun i dont see a film just to review it but this film would work only if one could believe the premise either it was real or it was a big joke its embarrassing for all involved petty story disguised as art,black_comedy
starts out limping and finishes lame apparently written as farce but directed as satire it left me cold i rented it to watch with friends and so had to suffer their dirty looks and muttering for the durationas a farce it fails because of its direction too straight and too slow the viewer is given way too much time to see the stupidity of the situations which develop it it was condensed into an hour with a dash of comic violence thrown in it may have been funas a satire it also falls short ultimately because there is nothing believable about it the story lacks subtlety and i got a real sense that the occasional unfinished sentence ala mamet i presume was not for realism but because there really was nothing interesting to say the theme of a manipulative media is hardly new just go watch network or broadcast news again they both go much deeper and youll learn and laugh a lot more the treatment of the media campaign in is over simplified telling even the most naive viewer what they already knowif you want good political satire rent primary colours if you want selfreferential hollywood satire see the player or get shorty perhaps is actually a farcical parody of the medias hamfisted attempt to satirize itself whatever it is i dont get it,black_comedy
let me start by saying that this was a very good movie now much has been made of its classification as a comedy it may not be a laugh out loud type of film although i did on a couple of occasions but it is witty fun and satirical i have seen many movies classed as comedies where i didnt even crack a smile people have also mentioned some requirement for genius iq to get this movie i would dispute that but at the same time i would say that i may well have enjoyed this movie more because my degree and work is in politics the story itself is uncanny it was been a well known principle that wars are good for poor polls it is just even more obvious nowadays the degree of media manipulation may be pushing things a bit far but it is scary that control of information and picturesie desert storm colours our perceptions so greatly generally this movie preaches that people will believe what they are told and hate whom theyre told to hate unfortunately theres a lot of truth in that i thought the acting superb especially hoffman even heche whom ive thought poorly of since six days seven nights  terrible movie put in a classy job and deniro was his usual quality actor lastly anyone who thinks primary colors a superior movie well i will say no more except maybe you should stick to van damme movies from now on,black_comedy
its funny to see how this movie has garnered polarized responses  from those who loved it and conversely those who didnt get it  i personally thought that it was hilarious  yes it does require some prior knowledge of politics and current events  and for that reason i dont recommend it to everyone  the humor is subtle and as i can testify first hand there were numerous times when i laughed hysterically while everyone else sat deadpanboring  no  thoughtprovoking  absolutely  and for that reason i think a lot of people will not like this movie particularly after all of the press it received recently as the presidents problems could not have been any more parallel to the events of the filmi strongly recommend this movie to anyone who wants to watch a movie that lets them to think as they laugh  otherwise watch the wedding singer and laugh because they have a rubiks cube,black_comedy
people who want to sit down and have a nice neat story poured into their heads will hate this movie  on the other hand if you like political satire this movie will make you laugh and cringe in fear  hoffman and deniro are brilliant  my favorite exchange deniro referring to the gulf war shot of a laserguided bomb blowing up a building says something like i was there when they filmed it  it was a 14 scale model  hoffman says is that really true  deniro smiles and says whos to say,black_comedy
many people have said that is a boring movie many have said its too brainy well i agree for those who cannot comprehend the subtleties it must be excruciating for the rest of us it is a fantastically sharp satire with quick jabs and an aura that makes you fear the possibilities for real life you cant get any better than de niro hoffman and such wonderful additions as denis leary and a surprisingly funny willie nelson make the cast one of the best in years david mamet is again masterful with his insight into the political realm and the music though not exceptionally powerful is appropriate,black_comedy
this movie was one of those movies that i thought i would have to like because the critics with whom i usually agree said it was so good other examples of critics praising boring movies are the last emperor the english patient and pulp fiction the acting in was great but good acting cannot subsitute for a boring story line,black_comedy
right after this movie was released the affair between billy and moni broke out and there were suddenly problems with the middle east hum hum so it may not be about that but its pretty close when the president gets caught in a sex scandal its up to robert deniro anne heche and dustin hoffman brilliant as the hollywood producer to create a fake war with albania it was very funny to see how the whole scam was planned in the very detail for a great rental i recommend it,black_comedy
this has got to be one of the worst films ive ever paid to see i almost fell asleep watching it  do not watch this rubbish no basic story line and ham acting throughout im sure mr deniro and mr hoffman would like to forget this one one question  why make such meaningless drivel when the performers have done so much better and mrlevinson again why ,black_comedy
this is another one of those movies that people insist is clever and politically astute and isnt the number of big stars in the film doesnt make it any better and quite frankly im ashamed of them for being in it  i say this as a tremendous robert deniro fan this is the type of film that only hollywood elites find clever the types that think everyone between la and new york are a bunch of rubes picking lice off one anothera brief outline of the plot the president is caught in a sex scandal  this film was released in 1997 mind you one of his spin doctorsrobert deniro seeks to save face he enlists the help of a eccentric film directordustin hoffman to produce a fake war they pick an obscure country that most americans have probably never heard of albania the presidents popularity surges the phony war helps bury the scandal and gets him elected  before us rubes find out i dont want to get political well the film tries to so maybe i willlet me start out with one of the tremendous flaws of this film it views clintons airstrikes of iraq as a cover for his sex scandal i need to introduce a big problem with this and how overly concerned with political correctness clinton was he also could have ordered the cia to take out osamba binladen yet cowered to political pressure of the possibility of looking bad for attacking people if he had the same types of people would have levied the same criticism on him not realizing how important it would have beenif you want to say this is revisionist history fine hindsight is 2020 but i hated this film when it was released i felt it was insulting and inaccurate then for other reasons news coverage over the past ten years is rampant cnn reports on deployments of us military everywhere when ever they move wrongly in my opinion the concept of a fake war that the american people will believe just because its on tv is ridiculous the only time the us uses immediate force without debate negotiations un votes congressional votes etc is when its doing so covertly think about the large antiwar build up and protests for the current or second iraq war the makers of this film have to much faith in government and not enough in the common man this very republic was founded on a revolutionary concept elective representation i just have a little more faith in us lice picking the world is flat rubesaside from the political and back to the film to its credit it has two fairly memorable performances dustin hoffman and woody harrelson its a highly watchable film with good dialog and bits of comedy scattered throughout but you can see all the stars in much better films i really think this film is vastly overrated i hope some people will look back and realize that it is i like most of the actors and recommend them highly in other films if youre interested films that are politically astute and deal with real situations instead of pseudo ones i recommend all the presidents mena good hoffman film the candidateslightly dated but still better than this or hotel rawandaa great film,black_comedy
woah woah woah im seeing the term brilliant satire being tossed around in these reviews far too much i think i saw a comparison to dr strangelove i hope kubrick hunts you down and punches you in the facethis was one of the worst movies ive ever seenas for plot it is essentially the same thing as canadian bacon 2 years prior imo infinitely times funnier and smarter than this which is not necessarily a bad thing if it werent so haphazardly thrown togetherthe movie begins a bit in medias res and awkwardly introduces you to the situation and this albanian idea without a single laugh robert di nero who i usually like is clearly just playing a poorly developed caricature of himself dennis hoffman who i love is occasionally good for a chuckle but the whole producer persona and dialogue just gets old boring and unrelatable after the first scene and then theres this who are you anne heche character whos only purpose in the story is to praise di neros character for his brilliance cause hes not actually brilliant o trolololol thats hilarious then these characters who we could not care less about or relate to go on a bunch of farcical adventures which would usually be a dynamite recipe for comedy but again we just dont care about or even understand these characters and their motivations overall this movie might not be the worst satire ever but it certainly is an awful movie  proof that good actors and a good idea cannot make up for a hideous screen play,black_comedy
was really a dog of a film the idea behind the film was amazing and probably sounded pretty flash at an ideas meeting at the studio but the script was pretty thin and the acting was a bit too selfindulgent and not particularly notablesometimes i felt that the plot line was rushed or perhaps they had a vague outline of how the story would play out but filled it in on the gothis wasnt really a comedy either as it lacked lines and scene that made you laugh it was more like an amusing film to those who liked it but ultimately i didnt find it very amusing either after a while it became fairly tediousthe film was well received by those who believe that government spin is so strong that their theories and perception borders on silly and conspiratorial but for everyone else it didnt offer us much,black_comedy
its not that i necessarily disagree with the politics its more that levinsons film is proof that satirical films should be left to people on the fringes of the film industry dont even get me started on hoffman and deniros performances hoffman especially radiates an unbecoming smugness only rivalled by the directors own,black_comedy
the us president has just been exposed in a sex scandal not long before the next election spin doctor conrad brean robert deniro teaming up with hollywood producer stanley motss dustin hoffman to fabricate a war so as to distract the country from the presidents sexual folliesthere are several badly handled leaps in the story and the movie lacked tension the acting is pretty good de niro and hoffman are reliable heche is outstanding and even harrelson is fun to watcha great cast a good story should have been a classic but it isnt the satire in this movie is spot on but the writing just isnt strong enough and the production looks cheap,black_comedy
if youve come across any of my other reviews of barry levinson movies youll know that im not a fan so it probably wont come as a surprise to you that i didnt think much of a good cast  robert de niro dustin hoffman and anne heche are the three principals  is assembled for a vague and unfocused satire on american politics and movie making hoffman received his 7th academy award nomination for playing an eccentric hollywood producer  by most accounts a parody of robert evans  but it feels like an inside joke that the vast majority of the moviegoing audience isnt going to get the movies not funny enough to be successful as a laugh vehicle not sharp enough to be effective as satire and not compelling enough to work in any other waygrade c,black_comedy
log line a hollywood producer a washington spindoctor when they get together they can make you believe anything produced and directed by barry levinson and written by hilary henkin and david mamet this film is best known for its timing by a stroke of luck for the producers and distributors its release coincided with the outbreak of hostilities against saddam following hot on the heels of the revelation of president clintons involvement with monica lewinsky spooky the blurb on the video box reads as follows when the president of the united states is caught in a scandal just two weeks before the election its up to his white house adviser ronnie brean robert de niro to clean up the mess ronnie joins forces with hollywood producer stan moss dustin hoffman to divert the countrys attention from the presidents crime they decide that what is needed to stop the media spotlight is a war but lacking a real war they fake one actresses play pretty refugees and rock stars record stirring hit songs about freedom soon america is rallying round the president but trouble arrives when and rough and tough senator gets wise to the pairs tricks meanwhile election day gets closer and closer very odd its a perfectly reasonable summary until the penultimate sentence having just watched the film i can say without fear of contradiction that there is no rough and tough senator who discovers whats going on was this an alternative plotline that was abandoned this wouldnt surprise me because the last act is rather weak the cia wrecks the war story by announcing an end to the imaginary hostilities but hoffman and de niro undeterred come up with a soldier trapped behind enemy lines its from this point on that the drama flags schuman the imaginary soldier turns out to be a psychotic military prisoner the plane supposedly carrying him home crashes a very odd sequence because one minute theyre flying through a storm and the next our stars are standing apparently unharmed in the middle of the wreckage  i dont think so and then schuman tries to attack a girl at the farm on which they end up the farmer shoots him and the plan has to change again  hell be brought home in a coffin with full military honours then in the end sequence hoffman decides that its all been so successful that he has to have a credit as far as hes concerned this is the greatest thing hes ever produced and he wants everyone to know that he did it  as he points out theres no academy award for producing hes insistent and as he leaves we see de niro indicating to the security men the next thing we see is the tv announcement that hoffman has died from a heart attack at the age of 58 or 62 depending on the buyout nice gag but its not really a satisfying payoff i suspect that the real problem is that lack of a third act the end of act two should really have been the discovery of the truth by that rough and tough senator with act three posing the really big problem of how they get out of that mess as structured here each complication is only ever an act two buildup  the problems change but they dont really advance the plot its like the same joke told in different ways it would be interesting to find out what happened to that elusive senator an afterthought this makes an interesting comparison with primary colours which although less overtly funny and farcical did at least try to make some kind of intellectual engagement with its subject never at any point in is the subject of lying in politics for the greater good ever brought into focus on the video box the times in london is quoted as calling the film a treat bright and intelligent but surely its not ive reached the conclusion that film critics only refer to the intelligence of a film in a direct and inverse proportion to their own knowledge and understanding of the subject in other words the times critic knows nothing about white house politics so to him obviously it appears intelligent or am i just being cynical,black_comedy
it may have been a clever idea but is not a clever movie no matter what its creators think instead its tedious and insulting would that it were not sorobert deniro as a political fixer dustin hoffman as a hollywood producer and anne heche as a ninnyish white house aide create a hoax war to distract the nation from a presidential sex scandal in the runup to election daydespite some snappy dialogue here and there the movie fails because it it cant decide if its a political slapstick like woody allens bananas or a chilling indictment of political system gone wrong like the candidate or bob roberts a vastly better moviethe cast take a variety of approaches to this problem deniro plays confident but never chooses a route hoffman goes slapstick and saves his own skin so does woody harrelson who wisely plays his role as a dangerous convict as if hes in police academy xiv heche appears confused directionless and not up to the taskit looks as if barry levinson wanted to use big names and slapstick to lure in the masses so they would see how they are being manipulated  to expose political fraud for the benefit of the presumably benighted while satirizing it for the amusement of the presumably clever no wonder its a guaranteed box office flop the public doesnt want to be told how idiotic and gullible it is  especially when the perpetrators of the elaborate hoax are shown as such incompetents if hollywood cant make a convincing movie about a fake war how are we supposed to believe it could make a convincing fake warthe reality is that the people running the real show in the us are sometimes scarily competent and they have more resources at their disposal than are shown in this movie as deniros character points out the us invaded grenada less than 24 hours after the disastrous truckbombing in lebanon which more than 200 us marines were killedthey dont throw phony wars  its easier to throw real ones,black_comedy
a film by barry levinson bandits rain man  good morning vietnam has an original concept however fails to deliver the poignant and dynamic effect it should create on the viewerwhen the president of the united states becomes involved in a sex scandal just a week before the election a spin doctor robert de niro is called in to fix the problem he sees that the only way to divert the publics and more importantly the medias attention away from the presidents scandal is to create a fake war however creating an artificial war isnt an easy task so de niros character conrad brean goes about finding a famous hollywood movie producer stanley motss dustin hoffman hoffman and de niro are both brilliant as usual however as the film unfolds the tail becomes more and more unrealistic while the script fails to captivate the viewer and produce the strongly compelling effect which the plot should create all in all is an original quirky well acted and slightly funny film however is nothing brilliant 610,black_comedy
i found this movie to be funny boring confusing sloppy and brilliant its worth seeing but its not a  big deal  i wont think about it every time i watch the news because this could never happen but it is interesting as a movie  woody harrelson was great and hoffman deserved his oscar nomination,black_comedy
the premise of the movie was rather interesting at least it seemed to have a certain potential but the treatment operated by barry levinson it totally disappointingindeed he delivered this story both amusing and highly improbable with no conviction and in a total linearity when it could have been a lot more impacting you never get caught up in the game of those two spin doctors because everything is delivered in a monotone way from start to finish with no variation of tone nor rhythm and the movie therefore appears as absolutely soullessto make things worse the photography is cheap as hell and gives the impression youre watching an old tv movie from the 90s not to mention some doubtful choices regarding cinematographyin the end you can only regret the waste of the two talents that are dustin hoffman and robert de niro in this anecdotal feature,black_comedy
