so i was watching this movie last yeardec 2013 on tv during the xmas season and i had to do a review on it so here it isis a 1995 romantic comedy about a lonely woman named lucysandra bullockwho is unlucky when it comes to love and men as she is working in a booth at a train station in chicago she meets a handsome man called peterpeter gallagher who is taking a train journey and she develops feelings for him as he comes by everyday to get a ticket from her boothbut when two teenagers thrown him off the train stationlucy saves him from a train coming on the train tracks by jumping into the tracks to get him out and he goes to hospitalwhile she is there at the hospital she blurts out and i was gonna marry him and the nurse mistakes her for peters fianc so peters family visit peter at the hospital and from here on in they presume that lucy is peters fiancas peter is in hospital lucy spends some time with his family and later meets peters brother jackplayed by casper star bill pullman but then she starts to fall in love with him and must decide how long will her facade with peter end and which man does she love more jack or peterbottom line i loved while you were sleepingsimilar to the 2009 film the proposal where bullocks margaret made out she was engaged to andrew but later falls in love with him for real i really enjoyed this filmsandra bullock was really good in this movie and her chemistry with bill pullman as jack was so cutei wish i could buy this on dvd but its impossible to get it only online but the next time its on tv i will definitely be recording it on vhsoverall is a thumbs up and a great film to watch at xmas time as its always on tv at xmasalso without giving too much away the ending was so adorable but my only concern is the movie posterits kinda making the film predictable as you know what man she chose in the end judging by the picture but still i loved this moviethey just dont make movies like that anymore only know and again1010ps i finally got it on dvd and i really loved this movie,happy
first of all the main weak point of this movie is an initial notsoconvincing misunderstanding between lucy sandra bullock and the callaghan family and the entire movie is standing on this persistent misunderstanding the callaghan family may be funny but did not necessarily have to be stupid however if this initial weak point can be ignored the rest of the movie is a simple fairy tale told in a charming and lovely way the activities of the callaghan family is hilarious although it seems to be a problem to understand sandra bullocks babbling she mumbles most of the time she is cute in her oversized outfits carrying a lonely bored puzzled cravingforlove type of a disposition it is totally impossible to imagine demi moore in lucys role which was originally written for ms moore bill pullman is irresistibly attractive in the role of jack callaghan bullock and pullman make a real romantic couple pullman has lovely hair and a great smile the ending however has lost its intensity and was not so thoughtfully projected the movie is overall entertaining i rate it 7 out of 10,happy
lucy eleanor moderatz sandra bullock is grownup who works at a train station on christmas day she meets peter callahan peter gallaugher a young man who comes to her window everyday he is unfortunately mugged by robbers and is left unconscious lucy saves him but is caught up in the middle of confusion everyone thinks that lucy and peter are engaged peter meanwhile is in a coma his brother jack bill pullman is wanting to give up the family business a furniture companyeventually lucy tells the godfather of peter saul jack warden who wants to tell the family but is lackluster at it when peter wakes up he doesnt remember lucy they think he has amnesia but he starts naming several things before the accident the alphabet his eighth grade locker combination and the likethis is a chick flick so im not a huge fan avoid it unless you like any of the actorsactressesmy score 510,happy
i thought it was time to see this again after all these years and it is just as fresh and wonderful as it was when it came out like the smell of bread just taken from the oven it is an exhilarating and essentially perfect romantic comedy it comes off so wonderfully because of the central casting of the irresistibly charming sandra bullock whatever she lacks in vogue cover beauty she makes up for in tsunamis of personality who could say no to her all she has to do is just smile or just look at you well bill pullman certainly cant resist her in this film and neither could his family this film is so famous that most people know the story which is the ingenious notion that bullock saves the life of a handsome young man played by peter gallagher who is mugged and falls unconscious onto an overground subway track in front of an oncoming express train in chicago bullocks leaps down rolls over with him and they just make it she goes with him to the hospital but they wont let her follow him in because she is not a family member so she pretends to be his fiance then the story takes place while he is ie in a deep coma where gallaghers family accept him as his fiance and she is in countless comedic situations of having to pretend to know all sorts of things about him in fact she had been in love with him for a long time but they had never really met it is a great idea and it works to absolute perfection there are many many laughs the film was magnificently directed by jon turteltaub which means turtle dove in german just in case you wondered who came from the unlikely background of having previously directed gasp gulp 3 ninjas 1992 believe that if you can this film is the only listed writing credit for daniel g sullivan and fredric lebow what happened to them surely they should have gone on writing stuff of this calibre did a hole in the earth open up and swallow them the story and script are absolutely brilliant bill pullman is also perfectly cast as the brother of gallagher who falls in love with bullock but nobly refrains from doing anything about it jack warden provides heavyweight backup as family friend uncle saul the dotty family are all marvellous everybody is marvellous everything is marvellous the film is marvellous get the picture,happy
despite the opening song number being one of my own personal pet peeves this is one of my favorite films it is a genius parody of the romantic comedy genre that plays with your expectations now this film has almost as many holes as the dark knight rises and more coincidences than the complete works of charles dickens but the likable characters and the spot on comedic timing more than make up for any and all failingsthis film looks at all the tropes and clichs of chick flicks and exploits them for well earned laughs including one of the funniest breakup scenes of all time all the humor lands perfectly and hits its mark the only problem i can find would be the product placement dunkin donuts bringing families together for years america runs on dunkinall in all its an enjoyable film that will play around with your expectations and moves along at a perfect pace this is a film you can just pop in and watch any time you could watch it multiple times in a row without ever getting tired of it the problem though and the reason i believe for the 65 rating is that people go in expecting a straight romantic comedy and see only the films weaker aspects i say take a look,happy
over the year theres been no shortage of romantic comedies occasionally one comes along that stands out as this one did as evidenced by its tremendous box office appeali had never noticed sandra bullock until the film she made just before this one  speed not my type of film really then she followed up with this film and she suddenly was pretty high on my list of favorite actressesthis film is utterly charming without being sweet bullock brings an innocence and sense of being lost to the screen without one feeling sorry for her then through a series of misunderstandings people begin believing she is the fiance of a man in a comaa man she has long had a secret crush on will they get married it seems like the film is heading in that direction until she falls in real love with the brother of the man in the coma one of the most special things about this film in the sense of family even though the family is a bit oddbullock is tremendous here and this may be her best film peter gallagher has a key role here as the man in the coma yet his role is not a strong one bill pullman not a favorite of mine actually has a very good role here and does exceptionally well with it micole mercurio as the mother of the two men is very good as is peter boyle  another actor who was never high on my list glynis johns is a hoot though again shes not one of my favorites and perhaps the best supporting role in the film goes to jack warden  a godfather and friend of the family who becomes bullocks friend as wellif you like romantic comedies youll probably love this film highly recommended with little to criticize,happy
sandra bullock is lucy a somewhat meek unassuming person with a menial job that suits her she sells tokens for the transit system she has fallen in love with a man she never meets but she sees him regularly as he goes to work she would never be brave enough to strike up a conversation with himthe businessman is peter gallagher as peter but one fateful day he falls and lucy sees it she rushes to his rescue to keep him out of harms way later when she goes to the hospital to see how he is doing they wont let her in because she is not a relative so she makes up the story during the heat of the moment that she is his fiancethis strikes all the family members as strange that peter would have a fiance and not have told anyone particularly suspicious was peters brother bill pullman as jackbeing the meek type lucy doesnt reveal the truth and actually goes along with the ruse which works because peter has amnesia from his fall and becomes adjusted to the fact that he is to marry her but jack remains skepticalgallagher and pullman are excellent in their roles but this is mainly a vehicle for bullock a good role and an entertaining moviespoilers peter and lucy get all the way to the altar friends and family in attendance and jack as best man but lucy cant go through with it as she got to know him peter was not someone she could fall in love with however she had in the process fallen in love with jack instead and the feeling was mutual,happy
i had seen this movie quite a few years ago and i didnt remember it very well it was nine oclock and i was bored out of my mind i checked the tv guide and saw that was about to start i sat down and smiled for a whole two hours it may be the cheesiest movie ever but it makes you feel so good and its so sweet of course a movie with bill pullman is pretty much always good  ive always had a little thing for him i dont know quite what it is about him though the only thing i dont get is this ive read all of the 48 reviews on this site and i cant understand why it got such a low rating everyone seemed to enjoy it except one person and it only got a 6610 i would at least give it an 8510 or maybe even a 910 because even though it wasnt the best movie of all times it truly was a feelgreat movie and very recommendable to anyone who enjoys a good romantic movie,happy
this film has to be classed as brilliant  take a normal lonely girl one gorgeous male and add a sweet very cute brother and you get this film  it is a good romantic film for all the family the moral of the story  you may think it is love at first sight but try looking a second time,happy
sighthis is an unabashed for the diehard romatics movie it has all the ingredients of one  the elusive prince charming a hopeless romantic and christmas there have been many similar moviesbed of roses but still wyws holds its own and wins because of some excellent acting witty dialogues and an aura that is so warmmaybe its just christmas sandra bullock is a really beautiful and talented actress her confession in front of the whole family saying that she loves jackbill p and not peterpeter g is really well rendered and bill pullman well the man really doesnt have to do that much hes just simply mind blowing but as usual he does a great job as jack the rest of the supporting cast forming the callaghan family have done a great job but yes the best among the supporting cast would have to be the guy who acted as joe fuscomichael r hes really cute theres just one thing id like to add part of the aura of this movie is the fact that its shot in chicago the city is a lving breathing integral part of the movie and the reason for some of its beautythis movie stands as one of those really heartwarming unadulterated romances that i hope will be made more often with someone like sandra bullock who because shes not soo obviously beautiful as julia roberts is more endearing and humanvery human,happy
so its a trifle predictable  and saccharine  and its the stereotypical chickflick  but is charming and cute not deep but enjoyable none the less  sandra bullock and bill pullman have such a natural onscreen chemistry it seamlessly moves the story along  ive made it a tradition to watch exactly once every year during christmas just to remind myself that sure it may be just hollywood fluff but true love isnt always just a metaphor sigh,happy
this is the first review ive ever done on this site but after reading some of the comments i would like to add mine too there was nothing worth watching on the box this evening so i dug out my copy of wyws and settled down on the sofa although i know this film pretty well having watched it a few times it never fails to give me a wonderful warm glow although peter is a handsome guy the chemistry between lucy and jack is without doubt very real and the two characters play their roles brilliantly there are so many quirky one liners in this film and the family scenes are well scripted and well acted how i wish i could be adopted by a family like that even if it were only for the holiday season if youre an old romantic like me and hey im not that old lol give this a try ive given it a 10 because there isnt anything to dislike,happy
i remember a few years agomy dad telling me that he was going to trade in what looked to be a romantic comedy the was in a very mucky bigbox exrental casepartly due to how nasty the case lookedi said to him the that was finejumping a few years forwardandi am searching on amazon for fun looking romantic comediesthat are being sold cheaply on dvdwhen i got to the end of one of the many pagesi suddenly spotted this film among them alli feltthatsince i had missed seeing it on my first chance toplus the fact that it had two very good lead actorsand a pretty good directorthe it was worth giving the film a shotthe plota longtime working subway worker called lucyhas a crush on a very pleasantlooking commuter peterthough she is sadly unable to get the confidence to go and chat to himone daywhilst he is waiting for his train to arrivehe gets mugged on the platform by a gangwho push him on to the rail lineluckaly for peterlucy is working there and she is able to bravely get him off the railway track alivewhen peter is taken to hospitalit is revealed to lucy that peter is now in a comawhen his family arrivethey are all understandablevery upsetbut are all really hopeful that he will come out of the comawith lucy having been extremely sad since taking peter to the hospitalthe family ask thatdue to how sad she has beenif she is engaged to himwith wanting to give the family something that can hopeful make them smile for a little bitshe decides to say that she is engaged to himthought as she gets to know the family morelucy stars developing feelings for peters very sweet brotherjacksadly for lucyquestions are about to be askedwhen peter wakes up from his comaview on the filmthe main thing that i feel made the film a lot more enjoyable than i was thinking it would bewere the great performances from sandra bullockandthe very underrated bill pullmaneach of the actors make their friendshiprelationship feel very charming and they have some very natural chemistry in all the scenes that they are inwhen looking at the supporting castit has to be said that the people the play peter and jacks familygive the film a huge warming heartsthat even warms up the very chilly chicagothat director joe turteltaub hassmartly chosen for the look of the filmwriters daniel gsullivan and fredrick lebow wisely decide to not make the story into a grim tvmovieoftheweekbut insteadto give it a very innocent feelthe only downside with the screenplayis that the ending is just a little bit too rushedwhich makes the last 15 minutes of the film feel like it is trying to fit into cindellas slipperfinal view on the filma engaging romantic comedywith a wellwritten screenplay and charming performances from the whole cast,happy
i have often wondered why bill pullman didnt become a bigger star than he is hes played the romantic interest in a few films starring opposite two of the romcom queens  meg ryan and sandra bullock he was even great in independence day and he is great in this film too with enough charm and likability for viewers to understand why it is lucy falls in love with his character sandra bullock does well in her role too its not an outstanding performance but as an actress and person she is so likable that really all that matters is that shes cute and easy to watch on screen recommended for anyone who enjoys romantic comedies,happy
absolutely loved this movie have always been a fan of sandra bullock and went out and bought this film with relatively low expectations i was watching it thinking this is the best fun ive had watching a movie in a long long time all throughout i could not wipe the giant grin on my face i found it very very funny at points and as i say again one of the best feel good films ive seen in a long long time very well acted by all that were involved especially sandra bullock and bill pullman at the ending of the film i almost shed a tear with happiness i would recommend this film to anyone who is feeling down in the dumps as it is a perfect pick me up and can be watched over and over and over again,happy
the genre of romantic comedies may not be a genre producing depthful insights dramatic acting or meaningful moralsbut it centers about the two most warm and nice emotions humour and love there cant be nothing wrong with this now many movies of this genre are just what you expect they are cheesy diabetesinducing sweet shallow movies sometimes the humour outweighs the love so much it becomes intolerable sometimes the love aspect is so heavy you are forced to vomit then many movies make the mistake of mixing love with lust or even replacing them that does not go for romantic in my opinion so the moviegoer is left with only a few notable movies which make your heart glow there are pretty woman notting hill when harry met sally sleepless in seattle you got mail theres something about mary and of course while you were sleepingunlike some others in my listing this movie sets his characters in a real normal life they are all average people who could live next your door thats one point in making this movie memorable because if such a sweet love can happen to those guys it can happen to you as wellthe story may seem to be a bit far fetched girl saves guy gets mistaken for his fianc family invites her over for christmas she falls in love with the brother and so on but it is not as far fetched as a millionaire falling for a prostitute a journalist falling for just a boys story and drives through the us to seattle or a movie star just walking in a normal bookstorethe humour is great soft and loving instead of cynical the only cynical remark if you fit in my pants ill kill myself is like you are kidding around with your friends the love is also sweet it never becomes sexual or lustladen just pure love unlike all the aforementioned movies here another love is playing a role the love for and of a family anyone who like bullocks character has lived without any family for some time knows what i speak ofthe acting is good not great as i said i dont expect that in a romantic comedy but better than in most other movies of that genre and many other genres as wellthe last great point for this movie are the characters the movie makes no point in creating a despicable mean character the family callaghan are so nice and warm even peter who the viewer gets to know only a lot later in the movie seems to be able to leave his playboy life and settle with sandra bullock also heartwarming is the role of joey fusco he seems to really love sandra bullock in his own way he tries to protect her and be a real friend though he is obviously not her type even the real fianc of peter callaghan ashley does not come evil just shallow and possessive her appearance lasts only a few minutes tooall in all if youre looking for a great movie to make you feel good get this one,happy
even though im not the biggest fan of romantic comedies i do like to watch one occasionally as long as they are at least somewhat original  which sometimes seems harder to find than you would like to believe  i really can have a good time with them but for some reason i feared that this movie wouldnt belong to that category and thats why it took me almost ten years to finally watch it now that i did i know that i shouldnt have waited that longlucy is already in love with peter for a very long time the only problem is that she has never really spoken to him and that he probably doesnt even know of her existence hes a commuter to who she sells a ticket for the metro every day when on christmas day hes attacked by some muggers he falls on the rails and lies there unconscious lucy doesnt hesitate but immediately goes after him and saves him from the oncoming train then he goes into a coma and is transported to hospital and thats where all the problems start the hospital staff confuses her for his fiance which they also tell to his family they immediately welcome her into the family and lucy who isnt used to so much family happiness and warmth isnt able to tell them that she and peter havent got a relationship to make things even more complicated for her peters brother falls in love with her and when peter himself wakes up he too believes that she is his fianceeven though the story feels a bit like all other romantic comedies i must say that i like the new approach of a man in coma as the subject of affection even though he plays a very important role in this movie his performance only consists of lying there with his eyes closed and somehow that feels more ok than seeing yet another clumsy guy who is able to win the heart of the woman of his dreams but not only the story is ok so is the acting sandra bullock jack warden bill pullman were nice to watch and even though peter gallagher didnt really have a difficult part he too did a good jobi guess the only problem that i had with this movie was that it was situated during christmas time while i saw it in the beginning of september im not saying that i wasnt able to get completely involved in it but somehow it felt a bit weird to see snow and to see them decorate the christmas tree thats also the reason why i believe that this is a perfect movie to play in that time period instead of the christmas classic the sound of music youre already completely in the right mood then and im sure that such a movie would only add to that perfect feeling of family happiness but than again its not that you cant watch this movie on another day eitherall in all this is one of the better romantic comedies that ive seen lately i had some good laughs with it the romance was a bit weird but believable the acting was good and the story original what more can you expect from such a movie not much if you ask me and thats why i give it a welldeserved 710,happy
sandra bullocks   follows in the tradition of the classic romantic comedies of the 30s  40s and 50s with a enough modern elements to make you believe this story could really happen old fashioned romance is played out in more than one way when you see not only the dynamics of lucys crush from afar but with the family who adopts her for the holidays instead of focusing on who will win in the love triangle for the entire film the viewer gets to enjoy the give and take between the other family members and the chemistry that attracts lucy to them even though she knows she is living a lie even the smaller supporting characters are pillars in the plot development and take you on twists and turns as to who ends up with who in the end  a great film that drives home the point that you dont just date a person  you date a family with all of its quirks and qualities that will determine your entire happily ever after,happy
clearly one of our familys favorite comedies incredible acting so many memorable lines worth retelling my only complaint about this movie is directed against the studio that made it how could they possibly release this movie on dvd and not add one speck of additional information im dieing to know how many takes the john wayne dinner discussion took id love to see outtakes from some of those scenes where is the fulllength commentary by bullock pullman or others please please give us a special edition dvd of this incredible film,happy
this movie is simply the bestsandra bullock rocks in her role and all the others from bill pullmanwho makes great chemistry with sandrato peter gallagher rockand it is not only thatthis movie makes you heart warm and puts a smile on your face for the rest of the dayafter seeing the movie life will seem much better,happy
