susan cooper melissa mccarthy is a deskbound cia analyst with 10 years of service who has been integral in assisting cia fieldagent bradley fine jude law in completing his missions by being the voice in his ear when fine fails to complete the mission and with all other fieldagents already being compromised cooper volunteers to go out into the field to track down rayna boyanov rose byrne and prevent her from selling a nuclear weapon to a group of terroristsgiven the fact that this is intended as a spoof of films i presumed that the forerunning theme would be to send an agent out into the field who is clumsy and incompetent and yet they believe in their own mind that they are brilliant  this worked well in johnny english and get smart the problem here is that susan cooper is neither incompetent in her deskbound job and nor is she incompetent in the field this approach doesnt serve the film well and at times it feels too much like youre watching a regular film than a so called spoof of a filmanother issue i had with this film was the decision for cooper to not have a partner for large portions of the film i always feel that spoofs thrive better when there are two very different people thrown together to complete a mission  this creates a dynamic and camaraderie and having two conflicting personalities at each other throats will more often than not make a film of this nature much funnier statham plays rogue agent rick ford who is effectively the thorn in coopers side but he isnt permanently partnered with her and i found that he seemed to drift in and out of the story willynilly this is a shame as writer and director paul feig set both characters up perfectly but for some reason chose to keep them separate for the majority of the film the reason i say its a pity is that i thought stathams character was funny  his bs stories become increasingly ridiculous and exaggerated and i found it very hard not to laugh at his rather tall stories the only slight problem i had with his character is that hes only shown as being incompetent now and again rather than being totally incompetent meaning there was no real consistency with his characteras ive mentioned the biggest mistake that was made here was the decision not to have cooper and ford working as partners which is what ultimately weakened the film feig does partner cooper up with artingstall miranda hartlater in the film but hart doesnt have the amusing material that statham had to work with which meant that hart  mccarthys scenes were nowhere near as funny as statham and mccarthysthe plot is fairly generic which wouldnt be a problem if the film was actually funny but most of the funny moments were between statham and mccarthy but again they werent on screen together often enough which is why the picture was short on laughs in fact the first laugh i got from this film was when statham first showed up on screen which just goes to show that he should have been used morethe performances were all very good jude law seemed to have fun being a james bond type character melissa mccarthys energy and enthusiasm is infectious and probably makes the film more tolerable than it should be after seeing rose byrne play many nice and likable characters i was unsure how good she would be playing the super bitch but shes excellent and she looks pretty good in this film too after years of playing serious tough guy type roles it was good to see statham sending himself up and he looked like he was having fun herethe film works quite well when statham and mccarthy are sharing the screen together and i could see that they shared a quirky and rather interesting dynamic however feigs decision to not have them working together throughout the film was a big mistake the result of this miscalculated risk is a generally humourless film that is saved from the doldrums mainly thanks to great performances from the main players and jason statham who managed to generate a laugh from me in nearly every scene that he featured in,comedy
ridiculous that some give this 110 i guess everyone is entitled to their opinion it is a very funny movie very entertaining and well made probably melissa mccarthys best comedy plenty of laughs comedies are meant to be funny and this film certainly is not sure why others would rate it so poorly but really doesnt make any difference pity for them have seen this several times now in fact watching it right now with my wife stumbled upon it again while flicking through the channels on tv and it still makes us laugh a lot dont listen to the haters great movie hope they make a sequel,comedy
what begins as get smart for women swiftly becomes something much much more by the time the end credits have rolled quite possibly one of the funniest entries in the genre this is coming out in a year where there have been too many releases in the same genre and though this is supposed to be played for laughs it makes a perfect companionpiece to mathew vaughns kingsman going all the way rrated as well melissa mccarthy has definitely found her niche playing her comedic role completely straight ensuring that we not just laugh at her character but also empathize with her completely not an easy feat to pull off for anyone especially given the conventional definitions of beauty and heroism that abound all over us not to mention the mainstream movie realm that glorifies and revels in the conventional definition of beauty miranda hart is also the perfect voicetheear foil to mccarthys field agent and their chemistry evokes the numbers of years that they may have known one another been each others friends from as simple an exchange like in a bar along with the gorgeous morena baccharins character surprisingly even the onthesurface thinlywritten roles for the likes of rose byrne and bobby canavale ultimately turn out to have more meatondabones than initially surmised jude law looks weird but does a good job with what he has i thought his characterization would be the surprise package but that honor actually went to someone else jason statham playing the straightlunaticsuperstupidto melissa mccarthys wouldhave beenbumbling but is actually an antithesis to the suave superis in his element and owns every scene hes in his characterization his delivery of the lines written for him are pitchperfect and justifiably evoke maximum laughspeter serafinowicz since his intro to the end maybe especially at the end is a hoot or am ithe q scene is a hoot and q himself perfectly cast michael mcdonald absolutely fantastic in his 1 scene as he was in the hilarious web therapyone more point of note in other spoof movies with spoof being the singular objective a character like stathams would not have been included even within the writing stage it is a testament to the strong writing and stellar execution paul feig  bridesmaids the heat ghostbusters that they incorporate this and several other touches that elevate this higher than many other works in this subgenre all the technical departments support the main narrative with score cinematography setproduct design and location work along with the action choreography complementing the core of the screenplay however not all the cgi sticks and this is the same problem both get smart and feigs the heat both have though not to the extent that most of mainstream hollywoods action movies have i understand the going digital is cheaper but it doesnt have to look cheap in this movie though as in get smart or feigs the heat thats a minor nit to pick since the overall content more than makes up for itanother scene worth a mention allison janneys a great addition to any ensemble here playing the equivalent of m disdainful refrain womena whole lotta fun at the movies worth repeat viewings sit thru the endcredits for a whole lotta funny mission briefs for either the interval between sequels or hopefully more material for future sequels kinda like what 22 jump street had going for it,comedy
middleschool humor with a lot of sexual innuendos double entendres uncomfortable situations and outrageous puns but it was excellent if you cant lol at what made you lol when you were a teen then im sorry to tell you but you have grown up into a boringas adult people who are offended by excessive swear words choose to be offended maybe you prefer jokes written for five year olds good clean fun only for you stupid prudes the plot of this movie is fairly simple following cia agent susan coopers journey across europe in an attempt to stop the sale of a nuclear bomb it is a parody so of course it uses all the movie clichs the fight scenes are brutal as is most of the violence hello awesome that is what actually goes down in most movies and i appreciated that they kept that aspect of the genre there are two fight scenes in particular that had me exclaim holy f every actor seemed to hit the right notes with their timing and delivery even some of the minor characters like anton or colinfrederick i was never a fan of melissa mccarthy but she was excellent here and won me over i will definitely be looking forward to more paul feig movies although i will keep my expectations low for the new ghostbusters movie as i feel it wont live up to the original unless the plot is fresh,comedy
susan melissa mccarthy is an administrative stuck behind the desk as support for another jude law until the plot puts her into the field jason statham is her coworker who resigns his position because he doesnt think she can do the job rose byrne is great as the femme fatale who is annoyed by everything around her madness ensues its a comedy so take that into account when the movie seems unrealistic i wrote this only because of the really bad reviews i saw ive seen plenty worse movies melissa rose and jason are all pretty funny its not perfect and it could have been made much better but i liked it,comedy
id be lying if i said i was ever expecting anything from this spoof  due to a combination of its marketing the behindthelens talent and even an overall lack of enthusiasm of its pastiche prospects since most in that particular subgenre are indeed subpar id also be lying if i said i wasnt pleasantly surprised by 2015 though because while its predictable and predictably clichd in both its narrative and overall execution the feature is actually rather entertaining and even sort of endearing in its own albeit slightly neutered and kind of cringeinducing way its not particularly funny though there are some jokes that land amidst the many that dont and theres a narrative element that takes a certain character and their arc in an annoying direction one that actually goes so far in that specific direction it almost runs counter to itself but theres plenty to like here your mileage will vary though depending greatly on how empathetic you find the characters and how funny you find the humour 610,comedy
trailer looked exciting i like mccarthy but i like statham more he made the movie worth watching there are instances where you can loose your instances but mccarthy and stathams comedy chops will keep you going just bear with some of the clichs there are ups and downs the twist im sure people saw it coming but was funny none the less,comedy
its pretty difficult to perfect the art of parody the glorious comedies of the era crafted by mel brooks are long gone and i doubt that any kind of renaissance is ever going to come back any time soon clichs already have destroyed any shred of originality it probably has left pair that with one of the most despised actresses in the cinema game so far and you may have a recipe for quite the disaster what was given instead was a well rounded fun romp of a adventure that has just enough melissa mccarthy that doesnt causes a great deal of stress for those who only like her in little treats like this also jason bloody stathem steals this film by becoming the best parody of himself since his role in the expendables series really the film is not only a good parody but its just a good movie in general i may not have enjoyed tammy but i am certain that mccarthys star quality that many actors these days dont muster up this here is mccarthys best movie and id be happy if this was the last movie she does for a while and others will probably agreethe clichs that plague the film are far too easy to spot you know the superis gonna betray our heroine spoiler alert you know the hero and the villain try to make up and be friends like in the interview spoiler alert you know that jason bloody stathem is going to screw this up despite all of his badass boasts spoiler alert honestly if youre surprised about any of these spoilers then you really need to see more movies because it gets really bad with it herethat is however up until the 3rd act when becomes a truly fantastic film the plot starts to straighten and a couple plot twists are thrown in to give the movie a kind of unique spice the final twist being a pleasant surprise and the ending was making me laugh like a hyena mostly involving mccarthys character jason bloody stathem also 50 cent piece is in this film and hes actually far more tolerable than his real life counterpartyes curtis 50 cent piece jackson is actually a surprisingly funny asset to the movie at first it feels like a onetime joke but its soon revealed that he ends up aiding the good guys in the most 50 cent way imaginable solidifying to us all that the rap genre is now the most parodied thing in our cultures recent memoryits a fun movie that has a lot of bumps at the start but that road smooths out near the end and ends up with a bang a big bloody bald british bang see it if you havent yet4 stars aranking,comedy
unaccompanied minors director paul feig has been grooming plussized actress melissa mccarthy for the big time since he cast her as the loquacious scenestealing puppynapper in bridesmaids meantime when she isnt costarring in her primetime cbstv series mike and molly mccarthy has been landing bigger roles she was hilarious in identity thief with jason bateman and she held her own with superstar sandra bullock in feigs female police partner yarn the heat in those movies mccarthy proved beyond a shadow of a doubt that she had usda approved comedic chops nevertheless she has confined herself to playing second fiddle roles like those reserved for hangover star zach galifianakis indeed mccarthy amounts to a female equivalent of galifianakis although it was a stab at stardom tammy found mccarthy confining herself to a similar galifianakis role except her name appeared above the title if anybody doubted the stout stars ability to shuffle off her comedic coil and play it straight they need only observe her in the superlative bill murray arthouse comedy st vincent where she restrained herself and shined all the brighter for her discretionary efforts now in feigs sixth film mccarthy has finally arrived watching is like watching the evolution of cinematic comedy if this audacious but formulaic espionage spoof doesnt solidify mccarthys status as the first fat lady of laughter nothing will think about it has hollywood ever given a big gal a shot at superstardom she is the whole show not the sidekick or the scene stealer represents the zenith of mccarthys career as a leading lady mind you she is still a big gal but from now on she will be the big gal and everybody will be strumming second fiddle to heras fortysomething deskbound cia analyst susan cooper mccarthy toils tirelessly without recognition from a vermininfested basement in langley virginia she makes it possible for one of the top field agents bradley fine jude law of cold mountain to survive perils galore in a snappy opening shootem up sequence set in faraway bulgaria the debonair fine decked out like a dapper james bond dodges an army of gunmen while he searches for a dastardly villain who has stolen a tactical nuclear bomb cooper serves as fines liaison communicating via satellite by means of hightech surveillance equipment consisting of an earpiece and a tiny contact lens camera that fine sports susan provides him with deathdefying reconnaissance she warns him where his adversaries lurk charts evasion routes and feeds him on the spot information about anything he encounters during a mission together nobody can thwart them not surprisingly susan has an obvious crush on her attractive colleague eventually bradley confronts his chief adversary eastern european arms dealer tihomir boyanov raad rawi of traitor and threatens to shoot him refusing to reveal the whereabouts of the nuke boyanov calls bradleys bluff unfortunately for boyanov bradley suffers an attack of hay fever that makes him sneeze so that he accidentally shoots tihomir in the head later bradley renews his hunt this time he pursues boyanovs haughty daughter rayna rose byrne of bridesmaids but she gets the drop on bradley and kills him naturally susan has a ringside seat for this startling occasion and watches in disbelief as rayna murders bradleypredictably susans superior cia deputy director elaine crocker allison janney of juno finds herself in a fix because the opposition knows the identities of her surviving field agents this doesnt deter brash loudmouthed rick ford jason statham of the transporter movies from demanding that crocker assign him to the case with a different face mistakenly ford believes the cia possesses a miracle machine that enables agents to change their faces like john travolta did in the 1997 john woo extravaganza faceoff so he can save the day livid that everybody has lied to him about such a gizmo ford storms out and crocker decides reluctantly to send susan out into the field to follow rayna and locate the bomb susan is dying to play but crocker saddles her with a variety of unflattering aliases that take advantage of her frumpy figure nevertheless despite these derisive disguises susan embarks on a european outing that takes her from paris to rome and finally to budapest not only does she manage to track down the wicked rayna but she also fools her into believing she has gone rogue later she finds an elusive al qaedaoriented terrorist sergio de luca bobby cannavale of snakes on a plane who wants to blow up new york city with the nuke along the way susan runs afoul of ford he claims he is shadowing her to save her life but she winds up saving his life the best fight scene in has susan contending with an indestructible female adversary kia nargis fakhri who doesnt flinch even after our heroine shoves a knife through one of her hands susan winds up commandeering motor scooters cars jets and a helicopter to preserve civilization from the enemyundoubtedly brawny action star jason statham delivers the second best performance nothing prevents him from ridiculing his own tough guy persona with a heretofore unbelievable sense of abandon statham is shameless as mccarthys egotistical counterpart nothing in stathams cinematic resume will prepare you for his madcap antics indeed this is the farthest afield the buzzcut british actor has gone with his image especially after his wicked villainy in furious 7 as susans cia basement colleague nancy b artingstall british actress miranda hart of the call the midwife television series knows how to steal scenes too basically nobody gives a bad performance in this exhilarating action comedy furthermore writer  director paul feig doesnt pull any punches characters get their heads blown off in halos of blood and politically incorrect laughs ensue feig stages several bulletriddled shootouts and mccarthy gets to beat the stuffing out of several robust ruffians altogether qualifies as a riotous saga with mccarthy dominating the shenanigans,comedy
review i really enjoyed this movie i laughed all the way through this far fetched comedy and the mixture of top class actors gave it the shock factor the funny script and impressive action scenes were great and it was good to see the funny side of jason statham melissa mccarthy plays a desk bound cia employee susan cooper who guides her partner bradley fine jude law through his various missions and secretly has a crush on him whilst on a mission to retrieve a nuclear bomb from tihomir boyanov he accidentally kills him without getting the bombs location the only other person who might know the bombs location is boyanovs daughter rayna rose byrne so fine goes to her house to try and gather some information on his entry rayna kills him while susan is watching and she tells susan that she knows the identities of all of the agents susan then volunteers to become a field agent so she can takedown rayna and revenge fine so her boss elaine crocker allison janney agrees on her terms as long as she doesnt have any contact with rayna one of the other agents rick ford jason statham is disgusted with elaines decision to put susan in the field and he quits his job and leaves the agency susan is then sent to paris to on sergio de luca bobby cannavale and she bumps into ford who has turned rogue and has no faith in susan completing the mission the next day susan sees an assassin exchanging fords bag with a bomb so she tells ford about the exchange and then she takes chase against the assassin who she kills by pushing him off a balcony susan then follows de luca to rome and she meets her contact aldo peter serafinowicz whose and italian agent working for the same agency she then follows de luca to a casino but shes not allowed to get near him so she goes to the bar were she sees a man put drugs into raynas drink she decides to tell rayna about the drugs which saves her life so rayna recruits susan as her bodyguard they then fly to budapest were another assassin tries to kill rayna on the plane but susan saves her life again and safely lands the plane rayna is convinced that susan is a cia agent so susan tells her that her father hired her to protect her in budapest nancy artingstall miranda hart is sent to keep an eye on susan and another assassin tries to kill rayna so nancy takes rayna to safety while susan chases the assassins who turn out to be the cia double agents working for rayna later that night they go to a party were rayna is due to meet up with de lucas associate lia nargis fakhri so nancy creates a diversion so susan can stop the meeting after chasing down lia susan ends up in a fight with her in the kitchen and her life is saved by fine who faked his death so he can become raynas lover susan is then imprisoned with aldo in a bunker were fine tells her that he really faked his death so he can get to the nuclear bomb susan and aldo manage to break out of the bunker and they go to de lucas mansion were they are selling the bomb for diamonds susan poses as a double agent and when the bomb is revealed de luca kills the buyer and his men and threatens to kill rayna but ford appears which distracts de luca so susan can save raynas life again de luca then escapes with the bomb and the diamonds in a helicopter so susan takes chase and hangs on to the landing gear with ford hanging on to her nancy and aldo arrive in another helicopter and shoot de luca but he isnt dead and he hangs onto susans necklace which was given to her by fine so she unhooks the necklace and de luca falls to his death elaine then arrives to retrieve the bomb and rayna is arrested realising that she has found a friend in susan elaine then appoints susan as an agent and gives her files for her next mission the director really did spend his budget well because he was able to get some top class actors film in different countries and have some impressive action scenes whilst still making the storyline witty and air tight jude law proves that he should be a candidate to play bond and jason statham shows that he can play comedic roles so like tom cruise in tropic thunder i hope he stars in more movies in this genre anyway i really enjoyed this movie the first time round but i doubt that it will have the same affect the second time round enjoyableroundup melissa mccarthy 45 has really proved that you dont have to have the perfect body and dashing looks to become an action hero with this movie i was impressed with her fighting skills even though it was most probably a body double and her unique comedy style really worked well in this film since her big break in 2011 in bridesmaids her movies have nearly grossed a billion dollars which is quite impressive for a late bloomer anyway this movie was written and directed by paul feig 53 who also brought you bridesmaids and the heat which also starred melissa mccarthy she seems to be his lucky charm i hope they bring out a sequel to this movie with the same characters because it has a great mixture of agents who all brought something fresh to this projectbudget 65million worldwide gross 2356millioni recommend this movie to people who are into their action crime comedies starring melissa mccarthy jude law rose byrne jason statham bobby cannavale raad rawi jessica chaffin and 50 cent 710,comedy
the film is so amusing and i feel like its really worth it i spent two hours in a very pleasant way melissa mccarthy is so talented and she proves it for one more time she is unique in making everything look funny if you are a fan of her she wont disappoint you she gives what you expect from herrose byrne is really good in this film toothe film combines elements of a good film with a neat plot and a wonderful female comedian in the leading role surrounded by nice actorsit would be great to watch a sequel,comedy
