my girlfriend and i took advantage of the kfc special with ice cream and entre and salad and had a great time watching melissa is so good and talented and jason is a real man mmmmm delicious,comedy
you want lame you got ityet another oneliner laden supposed action supposed comedy why is it needed why to fulfill release quotas of course and either deliver quarterly revenue targets or tax write off accounting line itemshere again we have a complete nincompoop ignoramus incompetent fool who is neither funny nor action packed deployed to the film by domestic american spooks yes it is xxx xander all over again except where xander was a tattooed trash this one features a flatulence fanatic in love with herself no wonder russia rules and is winning and has captured the executive and half of the legislative branchdumb movies like this result in a country where the president praises the country that financed the 911 hijackers and gave us bin laden and attacks the general who lead the mission to kill bin laden or embargoes iran which fought on the ground to defeat isisi have nothing more to add,comedy
kingsman the secret service started a beautiful new wave of james bond satire films its been done before but never quite as meta as it was in kingsman actively referencing how similar the plot and archetypes are to james bond while still having a refreshing novelty factor and interesting characters of its own  creating this whole new world for the overthetop james bondesque adventures to take place while the real james bond canon continues its serious grounded story arc while kingsman was about setting up this elite organization and showing off their penchant for ridiculously elaborate action sequences has little exposition and throws you right into this hysterical world where jude law is the super suave secret agent and melissa mccarthy acts as his eyes and ears back at headquarters jason statham comes in later as a rogue agent who is as arrogant as he is oblivious the movie doesnt itself seriously but it never goes into parody territory these characters as overblown and ridiculous as they are still have relatable personalities and youre willing to go on this crazy adventure with them right from the start is very much an action comedy  whether you view it more as an action movie or as a comedy is completely up to you i found it hilarious within the first minute and was laughing heartily throughout the entire movie but theres no denying that the action sequences are incredibly well done specifically the fight between susan cooper mccarthy and a female assassin in a kitchen the opening sequence of cooper alerting bradley fine law where enemies are while fine sweeps them up in a rat maze full of baddies and the scene with the car where cooper mops the floor with a handful of terrorists with little to no effort if you arent laughing at the jokes you can laugh at how insane and overthetop the action is  either way its an incredibly fun timewhat i find most compelling about is how likable each character is its not just mccarthy law and statham with a bunch of stoic supporting characters no even the supporting characters are hilarious and interesting miranda hart plays coopers goofy friend who does dumb things with the best of intentions rose byrne plays the villainous daughter of a rich terrorist and has some excellent backandforth bickering with mccarthy and peter serafinowicz plays aldo a sleazy frenchman who absolutely loves women and especially their boobs they all have moments of hilarity even the main antagonist played by bobby cannavale who is supposed to be a classy businessman has quirky oneliners and the funniest villain run ive seen in recent memory oh and 50 cent is in it playing 50 cent yeah its as crazy as it soundsas far as lead performances go this is the funniest melissa mccarthy has ever been this is the ideal role for her because her character has a serious job and a serious mission juxtaposed with mccarthys snarky personality and usual shenanigans making for some truly hysterical situations jason statham however is the real highlight here the man is brilliant in this role hes a toughguy agent that goes around bragging about how badass he is and goes on to do the stupidest things ever while still keeping a straight face and menacing persona  essentially a parody of his usual roles his rants are comedy gold simply because its statham doing them he proves here that hes not only one of the greatest action stars working today but also one of the funniest the fact that he even agreed to this movie says a lot about stathams attitude  hes a great sport and isnt afraid to make fun of himself and i really hope this earns him more comedic roles in the futurewas everything i wanted it to be and more i laughed harder at this movie than i did at most comedies in the past decade the production value was fantastic the pacing was perfect and director paul feig clearly knows how to do comedy but now can add action to his resume everything about this movie works it also allows james bond to continue its serious endeavors kingsman to handle the classy yet gritty side of secret agents while focuses on the campy and silly nature of the whole affair i sincerely hope this gets a franchise because there are too many great things happening for it not to get a sequel on its own however is an absolutely brilliant perfectly casted satire that should not be missed by fans of action comedy or fun,comedy
much as people want to watch their scifi dumbed down in the form of michael bays transformers it seems that the modern cinema going audience at least in america anyhow are content with paul feigs fecal offerings im astonished to see this movie running at 7210 at the time im typing thisi can only assume that movie is made for twenty and thirty somethings who have failed to grow up are generally sheltered from life and are intellectually limited i thought bridesmaids was bad enough by it seems that feig has gone full out on seth macfarlanes vulgarity style but with even less subtlety than macfarlane himselfwatching this you think youre in for an entertaining james bond spoof sure enough the first five minutes sets that up nicely it what follows is a disgrace in short this has the potential to be entertaining but it is ruined by a constant barrage of vulgarity the thing is that unlike movies of the past that have had vulgar elements in them say blazing saddles the vulgarity is delivered without comic timing and without any level of subtlety quite simply we see things like the normally wonderful alison janney saying the f word constantly and then hear her utter words like thunderc and were told its funny because hey its a swear word this goes on throughout the picture from the initial scene with statham to a plane exchange between mccarthy and rose byrne where the f word is literally uttered in every possible sentence im not a prude i swear like a trooper and potty humour is funny to me most of the time but when it gets to the gratuitous and unsubtle extent to which the film presents it i feel that my intelligence is being insultedthen there are it seems the other requisite elements to american comedies these days namely fart poo vomit and sex jokes the whole scene with the faked erect penis which we needed to see not just once but at least five times for it to be clear to us that we are meant to laugh just made my cringe like i have never cringed before then you have vermin crapping on a chocolate cakebecause har har har isnt it funny to see a background character eat a fecal laden treat when not being vulgar the picture goes to every length to denigrate the appearance of mccarthy and miranda hart with routine jokes about how they arent that attractive or how mccarthys weight is a reason for her characters undesirable place on the social and professional ladder to think that feig has the audacity to claim he makes these films to support women and that anyone who disagrees is a sexist unrealif you could get rid of the above then there is the bones of a half decent comedy there are still a few funny scenes most of which dont rely on the shock and vulgarity factor but it seems that feig cant help himself and just cant take a measured approach i shudder to think what he will do to a beloved property like ghostbusters slimer with a rubber dick and poo jokes no doubt well based on his offerings so far i wont be going to see it but the real tragedy here is the amount of cinemagoers who now seem to think this one brain cell trite is fine entertainment it is ultimately not the likes of feig or michael bay who are the death of intelligent creative movies its the morons who line up to lap it upand frankly they should be ashamed,comedy
i just watched the first half of this movie on recommendationit is just dreadful its a long string of expletives unfunny situations and terrible acting you know when the movies has lost it when the dialogue is just insults expletives and nothing elsei would certainly not recommend this title to anyone and putting it in the comedy genre is doubtful to say the least there is very little storyline basically a copy of true lies which was a far better movie and it fails on all scoresthe level of this movie is best summarised by one of the scenes showing pictures of an erect penis from a recovered camera hilarious for a sniggering teen possibly,comedy
after fife minutes watching it was clear to me that this is jet another failed attempt to create something of a british action comedy dont get me wrong all the necessary ingredients for a good movie where there great actors great music great camerawork and even a decent storyline nothing really new but hey  this is hollywood  if you cant think of a new story just recycle some old ones over and over again american scriptwriters never get tired telling the rest of the world how stupid we are my greatest disappointment were not the infantile dialogues the ever extensive use of the fword you really have that covered and the sexual innuendos you should really practice it more and talk less about it  it was the actors namely jude law and jason statham dear mr law and mr statham you should really stand above such bad filmmaking dear filmmakers you had so many good starting points to make a entertaining film  but you did what you always do everything over the top take a hint and watch some european genremovies they will teach you how to do it,comedy
yawn yawn yawnsitting through the vulgar language and bad acting in this move made the 150 i paid seem like too much moneymelissa mccarthy can be a funny talented actor but she seems to have to resort in playing parts where she uses extremely vulgar language making her look untalented seamy and stupid the inane vapid humor in this horribly scripted movie filled with obscene vulgar language actually made me angrydont waste a minute of your time or a penny of your money on this bad movie,comedy
really the frontal anatomy reveals and extreme cursing and anatomy references are over done since hangover the shock value is non existent and it is not funny it is rather disrespectful to the fan base to believe that the only thing the 18 and up crowd will laugh at is a crude bar joke aside from the obvious parental warning i would also have to add an iq warning as well the underdeveloped plot left nothing to be desired a film without suspense is basically a third grade writing assignment the characters were not believable or likable seeing another tammy movie where the audience gets to laugh at a fat woman for being fat is in and of itself laughable considering the american obesity rate the fact that we never see a movie where obese characters are able to demonstrate their acting range outside of an occasional moment where said character pines over an attractive costar and maybe despite my obvious repulsive weight this person sees beneath the lard layers boohoopass on this trash,comedy
terrible in all its glory fat jokes because it stars a fat chick terribly degrading melissas persona one would think that the movie actually adds something with that cast but it doesnt it not only has the last minute unexpected hero recipe but the im fat so i make fat jokes ingredient the movie was almost unbearable to watch and very american style of laughing at steriotypes its sad to see that jude law and jason statham participated in this since they have so much more potential and thinking that they wasted time filming this and not something of quality makes me sadthis movie is whats wrong with society nowadays do not recommend,comedy
my daughter told me this was a funny film so i watched it i will never trust a teenager again i forgot that teenagers will laugh at a fake willy joke every time and this film does the same showing a male member is faintly amusing the first time but by the fifth time its just boring i made myself sit through the last hour because i had hoped it might improve it doesnt the first ten minutes are by far the best it drops off a cliff after that puerile profane badly acted hamfisted and just really unfunny the dialogue is appalling the action sequences are ludicrous and the obsessive swearing just gets old very early on dont watch this if you have a mental age older than six adam sandler would be ashamed of this movie avoid no seriously just dont watch this tripe,comedy
parodies of films arent exactly the freshest thing off the boat at least not since the 1980s and even then it played old real quick dramatic films are often unintentionally funny  people look back at them and say they arent bad films because they were of a different time or maybe because other things in the movie triumphed the few corny scenes of the flick but as good as a dramatic film is a funny one can be even better especially if its got that 90sloving meta quality to it funny films mostly translate into selfaware comedies which are praised often immediately whether they are good or not theyre terrible but because the creators meant for them to be that way its supposed to be funny all right fair enough it seems to work for paul feigs anywayis a film that despite being made after a thousand different parodies works why maybe its the unconventional but still hilarious lead melissa mccarthy maybe its jason statham playing a bumbling goon a screwup of a maybe its the no limits humour of paul feig puking on a dead guy the crowd at my cinema seemed to eat it up apologies for that phrasing me i liked jason stathams real speech more i mean who would have thought that the science teacher from sabrina the teenage witch would actually become a decent comedy directormay be a lot like other film parodies in certain ways such as mocking the theme during the opening credits of the film  quite an obvious gimmick but enjoyable nonetheless if you happen to catch some of the lyrics of feigs interpretation however melissa saves the genre from the mistake of unfortunate castingi recommend this comedy to anyone whos a fan of melissa mccarthy and even those who arent jason statham fans may revel in the fact that he is actually quite funny in all of his scenes,comedy
overall this movie is great and i would recommend it to anyone whos up for a laughgood it is consistently funny with cool and interesting heroes the music is great and keeps in touch with the tone the movie attempts to set all the cast do fantastic jobs acting wise and you seriously believe their character melissa mccarthys rants are hysterically funny as is her unbelievable mode the cinematography is great and works very well it is a well directed edited composed and acted movie the actual action scenes were very well choreographed to feel bad ass jason statham is a personal favourite character and his insane egotistical attitude contrasts to melissas premode miranda hart and jude law do good with there performances though jude feels like more of a plot device peter serafinowicz did a good job of acting within acting his minitwist at the end was surprising and also funnybad the villains were not that interesting or unique or even special they just shifted the story along jude law was just a plot device over an actual character the twist at the end felt forced and just wasnt that interesting the slow motion action parts were just annoying and took away from the pace a much more fast paced action with little breaks would fit betterbest part any melissa mccarty rantmvp jason statham as ford810,comedy
i loved this film i didnt have high hopes when i chose it on netflix but laughed more than i have done for ages its not citizen kane ok but it has more laughs it is sweary and a bit crude but it all works statham is superb sending himself up and i even liked jude law miranda hart does her usual thing but again it works my partner told me to say how nice it was to see an older none thin women in a leading role,comedy
and with just 18 minutes i have come to appreciate the shitness romcoms are to miss lame penis jokes and started to think if my 410 rating for the movie the interview 2014 was bit overreacted because that would mean the difference from it to this was only 3 digits from the possible 9 maybe it was the feeling that this was made for generic tumblr users or the nature that fatso and her horselooking friend were somehow the kings get trickered of earth while being the worstwritten comedic devices since the word objectification which is spectacularly noteworthy and funny since this is supposed to be a story about strong independent women but lets not notice that due target intelligence i take this movie as a personal insult and i do not plan on forgiving,comedy
this is probably not the worst film ever made but its not far offlets start with the prosthe acting is ok  it has the polish of a hollywood filmnow for the consthe scriptits seriously unfunny kind of thing if you are nine or under then you might like anyone who is in double figures should definitely give this a miss a big missif you are a fan of miranda heart then this film may make you smile me i find her offensively unfunny her involvement alone makes this film arguably one of the worst everthe one point that really mad me raise an eyebrow was when the over the top cockney jason stathem uses the term twot the writers and continuity on this film are that lazy they couldnt even pick up that englishman say twat not twotvery much one of the worst pieces of cinema i have seen in years and years,comedy
2015 is an overmarketed overrated flop what were anyone thinking when they made this film is beyond me its not funny it doesnt stay true to its genres by any means its like they tried to copy the old films with a play mix on police academy did they really think that the whole world had completely got sucked into hey this is hot first off the lineup wow this film may have made jason statham lose the last bit of acting credibility just by being in it now i must say melissa mccarthy has been in a few sort of funny films but what happen here what is the big hype with 2015 its almost as bad as the 2014 annie movie remakei do feel quite mentally shot down after watching this as i was hoping to see a comedy which never got me to reached the point of a smile was there an actual point or story did everyone who watched this miss somethingsad to say but 2015 is for sure a wasted effort to recommend to anyone if there were anything good about this film maybe it got left out when it was being edited,comedy
my summary i think nails what is a few funny bits eg laws character accidentally shooting the guy in the head some banter between mccarthy and byrne surrounded by a juvenile predictable unintelligent unbelievable and overall really bad movie did i mention unbelievable no i didnt but i will now obese people simply arent athletic at all which is why theyre obese in the first place much less super agent tactical operator athletic so this whole movie comes across as contrived and unbelievable now if were actually a good comedy i could write off the unlikelihood of a fat super agent as its just a comedy but it isnt and i therefore didnt i normally dont waste time watching movies below 70 but was lured in by the high ratings of my wife and i watched it and i completely lost interest right around the time 50cent appeared at this point i very clearly remember laughing at loud and asking my wife how in the hell is this thing a 75 out of 10 on imdb is a 5 out of 10 at its very best but overall just awful and deserving of a single star,comedy
is indeed the worst movie of 2015it is extremely boringthis movie relies on vulgar words and swearing in a desperate attempt to make us laugh but in reality is a complete failuremaking fun of fat people and a movie which supports racismbad acting and not funny at allsave your money and save your time from this major disappointmentmelissa mccarthy made a fatal mistake by accepting to act in this rubbish moviei wonder  will melissa mccarthy act in adult movies for the sake of moneyavoid this movie at all costs,comedy
screw this movie in its fat ugly facei dont know what kind of crap youre trying to pull melissa but youre not funny the im so fat and ugly watch me fall over and swear act is getting old nothing you do in this movie is funny or interestingis a movie that lacks direction and tone half of the time it was sad and dramatic and other times it was funny it was neither and ultimately failed at both the 50 cent cameo was obviously phoned in his role was neither funny or complimentary to the plot jason stathams role was similar i found his general dickheadedness more annoying than funny the fact that he showed up in every scene against all logic was even worse rose byrne was predictable which is a shame because i do believe shes a very talented actress in the right roles damages 28 weeks later the villain is in the movie for about 10 minutes total  know nothing about this mastermind that we dont even hear that much about jude law who dies in the first 10 minutes of the film is a douche his death is supposed to be emotional are you seeing the problem how are we supposed to be sad about a character we barely know the film sets this scene up from nothingalso this movie is needless profane i nearly walked out i really didnt spend 18 just to see some guys erect cock on a camera i dont get it is it funny is it shocking either way the movie couldve done without it mccarthy constantly switches between sweetshy to mindnumbingly profane swears come out of her mouth like free gifts from oprahthe only saving grace in this movie is mccarthys sidekick whose name i forgot because she was severely underused she was far funnier than mccarthy this movie shouldve been her in the lead with somebody like stephen merchant somewhere in the mixanyway this movie blows hard do yourself a favor and watch mad max this weekend a movie with originality and visual flair and narrative heft,comedy
the family guy of movies is here a sneeze joke a bat poop joke awkward unrequited love jokes a pinkeye joke and fart jokes all within the first 35 minutes also like all of paul feigs films you have melissa mccarthy being humiliated for over 2 hours whats new about this one we get to see jude law play an infallible character while jason statham completely debases himself in his most embarrassing role todate then theres peter serafinowicz as aldo a sexual deviant who spends every moment he has onscreen trying to molest mccarthywhat about the action theres isnt any shaky camera effects but its filled with quick cuts and terrible special effects even worse feig randomly uses slowmotion during action stunts which becomes annoyingly repetitive and is completely pointless unlike the the wachowskis zack snyder and matthew vaughn who have mastered this effect making it a part of their style paul feig makes it clear he has no idea what hes doing truly a terrible writer and director with bad taste and no style of his owncan paul feig degrade women onscreen any further as bottom of the barrel as the jokes are throughout this atrocity the only thing that isnt made fun of is mccarthys weight yet every other aspect about her appearance and personality is targeted for cheap laughsso what can we learn from you can humiliate a woman in every way possible even sexual assault as long as you dont mention her weight also were all going to need to come together and boycott the new ghostbusters because paul feig should never be allowed to make another film again ever,comedy
if you up for a nonstop swearing pointless  tasteless socalled comedy flavoured with some stupid  inappropriate jokes then you will enjoy this 007parody aka comedy action otherwise do not waste your time watching it it is in my humble opinion jason stathams worth movie role  it would not add any respect for him i rated 110 was shocked to see such a high rating i guess the cultural standards  the tolerance in our society are responsible for that once again there are plenty of good movies do yourself a favour  skip this one safely you will not loose anything ps spoiler excessively high swearing content,comedy
this is the worst piece of shite i have ever seen the movie contains nothing the story is as hollow as the characters playing it its not even funny just some lame insults on each others all the time its not even kids humor since they show a lot of dicks in it how can great actors like melissa mccarthy and jason statham go as low as to take part in a movie like this can someone explain to me how this movie ended up with over 7 in score have you all lost your mind have they hired thousands of people to vote this movie up so they can earn more from it please people listen to me and save your time and money do not watch this movie its dreadful,comedy
