director paul feig and actress melissa mccarthy continue to make magic together their third collaboration is definitely more enjoyable than the heat and in many ways measures up to bridesmaidsmccarthy owns this film feig actually wrote it too unlike the previous two films but its clear he did so knowing mccarthy would take it over shes dynamic sassy lovable and foul and its delightful to watch even if its messytitle alone tells you that is meant to be a riff on classic films specifically the james bond series but its not a parody rather feig plays with conventions especially as they relate to women and even pokes at what other directors writers and producers might do if given the same premise of a cia desk jockey launched into the field to stop a scheme involving a nuclear warheadin fact the deception goes beyond the appearances and into the plot somehow feig keeps the story fresh and intriguing even when the film descends into goofy preposterous chaos its impressive how good of a tightrope act it manages between stupidity and sharp effective humormccarthy toes that line too at times shes just a vehicle for improvised shenanigans and at others theres something genuine in her character susan cooper its hard to pin down the characters qualities when shes constantly changing appearances and even personalities but never for a moment does it seem like shes trying to hard and failingwe do get to watch jason statham try the same thing however and make a total ass of himself the star of actual movies does have some funny dialogue at times but his character is a screwup who talks a mean game this idiocy is part of the conventiontwisting in but there are times he just seems like an idiot its more fun to watch peter serafinowicz as the outrageously lewd aldo  an italian agent who susan encounters in the field at various points in the film  than watch statham flounder jude law even does a nice job though his character isnt called upon for muchrose byrne as rayna boyanov the films antagonist  a role she seems to excel in when acting for feig continues to nail her comic bits with such incredible poise shes both a bonafide villain and a funny caricature of one rayna isnt hollow which would render byrne unfunny shes multidimensional enough to really work off of mccarthys susan feels like a multibout boxing match between a stupid genre spoof comedy and a professionally improvised fresh twist on a stupid genre spoof comedy every time you prepare to role your eyes and deem it a joke of a film it comes up with something hysterically clever to pull you back in not many films or filmmakers can do it and thats what makes the feigmccarthy duo one to keep an eye on for the long termsteven cthanks for reading visit movie muse reviews for more,comedy
i waste my time to watch this bad movie i only watch this because of jason jason and jude they underrated yourself acting in this movie and to spend 65m to make this bad movie with poor comedy is absurdlybad move for jasons career maybe you dont know what to do whit all that money you have but this is very bad way to spend on project like this and i must to say rating of 72 very good for this movie its overratedalso i want to say something to american directors i begging you to save us of comedys like this and movies like this even james bond is a bad movie uk queen toy,comedy
seems that the majority of all the prim and propers in the world have seen this movie and didnt like itso what if its clichd and has loads of swearing in it its just funny as hell ive not laughed so hard all yeari watched this with no real knowledge of the story line or fluff which you pick up with advertising and thoroughly enjoyed it films like this arent made to provide intelligent dialogue but for shts and giggles which are plenty in the moviestathams character is just one big dig at his normal run of the mill movie characters and is a constant menace in the film whilst being a bit tasty with what he does he still manages to do it badly and you get to see him with hair on his head too which is novel the very last scene after the clips is funny as sin too so keep watching,comedy
normally this isnt my type of movie but is well above average for its type because i liked the lead character she was funny but it left me thinking if only if only theyd have been more bold this could have been a great movie if they wouldnt have been afraid to go allout and use her to her fullest ability yes more fat jokes they could have made an absolutely hilarious movie instead they played it safe and did a lot of different types of jokes for standard cheap laughs when they utilized their main cashcow no pun intended it was very funny but everything else was standardthis could have been a great movie they could have kept the plot the samebut they should have added about 10 more fat jokes they had a few subtle jokes about looks and weightbut to be really funny they should have added about 10 bold jokes like i said im not one for slapstickbut for a movie like this you have to do it big dont be afraid like instead of making lame jokes about random stupid things simply have a few chairs explode when she sits on them instead of her hanging onto a helicopter have her pull the dang thing down with her weight instead of using karate have her squash people stuff like that that would have improved this movie from 510 to at least 710 or even 810 dont get me wrong there were some decent jokes with her the subtle jokes were still funny i liked the lead ladybut utilize her more,comedy
i love melissa mccarthy let me start off by saying thatbut lets not make her out to be lucille balllucy had a sophistication and class and was still able to get laughs without having to play blue resort to perverted jokes or foul language in fact lucy is still making people laugh it doesnt matter how old you are or how long ago lucy was on the air you tend to like lucy if you have a sense of humornot so with mccarthy i like to think i have a great sense of humor and while i like mike and molly i tend to not like her movies i find her much more funny in mike and molly where she has to be more reeled in because of the fcc standards on network televisionthis movie was one or two big laughs mixed with a few smaller chuckles among a bunch of  seriously moments some of the attempts at laughs were unnecessary like the big penis selfie it was not only not funny it added nothing to the moment and was there for the cheap and quite forced laugh the audience when i saw the movie seemed uncomfortable and werent quite sure if they were suppose to laugh or not when you fall to cheap laughs  its because the writingacting isnt strong enough on its ownand you know you may be dropping the fbomb too often when you have 50 cent doing a cameo and hes the only one with a clean mouth you also know the movie is in trouble when side characters who pop in and out on occasion to drop a joke like the ones played by statham and law are funnier than the leading character i actually anticipated the moments statham would appear i also enjoyed laws characterid say its funny enough to see  but you will not want to own this one on dvd or really feel like seeing it again say for example you have a friend who hasnt seen it and wants you to come along youll probably politely decline and say saw it already once was enough i give it a ccif theyd have dropped a few more jokes instead of fbombs i think it could easily have been a better movie but they were pushing blue too many times for a cheap laughi really really really wanted to like it more than i did but alas the funniest scenes were in the commercials,comedy
my wife and i could not even finish this movie it was so bad we thought statham who she loves might make for a good time instead were watching utterly outrageous unfunny nonsense where every man is a bumbling fool or dead and this obviously outofshape morbidly obese woman is flipping around like a ninja its so obviously a normalsized athletic person in a fat suit its not even funny the attempts at witty quips and jokes are literally painful to watch and hear there is more cringe in this movie than youd find at a my littly pony conventioni dare you to try to make it through the whole thing no i take that back  i wouldnt wish that on anyone,comedy
i read some of the reviews posted here both before and after watching the movie and tend to come down more on the side of the negatives than the positives i saw melissa mccarthy in her two previous films and quite liked her ive seen miranda hart on english tv and quite like her too so i figured what the hey lets give it a whirl for reasons not explained in the script miranda hart retains her english accent despite working for the cia in the us at times i got the impression she was allowed to write her own dialogue as well for theres more than a trace of her quirky style in evidence in terms of chemistry however m and m are about as tight as oil and water im certainly not against james bond type spoofs but derek flint james coburn and matt helm dean martin have already been there done that and got the tee shirts not exactly a waste of two hours but neither a eureka moment,comedy
it seems from the imdb score that a lot of people have a much higher opinion of this movie than myself melissa mccarthy plays susan cooper who is an office cia agent helping field agent bradley fine jude law having vowed to never watch a jason statham movie this is the second time recently that ive been shocked to see his name pop up on the opening credits i suppose its fair to say that he does play a very particular type of character and if you like that then you will not have the same reservationsas for the film itself it does have its moments but falls somewhere between austin powers and james bond not as funny as austin powers and not as entertaining as james bond anyway judge for yourself as its clear that many people enjoyed the movie,comedy
is a blandly forgettable name for a film but in their third outing together director paul fieg and his muse melissa mccarthy strike comedy gold yet again mccarthy plays susan cooper a cia analyst who works behind a desk partnering with a smooth talking debonair field agent who goes by the aptronym bradley fine jude law unexpectedly hilarious cooper nurtures a massive crush on fine who seems completely oblivious to the point where when he is murdered she offers to go into the field herself to try and avenge his death of course all sorts of complications spring up but despite having spent most of her years as a desk jockey cooper proves herself to be preternaturally adept at the game and her quick wits confidence and brusque attitude always are on hand to help her save the day the script is pretty solid delivering up enough twists and turns to keep things interesting but the real treat of the movie are in the performances by now everyone knows that mccarthy is an oscar nominated comedienne but i could not have predicted such hilarious performances out of jude law or jason statham who absolutely kills it as one of the cias ultra serious field agents who is completely over the top but cant see the humour in his own ridiculousness also great allison janney in a small role as the head of the cia british comedienne miranda hart as susans bestie and rose byrne as a bratty villain,comedy
im asian i watched a lot of englishamerican movie so im getting used to every joke they make and they did really make me laugh a lot for every punchline i dont know why some of the reviewer keep talking about feminist thing but this is just a fiction aint i right its just a movie for us to have some fun and i really do have a lot of fun and good time melissa mccarthy did a very good job depicting an out of all place woman who just become a field agent and never forget the hilarious jason statham he is so funny and i dont know if this is the first time he is actually acting rather than just become a mechanic transporter and anything else because he did a really good job miranda hart rose byrne peter serafinowicz and like every character in this story are so funny and paul feig you are genius nice action and twist the funniest action movie ever so far,comedy
saw too many 1 star review which honestly is not fair yes this isnt as great as some other comedy out there may be not even as good as bridesmaid which seemingly is the benchmark now but this isnt another sisterhood movie this is a funny spin on a flick shot people personally dont mind it and yes could it be better oh for sure as a comedy there are still a lot of blanks for humor in but at times when it happens i feel the make up for it not all humor had work for sure too but i feel there is enough balance to not make things too over the top and the ones that worked just did perfectly plus there is a lot to be loved about the movie beautiful scenery  people  outfit  cars  planes awesome cast when you think about it overall funny story line and scenes it seems it is a movie that while the plot doesnt take it as seriously but still put in the effort for a good movie,comedy
this movie is based on a nice comical idea  in a james bondesque world of supermen and supermolls a chubby middleaged underling has to mingle in unfortunately the fun stopped at the idea and never translated into a proper script with witty dialogues for large parts of the movie we see melissa mccarthy as efficient deskworker susan cooper bumbling alongside the evil dreamboats jude law cia superagent bradley fine and rose byrne as sexy supervillain rayna boyanov for example there is one trustbuilding scene in which rayna tells susan that she reminds her of her mother which susan fails to take as a compliment that scene drags on for what feels like 10 minutes with rayna describing her mother in increasingly grotesque ways its like one of those jokes among colleagues that take a terribly wrong turn where noone wants to lose face and simply end itto really mess up the comedy the producers decided to pull a kevin james on us and try to make us believe that at least for a fleeting moment susan is not just a nice but average person but that she really is on a par with her supercilious competitors that the reason why she didnt cut it as a superagent is discrimination and a lack of selfconfidence that there is a snowballs chance in hell that jude law is sexually attracted to her simply because she is such a good chum jude laws flirtations with her are shown not as friendly but inconsequential but as deceitful weve seen this makebelieve plot a hundred times before with an average guy being chased by perfect 10women this time its the other way around but it doesnt make it any betterbridesmaids was crass and super funny but theres nothing left of that in paul feigs latest offering ultimately its maybe 10 minutes of fun and entertainment in a 90minute movie,comedy
my favourite person over the last decade has been the late christopher hitchens  divisive  polemical and explosively controversial he was best known for taking on the men of god and constantly winning in his own take no prisoners style  one almost forgotten polemic is his vanity fair rebuttal that women are not funny  suffice to say i didnt disagree with this opinion and do recall getting in to something of a heated internet debate on this  no hard feelings on my part because its just the internet and isnt all that important but i still stand by with what i said in that i dont find women funny and does absolutely nothing to change my mind and that hitchens is right its interesting that much of the marketing material in britain has made a big deal about starring well known names of statham  law and byrne  a clever marketing ploy because melissa mccarthy will be treated with blank expressions and mutterings of who    after seeing all i can say is her relative obscurity this side of the atlantic is well deserved and hope it continues for a lifetime  ms mccarthy is chubby  unattractive and uses her as a star vehicle to deconstruct the james bond franchise and all those other espionage thrillers  she also constantly puts her metaphorical foot in it  swears a lot and is probably even more unfunny than the other 35 billion woman walking on the face of planet earth today  that is really saying something believe methis is a pity because as a spoof sp works relatively well  i saw the straight laced  po faced survivor last week and truth be told i probably had more fun watching than i did watching that  the espionage element is fairly well done  tough you have to suspend disbelief that a cutie played by byrne would be in league with the murderous misogynists of al qaeda but youre not supposed to take things seriously here  and jude law and jason statham have a whale of a time sending themselves up  a fact that theyre able to communicate to the audience and i wonder if this has everything to do with being popular with critics  regardless of this suffers from being a comedy vehicle for someone who simply is not funny,comedy
i loved this movie a friend recommended it and laughed the entire way through i have since then passed the love on every time i watch it i catch little hilarious nuances i missed by probably laughing too hard i highly recommend this movie just do yourself a favor watch it without any expectations and see it for what it is hilariousmelissa mccarthy really demonstrates that she can handle the starring role and brings the comedy jude law plays a on par with bond but with humorous parody jason statham is so unexpectedly funny its refreshing and delightful i cant wait to see him in another comedy peter serafinowicz from shaun of the dead plays aldo who is an italian she ends up working with made me laugh constantly i dont want to give away anything so i cant say much morena baccarin firefly and stargate sg1 has a small but fun part shes always fun to watchdont look for a deep philosophical or high brow comedy its funny and uncomplicated enjoyable,comedy
just when i was ready to give up on melissa mccarthy for running her shtick into the ground she surprises me this gem of a comedy melissa mccarthy stars as susan cooper a single woman who works behind a desk for the cia when the identities of all active agents are compromised she enters the field to track down an arms dealer looking to sell a nuclear bomb movies dont really rank high among my favorite genres although daniel craig as bond is definitely changing that but this s main selling point among many is that it knows how silly it is and just plays along if one were to critique on its plot of course one would conclude that its convoluted and nonsensical however the comedic writing and performances are all topnotch here making considerations of plot almost irrelevant my main issue with mccarthy before was her excessively profane loud and obnoxious screen persona thankfully she tones it down a lot here and goes for a more subtle approach her character does kind of become more outre as the film progresses but it was organic to the central theme of a woman coming into her own in a maledominated profession in terms of exploring that rose byrne neighbors plays very well opposite mccarthy as the arms dealer that cooper is after even though theyre on opposite sides of the law they share a bond over being taking seriously as professionals in their respective fields so to speak there was even great comic work from noncomic actors like jude law and jason statham who is essentially parodying his action star roles it was overthetop but oh so funny i also liked alison janney as susan coopers cia boss outside of the writing and acting all of the technical bits were welldone if unspectacular and the action was wellchoreographed there were a few moments where the cgi didnt look so great but the cheesy nature of the effects kind of fit with the overblown satirical comedy that film was going for finally there was some pacing issues towards the end of the second act and the beginning of the third maybe 510 minutes could have trimmed but i was laughing so much i barely noticed overall is perhaps the second best comedy ive seen this year behind kingsman it was able to take a comedian who i was beginning to tire of and make her funny again it also was just plain hilarious the whole way through and definitely worth your timemoney,comedy
the sooner someone stops paul feig from making films the better if we get rid of him we get rid of mccarthy as well now isnt that the kind of world were all striving to live in,comedy
i know melissa mccarthy since gilmore girls but never thought she would rise this far especially to dominate in a movie with the presence of the big names around her that too in an action film equivalent to top quality shes one of my favourite actresses even i enjoyed thoroughly her underappreciated tammy so this is where the action stars become comedians and comedians action stars indeed it worked out so wellit shames comedyflicks like the pink panther johnny english etc from the director of the heat helmed another perfect female oriented comedy jude law was a decent as usual but jason statham was unbelievably awesome in his tiny part i had plenty of good laughs the loud ones after a long time i still remember the unicorn joke and i cant stop laughing and roof over a bike gadgets and so on i find melissa mccarthys line deliverance are so funny and i enjoy her films specially for that reasoni know they used a stunt double and bluegreen screens in the crucial segments for a better result but still she excelled in all stunt sequences that required physically herself in front of the camera one of the trivia says after the end of each day shooting she looked like fell down an elevator shaft her hard work definitely paid off very wellthere are lots of adult oriented comedy so strictly it is for grownups only and may be matured teens ill be definitely disappointed if they wont make a sequel for this if they do i hope they retain all the cast especially statham along the lead actress and finally im looking forward the directoractresss the third collaboration ghostbusters710,comedy
review by mike smith a deskbound cia analyst volunteers to go undercover to infiltrate the world of a deadly arms dealer and prevent diabolical global disasterjude law jason statham and    melissa mccarthy from the looks of this movie it was going to be a agonizing flop but to my surprise this movie was fun and i cannot stop recommending itthe cast is an unlikely grouping but they all work awesome together after the last couple of melissa mccarthy films ive seen i was not looking forward to this one but she did a really good job if felt like she toned down the bumbling kevin jamesness unlike she has done in the past yes its still there from time to time but not overdone the one person i loved in this film is jason statham this is a different roll for him he is really funny and i feel like some of the stories he tells are things that happened in jason stathams other filmsthe story is good but not really original and the film is forgettable although has a great mix of comedy and action the laughs are strong and are non stop i was shocked by how good melissa mccarthy did with fight sceneswith a fun story good laughs fun action and jason statham like you have never seen him before is a good watch and you shouldnt let this movie pass you by cheers and remember life wont suck as long as there is a good movie to watch85 out of 10 edited by samantha locke twitter fatmiketpkfacebook page facebookcomfatmikesmoviereviews,comedy
this movie was absolutely one of the most funniest movies i have ever seen i mean the jokes were hilarious the characters were hilarious and the fighting scenes were hilarioussurprisingly jason statham was the funniest character in the whole movie with melissa mccarthy being right behind him statham said some stuff that would just make you crack up and give you tears like i said mccarthy was right there with him as her jokes were just laugh out loud funny rose byrne miranda hart and peter serafinowicz were also quite funnyanother thing that made you crack up were some of the fight scenes mainly the ones with mccarthy the stunts and moves they did on people gave you a laughand a lot of the jokes were just absolutely hysterical they are so clever that you cannot stop laughing after you hear it and you wonder how paul feig came up with such a jokefeig did an outstanding job with directing and writing along with the great performances from statham and mccarthy go see this movie if you love for your cheeks to be sore and have tears in your eyes from laughing,comedy
i dont understand all the bashers many of them claim that the movie is lame and stupid i agree the movie isnt deep it doesnt make a person think hard the plot isnt dark or complex and there isnt much character development but thats not what kind of movie is it is a james bond spoof thats all and it succeeds in this very well my wife and i laughed hysterically throughout the entire movie we watched it in the theater last year just watched it for the second time last night and loved it both times we are melissa mccarthy fans shes living proof that you dont have to be stick skinny to be successful and i think thats pretty cool we also liked her in the heat although we liked this movie more and we watch mike and molly every weekim taking away one star for the cussing as others have said i think they overused it and they really overused it in the heat im not a prude but it does get irritating after a while and i believe the writers could have omitted quite a bit of it and the movie would have been better especially toward the end of the film so if you want a lighthearted relaxing movie and dont expect something earthshattering give this one a try i think youll find it fun,comedy
