the culminating moment in 2014s atrocious paul feigless melissa mccarthy comedy tammy was when the titular character was hit by a car lesser writers and directors want mccarthy to be the funny fat lady they want her to fall through tables and yell at the top of her lungs mccarthy is good at this and it happens from time to time in director paul feigsbridesmaids the heat latest comedy however thats not the only joke and punchline physical violence is used as an end to some of the rather exhilarating action set pieces this film has to offer it sort of serves as feigs demo reel for an action film however the humor comes from the writing when mccarthy gets to belittle an assistant by saying she is going to staple his reproductive organ to his head so he looks like a unicornwhen she orders a wine that she describes as like a hummusthe humor comes from her intelligence and comic timing not just her ability to break furniture this is where truly shines in the film mccarthy plays susan cooper an intelligence officer whose permanently talking in the ear of bradley finejude law in a fun opening scene we see how its her doing all the work as she points out entrances and exits guards and traps when fine is kidnapped she has to go undercover and infiltrate a mysterious arms dealer further complicating things is his daughterrose byrne and fordjason statham a rogue agent whose basically a parody of every jason statham movie ever is first and foremost a comedy but its also an action filmas discussed above feig directs action rather generically but it comes as a fun change of pace from all the verbal sparring its also an empowerment story but a lowkey one it wasnt advertised as such but it would be the best example of a great female character this year if mad max hadnt come out it is a dash too long the plot is more than a dash too convoluted and some of the jokes start to get a bit old when its in its prime however it reminds us that melissa mccarthy is not just the funny fat lady and paul feig is not just another judd apatow they are both so much more,comedy
melissa mccarthy may as well be a genre unto herself these days after applying her somehowstillnottired schtick of foulmouthed slapstick with an undercurrent of sweetness to weddings and buddy cop capers alike its a pretty seamless transition into the pantheon of bond spoofs that increasingly run the risk of outperforming 007 himself like many of its genregender bending contemporaries manages to hit that sweet spot middle point between throwaway star vehicle and more than the sum of its parts  derivative largely forgettable but fun and funky enough to be worth its weight in exploding hemorrhoid removal cream writerdirector paul feig is clearly motivated by taking the pss out of the notoriously misogynist bond tradition but is canny with his feminism here we have the timeworn caper framework but inhabited by a female lead comedic relief sidekick villain and curmudgeonly superior but feig never makes a big thing of it allowing the inevitable gender politics to play themselves out without any fuss sans grandiose statement it helps of course to gird the whole shebang with prime spoofery including some genuinely engaging globetrotting action sequences though the bursts of shockingly graphic gore take it a step too far and even its very own impressively catchy bondian title track its the sign of a good parody when there are bits when you catch yourself getting nearly too swept up to remember its meant to poke fun at the genre youre enjoying savvy audiences will know to come for the pastiche and stay for the gags though and while feig has yet to escape from the judd apatow shroud of flabby editing and sequences of excessively generous riffing and a 130 minute running time  at least 20 too long  is indulgent indeed he specializes in the cutaway gag of which is chockfull some zany the rats have wings some gross some which veer from one into the other and back again oh god not on him not on him proves 2015s repository of daft comedic quotes to beat  you can practically make a short film out of the deranged boasting rants of jason stathams exquisitely oblivious rogue agent alone overlong and clumsy as the results may be the throw spaghetti at the wall and see what sticks approach to comedy is nonetheless bound to win laughs from just about everyone at some point or another if anything feig has enthusiastically assembled such a stellar ensemble cast that the proceedings grow almost worrisomely overcrowded at times but too much of a good thing is still a fairly welcome complaint mccarthy herself remains the highlight with a ferociously enjoyable leading performance that weaves in her recurring archetypes of mousy lovable loser and bombastic elaboratethreatspewing piledriver and somehow grounds both in an impressively believable and endearing character near impossible not to take to rose byrne is an impressively terrifying scenestealer as the resident ice queen evil mastermind almost as frightful when scathingly critiquing mccarthys wardrobe as menacing undercover agents with a gun and feig is wise enough to let her and mccarthy rip into one another with enough voraciously trashtalking banter to make goldfinger blush miranda harts sweetly awkward act toes the line of overuse as mccarthys sidekick but wins enough genuinely unexpected guffaws to be well worth her while while statham is consistent comedic gold lampooning his action man persona like a champ jude law naturally was born to live and breathe bond withoutbond and allison janney grumbles like the best of them as the surprisingly unfussy cia director while peter serafinowicz is reliably hysterical as a boorish italian agent even if bobby cannavales slick arms dealer feels like an extraneous dud of a last minute threat flounders a bit with one or two twists plot lines or characters too many lacking the taut precision that would elevate it to the hot fuzz calibre of classic spoof nonetheless feig and mccarthy continue to be a modest dream team of reliable laughs and nonchalantly progressive genre tweaking and their seesawing between clever goofy crass and sweet still has mileage aplenty as loathe as i am to admit it in the epoch of unwarranted sequels susan cooper could prove a concoction who  shock gasp im going to kick myself for this later  wouldnt be too abhorrent to cinematically only live twice even better i aint fraid of no ghosts bring the noise710,comedy
this was a good film in general with a good cast that is in some ways out of their right element it is really fun and entertaining and there is a lot to love about this film in my honest opinionit is really the cast that makes this film stick and be really great and funny melissa mccarthy is in an all time high maybe a bit typical funny role but her character is out of her usual elements in many ways she is the silent awkward type and it is really good jude law is the dashing british that really has it all but is flawed in the way that he gets a bit too much of himself and doesnt know what is really going on around him jason statham is in many ways the same he is a but a more dumb one hard hitting shooting and moving on in a fast pace is his style but he is not that clever and way to hard headed these three spies really compliment each other in this film and have a lot of help from different sides but it is fun seeing them in and out of their typical elementsthe film is entertaining very classic in its class in many ways but does have the humor and strange extra scenes here and there to keep the viewer alert and see what is really going on in this melissas role of susan cooper is just great she saves countless mishaps and strange behaviors not appropriate for a real  there is a lot to see in this and it really is just a well oiled comedy machine both in scenes characters events fights shootouts and much more,comedy
is a comedicfemale version of james bond with a lot more hilarious trashtalk and more failed missions than one would expect from a socalled movie melissa mccarthy plays susan cooper a stereotypical shy genius who works in a secret cia underground facility she is the righthand man to bradley fine portrayed by pretty boy actor jude law coopers role was to help support fine from behind the scenes by assisting him via bluetooth in which she lets him know where enemies are approaching how many people are surrounding him and ordering missiles to shoot at precise locations she provides when the time calls for it cooper had a onesided love with fine and when she thought fine had died at the hands of an arms dealer she began the plan to avenge his death the aforementioned arms dealer goes by the name of raina she is played by the devilishly beautiful rose byrne right after raina supposedly killed fine she revealed that she knows all the true identities of the cia agents in the field this along with her plot to avenge the man she loves death caused cooper to volunteer to go out into the field to find raina and track down a stolen nuclear bomb isnt only about capturing the bad guys this movie shows the evolution of a woman who was invisible to both her peers and the man that she loved to becoming a who kicks butt in the field and saves the day cooper was unknown to the villains of this movie because she kept her head down in the cia and operated in the background now she calls her own shots and leads others into battle she developed confidence in her line of work and has a newfound sense of respect for herself by loving who she is and not being ashamed of it the only questionable part about this movie was the directors casting choice of bradley fine jude law certainly had the looks for the part but ryan gosling would have made a better fine gosling would have put more of a charm towards fines personality which would have made more sense seeing as how cooper fell for him gosling would have made a more convincing character as fine and would have overall made the movie blend better together throughout the movie is a series of endless laughs and witty comebacks this movie is a mix between james bond and paul blart mall cop although this movie shows these spies having some amazing skills in kicking the bad guys butts this movie also shows idiotic failings a 10 year old could figure out like not storming into a black market bomb deal and knocking yourself out ford if you want to see a successful and witty hero in an action packed movie then go watch tnt movies on the television however if you want a good laugh see things get blown up then this is the movie for you,comedy
susan coopermelissa mccarthy a desk bound cia analyst finally gets a chance to go undercover after one of there top spies named bradley finejude law is killed while on a mission susan wants to prove herself even though everybody else believe she screw up big time will she prove them wrong i like the way this film is not a totally spoof where the story plays itself straight and the comedy gets brought in melissa mccarthy really does shine here i liked her comedic timing playing off the insanity not mention miranda hart who plays her friend i hope she and mccarthy will team up again cause the two are quite a funny pairing jason statham is good here kind of making fun of himself as a action film star jude law and rose byrne are also great in there supporting roles action scenes are quite amusing kind of feels like a send up of james bond and jason bourne im begging the filmmakers please make a sequel,comedy
this film is so much fun its got a kickass central performance by melissa mccarthy complemented by great shows from an alist cast as well as fantastic action a suspenseful if not generic plot and consistently hilarious laughoutloud comedythis is by far one of the better james bond parodies much like this years kingsman the secret service it satirises the genre perfectly throwing in brilliant injokes and witty copies of classic bond moments and tropes making for a lot of laughs whilst it also successfully adds brilliant action and a story that is massively excitingthe funniest thing about this film is that it is quite foulmouthed and full of unpredictable humour from start to finish its a quick paced comedy that throws so many jokes at you youll need to watch it again to have a chance of catching them all because everything is simply so funny and it even has a good shock value with such a high swear count and excessively comical but often bloody violencemelissa mccarthy is absolutely stunning here she plays her generic underdog character like in films such as the heat and identity thief but she adds a bit of shine to what was quickly becoming a tiresome character showing off quite a slick image in some of the latter stages of the film to go against her stereotype which not only fits perfectly into the film but is a nice surprise to see what else she can dothe rest of the performances are fantastic too jude law plays a kickass pseudo007 jason statham brilliantly makes fun of himself in an overthetop sweary statham role whilst rose byrne is an incredibly suave and sexy villain as well as being a lot of fun when it comes to the slapstick and sillier side to the plotthat plot is on the whole thrillingly entertaining of course you know whats going to happen its the most generic plot in the world but the globetrotting the slick gadgets the countless criminals all make it into a rapidfire thrill ride thats just as enjoyable as any bond or mission impossible moviefinally the action here is also incredible to watch melissa mccarthy does a great job of getting stuck into some very action packed sequences again deriving from her stereotypical on screen persona whilst the visual effects explosions and fight sequences throughout are both brilliant to witness as well as hilarious to watchoverall im giving this an 8 because its a thrilling action packed and hilarious parody that keeps up high quality comedy throughout that will leave you in tears of laughter by the end,comedy
i saw starring melissa mccarthymike  mollytv bridesmaids jason stathamthe expendables movies the pink panther2006 rose byrne insidious bridesmaids jude lawrepo men sky captain and the world of tomorrow and allison janneymomtv west wingtvthis is a female version of james bondjane bondone of my favorite movie characters with some humor thrown in it even opens with a james bond type musical number and action scenes it is directed by paul feig who also handled the heat and bridesmaids both with melissa melissa plays a cia analyst that works with jude a suave james bond styled secret agent that usually gets the job done melissa has gone through the training required for an agent but has never done any actual field work when jude actually fails on a job involving rose the villain in control of a nuclear bomb melissa volunteers to go into the field and finish judes missionit seems that rose knows all the identities of the regular cia agents including jason allison plays the boss at cia headquarters and gives melissa her chance to show what she can do the action scenes are very good with one in particular being a confrontation in a kitchen involving melissa a knife a frying pan and an evil villainous henchwoman that really looked good jason has several good fight scenes too but he is also very funny it seems that he likes to exaggerate his exploits just a tad and some of his stories are really stretching believability a bithe is sort of a cross between rambo and inspector clouseau fyi melissas real life husband ben falcone makes his usual cameo he is the tourist that asks melissa for directions to a burger king as the credits start there is a scene and during the credits are clips of more missions with another scene at the very end after the end credits its rated r for violence language and sexual contentincluding nudity and has a running time of 2 hours being a james bond fan i really liked this one and would buy it on blu ray,comedy
the idea of the cia being good guys is already very difficult to believe but its a movie i can set aside my cynical doubts long enough to have a laugh but unfortunately there are not many in this movie melissa mccarthy gives it an admirable try i cant really fault her she just needed better material jude law was pretty respectable toojason statham was just horrible not funny at all and he felt tacked on at the end like they made the movie decided it needed more something and added him in thats not really what happened statham was involved since shooting started but thats how it felt anywaysby the end it just drags on i think its because they only have a couple gagsjokes and they implement them all multiple times wearing out the humor factor quickly,comedy
follows susan cooper melissa mccarthy a cia desk operative who volunteered to go on a mission upon learning of a terrorists plan to take out all of the agencys top field agents an unlikely choice for fieldwork she travels around europe following suspected arms dealer rayna boyanov rose byrne as rogue agent rick ford jason statham attempts to interrupt her mission in order to show the agency that he is their most indispensable agentthe movie combines comedy and action seamlessly stathams comedic timing and unapologetic quips work well with his classic action star stunts mccarthy on the other hand showed versatility as she embodied different person as that ranged from being susan the pushover to ruthless amber valentine with quick dialogue and highflying stunts is a film that relies on the unpredictability of all its characters bringing in the laughs until the end,comedy
from bond to bourne by way of the naked gun and johnny english movies about covert operatives kicking butt and saving the day  not always intentionally  have become a genre unto themselves thats why the advent of paul feigs is faintly depressing how is a femaleled comedy spoofing the secret world of spies only happening now in 2015 at least theres nothing at all depressing about the film itself is a blast of fun cheeky adrenaline which cleverly sends up the dudecentric conventions of the genre while crafting a world and characters that both embrace and defy stereotypessusan cooper mccarthy wanted a life of adventure and mystery when she joined the cia however despite turning in an outstanding performance at the training academy shes faded almost literally into the background in the perennially vermininfested confines of cia hq she commiserates with fellow desk jockey nancy hart while providing able support for the agencys top operative cocky suave bradley fine law but when fine runs afoul of ruthless arms dealer raina boyanov byrne susan finds herself in a unique position to take action  shes the only fullytrained agent who is also a complete unknown in the fieldmany spoofs falter in balancing comedy with plot and action  a problem that largely manages to avoid until its almost breathlessly overstuffed ending feigs script is sharp and witty poking fun at character and convention while never losing sight of the power of a good pratfall considering how many gags and jokes he packs into each frame of the film its a marvel that so many land as well as they do but land they do from the almost outrageously frumpy cover identities susan is stuck with to the frankly ridiculous rogue antics of rick ford statham an unpredictable hotheaded agent who resigns in a ragefuelled fit of machismo when susan is tasked to pick up where fine left offbeyond the comedy however what keeps the film chugging along is the fact that feig also cannily supplies susan with plenty of credible obstacles derived from plot and character theres the nominal villain of course petulant haughty raina who orchestrates death and destruction without blinking an eye but the plot extends beyond raina and her histrionics susan has quite a few lovely character moments too not only does she turn her invisibility to her advantage when she first observes then infiltrates rainas operation susan also demonstrates to everyone herself included that she really is every bit as competent  if not more so  than her male counterpartsfeig even throws in some action sequences worthy  and deliberately reminiscent  of a topgrade flick from an escape on a motorboat under heavy fire through to a spectacular midair confrontation between the forces of good and evil the fight scenes are brutally wellchoreographed with susan giving every bit as good as she gets as she efficiently takes down everyone in her path that said does stumble a little as it barrels towards its gigantic final setpiece the action beats building up in a way that suggest feig is trying to write himself out of a tough spotbut feig never loses sight of his main character who proves to be the finest gift hes yet given to his muse yes that includes the oscar nomination she picked up for her role in bridesmaids and her enduring friendship with sandra bullock her costar in the heat susan is a role that sits comfortably in mccarthys wheelhouse allowing her to deploy her irrepressible charm and impeccable comic timing while also suggesting a wealth of emotion and depth beneath a relentlessly sunny exterior but its also a role that allows audiences to look beyond the brash loud characters shes become known for in her film career  one that celebrates mccarthy as a comedian an actress and a person the fact that the film never once doubts susans abilities in the field is one of the most empowering statements youll see in a film this yearthough shes more than capable of doing so mccarthy doesnt have to carry the entire film by herself feig has provided her with a stellar supporting cast  including allison janney as susans humourless boss and peter serafinowicz as an italian contact with a healthy appreciation of susans wiles law turns in a sparklingly selfdeprecating performance as the films version of bond while hart bumbles her way endearingly through proceedings in much the same way she does on her eponymous hit british sitcombut the real standouts in the supporting cast are byrne and statham both tasked with playing loud outlandish characters who are just barely more than caricatures byrne is delightfully silly as a spoilt daughter who has inherited a highly lucrative nuclear device sneaking quite a bit of charm into the menace that accompanies rainas more callous decisions statham meanwhile flings his grim taciturn demeanour  cultivated and recycled in a string of cookiecutter action thrillers  out the window he plays loose cannon ford with a joyful pomposity thats joyous to watchat a time when the sexism that still riddles hollywood is being actively discussed and dissected courtesy of films like mad max fury road and avengers age of ultron delivers the goods as a feminist twist on a genre that has been dominated by men for far too long its female characters are a magnificent blend of strong and silly tough and tender all at once  incontrovertible proof not that it should be needed in the first place that women are funny and can headline genres typically associated with the male of the species but most importantly of all is delightful in and of itself politics aside this is quite simply a topnotch comedy jammed full of big laughs and bigger action  which is reason enough for it to be a big hit,comedy
after superbradley fine is killed in action his homely and rotund base contact susan volunteers for the followup mission to prevent nuclear weapons falling into terrorist handsmelissa mccarthy is good fun in this role reversal bond spoof which also trades on her diminutive but ample proportions for humorous purposes and the bond spoofery is well done i loved the title sequence jason statham is a hoot as sexist agent rick ford rose byrne is a good icy villainess miranda hart tickles in her first hollywood outing and the cast generally is all good there is actually a decent plot so there is much to enjoy hereand for me the vast majority of that enjoyment was buried under the industrial quantities of profanity which lace this film the first 5 minutes or so is clear then the fbombs start and are constant until the very end and they are unnecessary pretty nearly every one of them adds nothing to the film if they did i wouldnt find them so objectionable for me they spoiled an otherwise very enjoyable film,comedy
loved this movie it exceeded my expectations so much undoubtedly the funniest comedy we have gotten so far filled with really fresh humor there was never a point in the movie that i would feel bored for the first time we see melissa playing an actual badass being absolutely hilarious at the same time jason statham  we have seen him being funny before but in this movie he was hysterical jason was the best part of the movie surprisingly movie had some great action scenes too cant and dont really want to say much more about this title watch it youll love it,comedy
started to watch this film with some scepticism i wrongly assumed that this film would be cheesy with the usual jokes and one liners my interest was raised by the details in the special effects and i loved the way the film jumped in to the comedy from that point it was laugh out loud until the end i would recommend this film to anyone but with a warning do not watch with your children or your parents unless you dont mind a few very awkward moments it may hold a 15 certificate but call me old fashioned as after watching i would have said it should have been a 18 negatives im sorry to say i was not impressed with miranda hart performance but in fairness to her im not a fan but it did not spoil the film for me jason statham on the other hand was brilliant i would love to see a 2 made with the same cast but for me less of miranda,comedy
