would be a definite favorite of those who like highfantasy movies the movie is very hilarious being a parody and action packed the stunts go beyond our imagination can you ever imagine someone using a buddhas palm as a deadly weapon sequences like these would be liked by many wushu loversfun is when we see the most ordinary of the people turning out to be real kungfu mastersthe story is about a wannabe kungfu maestro who uses up his pocket money saved to become a lawyer to purchase a kungfu book from a street vendor he puts in a sincere effort to learn the technique from the book but is unable to learn the art his hardships as a child makes him lose faith in being a good citizen and so he wants to become bad he tries to join the axegang which is the most notorious gang in that locality in order to impress the leader of the gang he is asked to secure a kungfu master called beast from the prison beast is being brought by the axegang as they fail to destroy the people in a particular housingcomplex who insult the gang the landlady of the complex and her husband are also kungfu masters but we come to know about it only during the middle of the movie all the fight sequences are interspersed with a lot of humor all in all a great movie to watch for the entire family,comedy
i was blown away seeing this movie i rented it without any expectations you should also probably do that but the screenplay and the build up is great the music and special effects are top notch the land lord and land lady have done great not to mention the axe gang boss and his side kicki particularly enjoyed the sequence where the musicians use the musical instrument to fight the background score and the special effect combination in this sequence is great you should definitely appreciate the directors imagination in this sequence the movie is also very funny consider the comment by beast when he exclaims  i do not know lions roar could be done with the speakerthis is a great entertainer,comedy
this is a true kung fu movie i know therere a lot of kungfu movies out there but imo and thats coming from someone who read hundreds of kung fu novels multiple times this one finally got it right crouching tiger hidden dragon may have got the physical form right hero may have got the mood right house of flying daggers may have got the romance right but got the kung fu right or rather the wu xia right youll probably have to wikipedia the word  since it holds a lot of meanings the movie has some brilliant scenes with exquisite form and style like the three masters face the two musicians scene and toad fight scene however its the other parts that shows they truly understand kung fu like how the true masters would rather live in pig sty alley than going out showing the world what theyre good at how a boy with humble backgrounds can eventually become the best martial artist and especially the ending when the beast asks what is the name of your technique and he answers you want to learn i will teach you that is a very taoist thing to say just that one line could win me over kung fu may seem like its about fighting and winning but actually its also about teaching preserving and spreading and in kung fu tradition the latter may be more important than the former mortal enemies dont have to stay as enemies they are really on the same side in the pursuit of great martial art provided they no longer run around trying to kill people its an art form first fighting skill second what impressed me most is they delivered this rather serious topic in a simple fun and cool way i highly recommend this movie,comedy
stephen chow has been a thorn in the side of hong kong critics for more than a decade now  his main claim to fame is his ability to resurrect cantonese comedy in the era of the increased sophistication of the hong kong new wave cantonese comedy is a style of low slapstick  benny hill is a good western equivalent  lots of lockerroom humor and farting in chow has managed to increase his general level of sophistication and at the same time use computer graphics to construct a film that is totally fantasy i found it amusing fu purists will object that there is naught but wireworks in the fight sequences but this isnt really a kung fu film its really a comic fantasy similar to mel brooks blazing saddles in the lightness with which it treats its subjects not for all tastes but as i am hardly a chow fan i think the fact that even soeone who doesnt like chows brand of comedy could like this film says something positive about italso there are enough references to classic fu films to satisfy the purists  as long as theyre looking for a comedy and not a fu filmlook the special fx are good and its a funny film really grows on you with repeated viewings,comedy
fun moviereally goofy and silly but thats what theyre trying for so no complaints the actor who played beast the old evil master with a wife beater tee shirt is an oldie but goody i remember watching him in some of the old kung fu movies from the late 70s and early 80s he was obviously a lot younger then if you like this guy then check out my kung fu 12 kicks or iron fingersthe rest of the cast was fun it almost seemed as if they were poking gentle fun at the old shaw brothers kung fu movies with a bit of modern day lingo mixed in for good measure if youre in the mood for a funny combination of matrix five deadly venoms and bugs bunny then this one might be a winner,comedy
this movie is really cool the basic plot involves a guy stephen chow who wants to get into the axe gang in circa 1930 shanghai by impressing them with how much of an arch criminal he is he decides to pick on an apartment block inhabited by the working poor and triggers a massive confrontation between the landlady of the block and the working poor on one side and the axe gang and their hired thugs on the other both sides turn out to be more than they seem and the confrontation quickly escalates into a battle filled with chinese magic and fighting artswah yuen steals the show as the ironfisted landlady marching around in a silk house robe hair in curlers puffing away on her ever present cigarette while shouting orders really a fun fun movie to watchmy only complaint is that some of it is a little hard to follow and i would blame that on the translation the movie was made in chinese and i generally watch foreign language films with the subtitles rather than dubbed because i like to hear the way the actors sound when they are saying something while i read the subtitle but the subtitles didnt quite seem right so i switched to the dubbed version and that didnt seem quite right either so i watched it dubbed with the subtitles and half the time the dubbed spoken english didnt agree with the english subtitles so a really crappy job of translation makes this a 9 instead of a tenother than that the acting the visual effects the camera work the choreography the comedy the story are all first rate and make for a spectacular show,comedy
i am no big kungfu movie fan but this really doesnt matter as this is not a kungfu movie  at least not in the sense that hero or the tiger and the dragon were this movie is pure joy and the kungfu setting is merely incidental i watched this movie on the plane and it was so much fun that i think i kept the other people in my row awake because i was laughing aloud the whole time the gags are very well made the whole tone of the film is very tongue in cheek but absolutely not pretentious and although the humor is unpretentious and very visual it is by no means slapstick there are clear goodnatured references to other recent movies but this movie is not a parody or a satire in fact i find it hard to classify this movie it is neither highbrow nor lowbrow it is neither steve martin nor leslie nielsen this is john candy and steve martin together as in planes trains and automobiles with action scenes directed by james cameron it is one of the funniest action movies i have ever watched i highly recommend it to goodnatured funloving people i would watch it again over and over i believe this is going to become a cult movie in the future it is utterly original intelligent and lovingly made,comedy
stephen chow eh i was to be convinced having read so many good reviews of shaolin soccer i got the dvd what a disappointment i thought it was terrible not funny not enough football and terrible special effects how surprised was i when a friend convinced me to get on dvd expecting it to be rubbish i sat cynically money wasted what a surprise  funny and entertaining the kung fu was spectacular the bad guys interesting the fights were masterful  i have been convertedfantastic  maybe this stephen chow has some talent after allan entertaining couple of hours 810,comedy
this stylized kung fu kicker by stephen chow shaolin soccer features chow as a hapless gangster wannabe who seems to be unlucky in any endeavor or scheme that his warped mind can come up with he aspires to join the axe gang a notorious syndicate making a move on a local neighborhood but the crazy tenants have a bit of kung fu magic up their sleevesis a wildly imaginative and engaging actioncomedy whether knocking you dead with its slapstick comedy or making your ryes bugout with its amazing highly energetic action sequences hustle will surely please anyone fond of this brand of film most of the sequences must be seen to be believed the outlandish visual style makes for many exciting sequences i almost passed this one up due to poor trailers but am really glad i gave it a shot is a really fun flick,comedy
kung fu movies are inherently ridiculous with their balletic indulgences this movie exploits that constant over the top action with slapstick and looney tunes gags i laughed out loud during the husband beating the inept knife throwing the road runner chase and the pinball battle scenes everybody knows some kung fu from the frumpy landlady and her wussy man to the beast who looks more like a florida resident than a master but like all great comedies this movie pays tribute to the same movies it jabs at the fight scenes in this movie are better than any american knockoff the special effects and sound effects are quite good because action needs sound and those stylish snapping noises are here whenever anyone is hit this belongs in the same class as the princess bride and shaun of the dead,comedy
im bill springer and heres my final thoughti wanted to see this in the theaters like really bad but im poor in the fact this economy sucks and my parents hate me enough to not give a crap about me seeking entertainment at the cost of 850 soooo long story short im raking in the cash now and i bought the dvdalright my expectations were greatly exceeded it is a perfect mesh of kung fu comedy and it even threw in a back story or twoa purpose which is always good just imagine this dragonball zminus the the shiny kamehamehas mixed with and gang related movie wrapped in a loony tunesque shell thingy its worth the buy if your into the whole being entertained thing i know who in the world would want to be entertainedsarcasm now go to sleep right now or im taking away your toys and giving them to the boogyman in your closet sweet dreams,comedy
kungfu hustle where to begin well for starters actor and director stephen chow is quickly becoming one of asias most beloved screen comedians at 42 and already a veteran of numerous comedies chow finally broke through to american audiences with shaolin soccer in 2001 now he brings forth this comedic vehicle kungfu hustlethis movie has it all slapstick comedy thats right out of a looney tunes short martial arts and dazzling spinkicks and armtwists that are all courtesy of yuen wo ping the matrix crouching tiger hidden dragon in this picture which is set in 1940s shanghai china before the revolution chow stars as sing an aspiring gangster who wishes to join the notoriously lethal axe gang the axe gang rules much of the citys underground with an iron fist and their demands are absolute but the accidentprone sing and his chubby companion played by chi chung lam wander into pig sty alley posing as axe gang members the axe gang doesnt bother with this slum very much because its so poor and plus its already under the tyranny of the vicious chainsmoking landlady qiu yuen who runs things along with her husband landlord wah yuenthings become complicated when the real axe gang shows up and the gang is attacked by a trio of kungfu masters who had been living there the axe gang members are quickly defeated in the ensuing chaos while sing and his companion are captured by the fleeing gangsters the two are allowed to join but are demanded a deed of loyalty  kill someone for the next 45 minutes or so chow is off the screen and we focus mostly on the tenants of pig sty alley as the kungfu masters square off in dazzling skirmishes with axe gang acolytes who are masters themselves landlady and landlord are also later revealed to be masters toochow reenters the picture and remains on the screen until the closing credits where he donning a white outfit a la bruce lee himself takes on the remaining gangsters in a freeforall reminiscent of the crazy 88s scene from kill bill as it turns out he is a kungfu genius in that hes had the power to master martial arts since birth i must say chow does display some impressive moves of his own he then does battle in the films most overthetop sequence with the beast hsiao liang who is the most feared kungfu master of them allthis is a brilliant actioncomedy from a mind that seemed destined to bring forth something like this to the masses the film plays out a lot like a collision between every great martial arts movie weve ever seen and then adds a heavy dose of slapstick and chows sly wit youll laugh at chows comedic antics as every great kungfu flick gets its fair share of comedy its just kind of funny since i was watching enter the dragon 1973 last night which is considered the greatest martial arts movie ever and then today i watch kungfu hustle which could be called one of the greatest parodies of the genrethough some of the humor might be lost on american audiences i found myself laughing quite a bit it definitely caught on to me as chow also pays sly homage to his heroes both bruce lee and jackie chan who made the genres chow pays respect to its all done in a deliriously comic fashion that also doubles as a visual feast for the eyes the film also contains a rather touching subplot with a mute girl sing once saved from bullies and it really got to me because of the cheesy music that cues up whenever they are on the screen togetherkungfu hustle is one of the best pictures ive seen this year so far i expect well see a lot more of these types of pictures that are going to be cherished by a devoted following in the future stephen chow has crafted a funny brash and actionpacked picture thats sure to remain with the masses in the coming years1010,comedy
its somewhat difficult to regard this film as a black comedy so to speak since the humor is far too light and abundant however in it very little are some rather serious and touching moments steven chow does a fine job of directing and manages to make this hodgepodge of looney tunes humor added with a touch of tarantino and matrix work in addition he plays the part as sing  the neerdowell who finds his calling but wah yuen and qiu yuen steal the show the action and laughs are aplenty disregard the films defiance for the law of physics just sit back and enjoy what may be one of our finest in quite some timetruly a gem how i wish it would have found its audience,comedy
hilarious plot i really dig stephen chows sense of humor this movie has matrixs special effects but with lot more funny scenes it might appear a little stupid if you are new to stephen chows style but no worries once you get a hang of his dark humor you will really enjoy it after all he is ranked way up there in hong kong entertainment arena along with jackie chen and jet li as far as popularity and gross income are concerned i enjoyed this movie a lot more than house of flying daggers which is a little confusing and characters motives are unclear this movie however makes everybodys intentions every clear it just makes you anxious to find out who is gonna kick whose ass in the end i also like the love story briefly intertwined with the action scenes the quick flashback of stephen chows character wins you on his side at early stage of the movie so that you like his character despite of all the bad things he does it especially makes you feel good when you see him kicking someone elses ass for a change in conclusion i love the movie i guess i better clean up my dvd shelf and find a spot for a new member of my collections,comedy
its a whole new set a whole new look at a movie a whole new genrei dont think its action adventure or comedy no it has its own genreand damn did i liked it  10 superior no more to say if u like jackie chan jet li and u expect that this is the same kind of movie youre wrongit contains everything that u wouldnt expect in the beginning you would think damn what a strange movie and you will laugh at the scenes but at the end it will make you think like what a masterpiece,comedy
the last few years have seen many excellent chinese movies ranging from historical dramas as in the emperor and the assassin to brilliant action movies hero house of flying daggers comedies like shaolin soccer thrillers like infernal affairs and moreis the next step of what i consider the growing up of the chinese film industry gong fu is an action film full of some of the finest martial arts you can find but it does not stop there latest cgi and cinematic effects are deployed with ease to make the experience truly magnificent this part could describe a well made but typical hollywood action production but gong fu grows beyond that incorporating very satirical elements that make this movie a treat if you are a fan of kung fu movies or if you are a critic this film can entice both as it presents a delectable parody of the genre without taking itself too seriously in so far it accomplishes what hollywood has lost somewhere along the way the ability to make a funny and inventive movie that is filled with little thoughtful vignettes to discover while still appealing to a broad publicthere are scenes which are so overdrawn that they become surreal moments when you can not believe what is happening on screen typical clichs like bad synchronization so common in past chinese movies are delightfully played upon in parts of the movie i was even reminded of scenes from dragonball z and other anime but underneath it all gong fu does not hide its social critique and puts the finger on several points that might hurt if you think about themoverall this is a movie for nearly everyone providing gags and entertainment if you just want to relax and little hints and thoughts to contemplate if you are of the thoughtful persuasion in my opinion it is one of this years top movies recommended,comedy
right from the start i was under pressure to like it the cast the director and everything thats already been said not to mention that its an asian film and im a huge fan the other reason i was under pressure was that my girlfriend loves the sun and this was the hottest day weve had in edinburgh all year it was the peak of a hot week and she let me take her inside to a movie an asian movie no less the cinema was empty the two of us and the projectionist  although it was all digital so who knows if someone was there and when the movie began i just wasnt surethe movie opens strong with a wonderful mix of visual styles and periods the sets give the feel of a western and the gang clothes give the impression of 50s america with the police looking just like police today these opening scenes are pretty strong loud and violent and so my expectations were whipped in the opposite direction as an axe murder and shooting rivet you to the spot thats when the dance number begins and youre whipped in another direction nervous laughter ensuesi think that paragraph defines the film quite well not that you really can define it but if you imagine genres and styles as straight lines traditional movies will pick one at the start and pretty much stick to it yes it might flip back and forth from its neighbour but what it wont do is weave a crisscross path back and forth between them all thats what appears to do it grabs from different styles genres and movies and pulls them together in a rich weave of a movie something youre not really used toafter that the movie comes to the current period and begins the story in earnest the laughs start from the beginning but to be honest we were still reeling from the opening and being thrown back and forth at this point i wasnt sure whether i was laughing because i thought i should be or because it really was funny i didnt know what mode or genre i was supposed to be inwhat quickly happens though is that you forget that standard youve been conditioned to expect by those endless reams of movies youve watched and suddenly out of nowhere youre enjoying the ride then you really do start laughingafter all i would really describe this as a comedy but it also brings you some amazing kung fu mixed with hollywood blockbuster effects a smidgen of a love story and a tiny bit of thriller its also a huge tale of good and evil and what it does take to be truly one or the other yeah but its still a comedy and one that pokes a finger at hollywood in the processmost of the humour is bizarre and off the wall and im not sure thats entirely down to the culture difference i wonder if even asian viewers would be feeling some of what we did during the early parts of the movie however it works it really does it grabbed me and made me laugh and i was often laughing at the movie itself and not the storythe story is great fun and its a massive story at that not just some small tale but an epic this is as the young boy is told about saving the world its that big with that im afraid thats all im going to say if you want more on the story read someone elses review and have it all given away or go and see the movie and revel in the first time viewingthe fight sequences are something else theyve done an amazing job to make the fights so seamless and to be able to visualise the effects during the choreography the fight scenes coupled with the stylistic effects they provide some breathtaking scenes all fantastically choreographed by sammo hung kambo and managing to keep a good feeling of fun throughoutapart from being surprised by the scale of the movie the huge effects and the excellent fight sequences the acting was pretty damn amazing and not just from one or two of the actors but from everyone not one of the actors stood out as being out of place and not a single one seemed to be dwarfed off the screen by the sheer number of actors around them i have to say that my favourite is the camp kung fu master the way he slipped from complete mastery of kung fu and strength of body and mind to his camp character running around the set was superbly entertainingstephen chow is totally natural in his role and plays both sides of his character extremely well never mind the fact that he cowrote directed and coproduced too hes pulled out a stunning performance with an amazing moviereally i dont think i can find any fault with this movie because there is so much to it i could keep writing about it and praising each individual element actors effects story but the beauty of this movie is that it is so much all at once its that rich weave of so many styles and genres that i already mentioned think of it as a beautiful dress you cant dissect it and being to critique the individual strands of the weave you loose the beauty of the dress and of seeing it being wornif that sounds cryptic its supposed to i cant give you anymore than that you just have to take my word for it that this is a stunningly good movie for so many different reasons relax let it flip you around and enjoy,comedy
i can say this was one of the best movies i have ever seen the most amazing thing of this movie is originality a great sense of humor wonderful kungfu scenes comedy romance and hilarious fun it is something like killbillspidermanadamsandlerit is not a well known way of storytelling which gives you an unexpected way of having fun from a movie in these days that hollywood cinema is suffering from lack of original ideas these kind of independent movies will continue to nail us in our seatsall apart stephen chow is brilliant with his acting directing and writing he will fascinate us with more movies i thinka definite 10 out of 10,comedy
what a fantastic movie humour by the truck load brilliant direction and a well paced rendition of the good guys v bad guys genre the fighting scenes are the best ive seen since the original mortal kombat and throw in a great plot and youve just spent a great night at the movies i have to say though that living in scotland as i do mrs landlady reminds me all too easily of scottish women  and i mean that in the nicest possible way stephen chow was 42 when he made this film how on earth does he look so good he seems to be a special effect all to himselfgo see it  go rent it  you will be regally entertained,comedy
