was really funny and entertaining it was really exaggerated but not in a corny way i would definitely recommend it its a good movie to watch with friends its like napoleon dynamite with more plot and energy in chinese its not only fighting but romance and comedy i only saw one scene the scene with the harpists and i had to see it i knew it would be good the violence isnt gruesome either so its a fun movie to watch its not very predictable either if you liked kill bill 1 or 2 then you should definitely see i cant wait for the second one to come out it should be in theaters in spring 2006 its called 2,comedy
this film really surprised me in a good way i didnt know what i was getting into when i saw the film on dvd i thought it would be another crouching tiger hidden dragon but instead turned out to be an animatedlike comedy whats amazing is that this movie is dependent on cgi but the cgi is only there is move the story along not be the story it blended perfectly with the action sequences which were ingenious and believable and the fact that in this cgi environment the acting was natural is even more surprising kudos to director stephen chow for giving us a perfect blend i really also enjoyed how the story progressively gets out of hand and by the end of the film the action sequences are so enormous and spectacular you feel like you just want more and more hopefully theres a sequel brewing i definitely would see it,comedy
he may not be orson welles but asian wunderkind stephen chow isnt about to let that slow him down he wrote produced directed and even opted to star in the film which pays homage to the very genre it spoofs delivers this typically stagnant spring movie season a desperately needed kick to the funny bone while chow received minor acclaim with his last directorial effort shaolin soccer it is hustle that will likely make moviegoers around the world stand up and take notice of his myriad talents chow plays sing a wayward young adult trying his hand at mischief he longs to become a member of the widely feared axe gang a routine grift in pig sty alley leads to a huge brawl between the axe gang and a band of local kung fu masters pandemonium ensuesthe script while inventive is hardly the driving force of this wickedly maniacal picture chow has created what could best be described as a living cartoon the theatrical scenery musical numbers and outlandish camerawork somehow fuse together perfectly leaving the audience both startled and riddled with laughter the fight scenes are a bit lengthy especially during the last act of the film but thats to be expected and while the jokes dont always hit home the ones that do are truly hilarious while technically a foreign film will likely speak to most audience members through its universal languages of humor innocence and unbridled zaninessrating b,comedy
in his 7th directing effort stephen chow has created a exciting moving nostalgic ride that leaves you reeling from beginning to end one of chows primary objectives in this film seems visually stun the audiences filled to the brim with exciting action dramatic violence sophisticated camerawork and some of the best sight gags ive seen is no doubt a feast for the eyes so much visual action seems to be possible because at its core this film tells a very simple story it is deep and emotional but simple nonetheless the only part i found visually inadequate were the cgi sight gags their comic timing was right on but the quality wasnt as good as it could be pulling me out of my engagement with the storyif visual beauty was chows primary objective in this film his secondary certainly seems to be to pay homage to his favorite films contains countless references to american culture and films stretching from the 30s and 40s top hat 1934 and casablanca 1942all the way up to blockbusters of the past few years spiderman2004 and matrix reloaded 2003 this is not to mention the roadrunner legs that sing and landlady dawn and the assassins striking resemblance to the blues brothers this film is simultaneously like nothing ive ever seen and a highlight reel of great moments and references to movies i have seen and love stephen chow loves american film and he knows we do tooit should be said here that anyone can create a montage of their favorite movie moments clump them together and call it a movie what chow does in exemplary fashion is incorporate these moments and reference together into a story keeps us emotionally invested from beginning to end with plans for a sequel in the works chow may well prove to be a master of blending comedy action and drama together all while maintaining artistic integrity and keeping the audience nostalgic and loving it,comedy
i dont think i have seen a movie this funny in a long time in this day  age it is hard to have humor action  twists all in one that can be pulled offbut has it all the landlady makes this entire film a delight the story follows the axe gang vs pig sty valley the axe gang is one of those gangs who is fighting for territoryonce they arrive at pig sty things take an interesting turn of events i cant wait for 2 i will be sure to run just like the chase scene all the way to the theatre in order to be the first to see it if you see any movie on the big screen on dvd or on tivo make sure it is kung fu hustle,comedy
this movie is now my favourite movie of all time what a great movie it doesnt happen very often that a movie makes me feel this way for a long time i had three favourite movies which were fight club requiem for a dream andmomento now has stolen that title this movie has everything in it great humor action and a little bit of love thrown in for good measure i was laughing so hard at the knife scene my eyes were watering ill admit it started a little bit slow but then it definitely turned it up a notch and never looked back id like to thank stephen chow for making such a great film a have you ever killed anyone before ive always thought about it,comedy
only my reluctance to give anything a perfect ten out of ten stops me from rating this film ten what an absolutely awesome flick i just saw it with my husband and i cant think when i last saw a movie i enjoyed this much it had the whole package  style innovation solid and often sympathetic characterisation romance martial arts good guys bad guys comedy great cinematography pathos go see it now god i loved this movie i thought hard trying to come up with a single criticism and this is the best i can do  on occasions the incongruous sound effects are more distracting than effective thats it theres nothing else wrong with this movie,comedy
i have to confess to being a little perplexed and intrigued by the trailer for this film and was certain that it had to be checked out what an original and amazing film it was rejuvenating the kungfu genre in its totally out there form funning startling and at times plain cute this really was an adventure at the cinema go see if for yourself chow uses special effects in a masterly fashion like a painter with a vast and varied palette the cast are spectacular and their puny looking bodies make the stunts that much more exciting the landladys facial expressions are the stuff of acting genius in fact the whole look and feel of this film are truly wondrous,comedy
when i bought this movie i was expecting a chuckle or two and to see some pretty good fight scenes this movie went beyond my expectations and has to be one of the best movies i have seen all year the comedy had me laughing out loud the fight scenes were jaw dropping and to top it all off it even had some touching emotional scenes as well this movie has it all and it comes not from the united states but rather the far east where they seem to keep making movies that i thoroughly enjoy this movie has a gang known as the axe gang terrorizing nearly every corner of the city save for the areas that are poor that is until an aspiring man who wishes to join the gang literally brings the gang violence to this peaceful little slum town with its many colorful characters which a few of the residents are kind of well versed in kung fu we get to see this young man make several stupid mistakes and he seems sort of a klutz but there also seems to be a hint of greater things assassines are sent to deal with those who fought the axe gang and we get a very strange musical combo and a man who is so well versed in martial arts he is known as the beast great fights ensue but as for the comedy the best part has to be sings the man who wants to join the axe gang assassination attempt of the landlady of the poor town so if you like asian cinema and are in the mood for a movie that basically has a lot of laughs and action then this is definitely the one to check out,comedy
is a chinese film in cantonese and mandarin with english subtitles the film is set in the 1930s in china and is about sing a young man who tried to be good as a child and got bullied and now decides that he wants to be bad and wants to join the evil axe gang that his terrorizing an alley housing complex and killing many of the residents the axe gang finds out that the landlady and the landlord both are great martial arts fighters and they plan on protecting their housing territory so they get a legendary martial arts fighter as well named the beast to kill them in the end sing has to decide whether or not he wants to be good or bad the film blends action comedy and even romance together while using cartoon like martial arts moves winner of the hong kong film award for best action choreography best editing best picture best sound effects best supporting actor wah yuen who plays the landlord and best visual effects at the hong kong film awards and the hkfcs award for film of merit at the hong kong film critics society awards has good direction a good script good comedic performances by everyone involved good original music good cinematography good film editing good production design good art direction good set decoration and good martial arts choreography and visual effects blends together action comedy and romance and it all comes together and works very well the martial arts scenes are like watching classic childrens cartoons and the fight scenes along with the rest of the film are clever inspired and very imaginative the film is also a very good looking film and is nice to look at and the film has an entertaining story and is a lot of fun the film is like a big popcorn movie but it is made much better than your average popcorn movies and as of this year it was the foreign film with the highest cinematic release in north america even though the film has subtitles i think this film will appeal to a lot of people just because it is very fun and entertaining and very creative one of the most original films of the year and one of the best,comedy
are you bored do you live a boring life do you want something different in your life i recommend this go to the movies oh dont fret i know that lately the movies have been nothing more than a lot of disappointments mind numbing horror flicks and romantic comedies starring grade a actors of course if you live a boring life that means you do not have that significant other as of now dont fret watch yes i know it looks totally weird different and stupid but there is one sure thing this is one of the most entertaining movies in a very long time you do not need to actually think much but just sit there and be blown away by the visuals laugh your butt off at the physical comedy admire the jawdropping fight scenes and also get tearyeyed at the sentimental scenes is 95 minutes of fastpaced inyourface action that leaves you with a smile on your face throughout the entire filmfrom the first scene to the last you will be seeing things that you do not see in regular films for starters the beginning of the movie features a dance sequence involving a gang of professionally dressed axecarrying assassins is about a wannabe gangster trying to join the axe gang while the axe gang is having trouble with the strong citizens of a certain deserted area outside the city throughout the film you see the main character try whatever to join the gang and you will see the gang go to extraordinary lengths to teach the landlady and the landladys husband a lesson what makes this movie so great is that the movie combines good oldschool kung fu action with excellent visual and special effects and also a few action and chase sequences that look like they were ripped off of old warner brothers cartoons the plot is very simple and easy to follow but it will be all the chaos that will lure you into the filmfighting more fighting countless fighting it is all there whether it is one man against an entire gang a few citizens against blind assassins wielding a deadly musical instrument an insane man against a powerful couple a very loud lady against her husband or an oldfashioned brawl amongst the citizens just for the sake of fighting will deliver so much action it parallels the actionpacked kill bill volumes 1 and 2 and then there are the looney tunesstyle scenes the visuals shine during these scenes especially the chase between the landlady and the main character sing played by the directorwriter of the film stephen chow mostly the cartoonish action is for humorous moments but at other times the style of fighting also became serious at one point it even resembled dragonball z the infamous anime that stretched a plot to incredible lengths 20 episodes it took just to show one fightwith most good allaround films you also get your sentimental moments as well with this film there is this sad scene with sing and his bitter past and how it shapes up his personality there are other moments but id rather not spoil them for you the acting is not the worlds greatest but like most actionpacked films it is not necessary as long as there is enough going on to keep you on your feet there is a lot of slapstick and physical humor that makes up for the lack of jokes involving dialogue so if you are the kind that does not laugh at a typical businessman beating down two wannabe assassins or a guy throwing a knife at a woman only to have it bounce back and stab him then you are not going to find this movie as funny as other people wouldbottom line one of the best films in a very long time very well directed plenty of effort was put into this and it pays off plenty of action comedy and also with a dab of good music and drama fills the bill as the 95 minutes watching this is much better than just watching the typical twohour movie i had a lot of fun watching this reminds me of the old days when i would watch cartoons that have no plot whatsoever but did not matter because they were just fun to watch over and over again surely this film will not get the box office success that it deserves because it is too goofy for people and some teenagers and adults will fear that their ego will be tainted if they are caught watching this come on everyone watch this foreign masterpiece and do the hustle score 1010,comedy
stephen chow managed to blend irreverance and poignancy action and introspection violence and comedy satire and personal belief very very well in and this movie doesnt play like your mainstream fare some real thought and imagination went into the making of this movieone of the best and oddest bits was the scene introducing the axe gang seeing the axe gang members dancing showgirl style in tails and top hats was a unusual eloquent amusing way to express the power arrogance money and style they possessed at that stage in the movie the fact that the hero is not the main focus of half of the movie was also very refreshing looney toons style hyperbolic action scenes havent been used that humorously since blazing saddles and the resolution of the final battle was so different and cool from any other action movie i almost fell out of my seatlastly i enjoyed the political commentary embedded in the movie the riff by the bad guys if youre not with us youre against us as well as the lifestyle choices made by the heroes were notsosubtle jabs at current us foreign policy,comedy
as a movie viewer i am very hard to please there were maybe 6 films out last year that i liked so you can tell im not just saying this when i tell you that was awesome its funny its entertaining its exciting its a stephen chow movie like chows other films the plot is a typical good guys must fight bad guys story but the plot isnt what youll remember the cartoony slapstick and parody is topnotch stuff anyway the people in pigsty alley must defend themselves against the axe gang and its seemingly endless supply of assassins like a buster keaton film this thin plot is used to set up as many gags as possibleand for those who loved this check out chows shoulin soccer in america dubbed as kung fu soccer and god of cookery,comedy
while heading to the washroom during a storyline in the movie i was asked by the attendee how the movie was i replied like matrix meets crouching tiger and the three stooges it was everything merged into this new kung fu style dancing bad guys in the style of the sinatra era fantastic visual effects and just the right amount of comedy to morph it into what could already be considered a classic in its genre theres nothing more fun than a chow movie in this respect id love to see him continue to reinvent the classic style into something new like this more people will be turned on to a new brand of filmmaking mixed with an old style,comedy
the story about a village in china a group of black men and a man named sing to start kungfu hustle begins with some gruesome action which makes you chocked although it is a comedy it has blood in it but honestly  this movie is completely outstanding if theres one as fantastic as this one its got to be shaolin soccer while this movie blows your mind totally it is the cause of stephen chows inspiring directing and variate acting every scene in this movie are wellperformed laughable but in a good way of course  and totally astonishing its awesome that you automatically feel youre sucked in to the blending story with kungfu action comedy and almost crying cutscenes in other words a good mix of imaginative and wicked fights are round the corner all the time an theres always sumthin to look forward to a definite 1010 scorerating by me enjoy the masterpiece,comedy
chow uses a celebration of classic genres to take his viewers on a farce of truly epic proportions from serigio leonne to warner brothers cartoonsnothing is left out and you really do not mind being taken along for the ride it does not take a psychic to see where the road in this movie is going yet though the scenery may be obvious it is very enjoyable hilarious comedy mixed with action kung fu mastery road runner styled chases and unfortunately all to short dance scenes saw this with my 18 year old son and though he was reluctant to go see this particular film he was nearly choking on his popcorn from laughter though this is a film very unique these days i am afraid that it may receive limited screen time as you do have to read the movie as it is done entirely in chinese,comedy
its time hollywood and the public stand up and realise what a genius stephen chow really isa vibrant comedy with beautiful colours and cinematography i loved every second of it the action is out of this world very similar to the final fantasy games with special moves and what not but the movies winner is the movies charm and endearing characters each one has there own individual flawsand dare i say it better than shaolin soccer which i never thought was possibleif we had more talents like stephen chow in the western world i probably wouldnt have to sit through churn like boogeyman and be coolsought yourselves out hollywood you have a lot of catching up to do,comedy
stephen chow sing chis may be the most satisfying filmgoing experience that hong kong film enthusiasts have dreamed for in recent years some viewers may attribute kf hustles greatness to hong kong film industrys lack of quality production in recent years thus enabling kf hustle to shine through i dont see it this way i believe the films success owes mostly if not entirely to its own meritsi grew up watching hong kong hk movies when i was a kid i cherished what i saw on the screenbeing a child was great and hk cinema was larger than life to me as i entered adolescence i lost most of what i cherished action sequences that once took my breath away started looking cheesy compared to the latest blockbuster revered performances started to pale as they were mimicked as i understood more about life and how movies were made i never saw movies the same way again i became more critical and i thought the joy of becoming one with the movie would be lost foreveryet i rediscovered this joy in perhaps for the first time since childhood why is kf hustle able to deliver the joy of pure entertainment to a broad range of audiences from innocent kids to mature grownups that is to say how could watching kf hustle enable an adult such as myself to take a trip back to childhood remembering what it was like to truly cherish a film i believe this is the result of several important elements employed by the film firstly stephen chow in making a film in the new millennium has not forgotten the old ways the scenes in pig sty alley employ a background score reminiscent to those in traditional martial arts films from decades before in addition chow selects several classic kung fu actors as homage to the golden days of the genre including bruce liang beastone of several bruce lee clones in the 70s who is perhaps most remembered for his roles in fist of fury and legendary fok tv series and longtime sidekick yuen wah landlord these slick blast from the past strike a chord with older audiences while still managing to be refreshing to the younganother element that makes this movie such a tourdeforce is the transcendence above genre conventions kf hustle embodies the quality of a martial arts feature a comedy an action flick and occasionally borderlines a scififantasyspecial effects extravaganza in fact kf hustle is all of this and none of it what it is is nonstop exciting and unpredictable entertainment the whole way through never letting audience involvement slip when theres action you never want to blink for a second when the action isnt on there is always comedy suspense or complex drama to keep us involvedin my book stephen chow in crafting has reached the peak of perfection in filmmaking in the ride i was able to suspend my belief and feel chows magical world the very same way i entered the universe of my fondest childhood films without critiquing little details and that is just what we need sometimes1010,comedy
ok i dont usual post comments or my own opinions here but this movie definitely deserved my songs of praisei loved every single aspect of this movie the slapstick humour was at times unbearably funny the cgi and action sequences were on a par with the matrix just looked better in kfh to me with the amazing asian art direction the characters and acting were just awesome i loved this moviemy dad recommended i watch chows previous films god of cookery shaolin soccer etc which i did at the first opportunity and i have to say im now chows number 1 fan i really hope this gets the useu release it deservesfirst movie ever on imdb to get a solid 1010 from me,comedy
slow to start because of buildup  background this quickly moves from gory gangster flick  becomes the true comedy it really is the characters are often a little typed to standard but this is a spoof so that is to be expected  actually part of the mockery of the gangsters  martial arts fighters at which it is poking fun the gags are never tiresome some are hard to catch unless you are paying attention especially one where a character says something in english  the subtitle is in chinese i was sorry that it got the limited play in my area st louis mo  that it got an r rating i would let 13 yr old children watch this should have been pg13 the minute this one hit the stores i went out and got a copy if you like to laugh this one wont disappoint,comedy
and this one too i love this film ive recently watched this and boy was it hilarious and full of surprises and cool characters and their funny moves i like especially the ones done by the tailor and the old man and not to mention the fighting and action everything youd expect in a kung fu movie the main character who is a kung fu gangster wannabe is funny especially at the beginning when he challenges everyone at the slums they were all ready to fight but they denied him and i like the way the landlady who runs fast her moves were outrageous and the gay guy and the coolie they were all cool and they also have cheesy names as well such as coolie donut the beast etc recommended for all kung fu action fans all around and to fans of stephen chow watch it you know you want to and not to mention the funny references and movies they spoof expect to see references to the matrix the matrix reloaded the matrix revolutions top hat the shining spiderman kill bill shaolin soccer grand theft auto vice city and many more,comedy
