well it took him a long time to get there but eventually stephen chow who is currently the box office king of china got a movie properly distributed in the usa and it was his elaborate and funny kungfu homage although or perhaps because this one isnt family appropriate like shaolin soccer and cj7 it was the most successful in america of any of his films so farthe story takes a little while to get going because like all the chow movies ive seen this one has a multitude of characters who are somewhat developed first there are the three hidden masters men who have left behind the kung fu lifestyle to live among regular people but who rise to the occasion when thugs threaten the neighborhood the central character in the story however is the one played by director chow himself sing  a weak moron who imagines that he will become a wealthy criminal by joining the notorious axe gang hes accompanied by equally slowwitted but loyal bone chi chung lam in addition to all these heroes the landlady qiu yuen and landlord wah yuen are so dynamic and entertaining that they threaten to steal the movie and there is a series of genuinely creepy and bizarre villains from the mambodancing crime boss kwokkwan chan the two harpists who kill with music and the seedy deranged veteran master known only as the beast siulung leunga lot of people are going to talk about this film in terms of kung fu but im personally more interested in the philosophy thats expressed often through humor rather than the actual fighting chow seems to favor a fantastic style of kung fu that is accomplished through computers anyway and hes never had renown as a fighter what he is and deserves to be famous for is his wacky sense of humor and his ability to convey offcenter perspectives as is usually the case his hero here is a character who is more than just humorously flawed he manages to make us more comfortable with the ghetto environment of pig stye alley than we are with the plus and westernized surroundings of the axe gang this is a very impressive film in terms of the way that the design in the sets and the costumes came together to reinforce and heighten the directorwriters goalsmy only regrets about the film is that it feels a bit overstuffed perhaps too processed they really felt the need to get so much into this package that sometimes the story seems to get lost i dont think chows character takes enough of the center stage and the romance is perfunctory you could say that its primarily a comedy so those things shouldnt matter or dont need a lot of time but they still didnt work for me as well as they did in the case of shaolin soccer where i felt the story itself and the characters were more vital its hard to look at this movie as a thing in and of itself it often refers to other chow films and also to various kung fu classics so i think theres a bit of static or conflict between various aspects of the homage and the actual story of the film,comedy
i dont even know where to start since this is a kung fu movie i guess ill start from fighting scenes the fighting scenes in this movie looked like a mix of jet lis fighting scenes with dragon ball z fights though this movie often looked more like a parody but still the fighting scenes were great talking about a parody this movie spoofed all the most known kung fu films exept maybe the drunken master even plot was very typical for 70s kung fu films and in one scene the landlady qiu yuen was imitating bruce lee this movie has everything action comedy romance and even crime movie elements it would be interesting for kung fu fans and for comedy fans also stephen chow is a very talented hong kong director and if you liked this movie you should check out his other movies,comedy
ive been meaning to put up a review of this movie after i originally saw it during its cinema run and loved it watching this movie again on sbs tv the other night gave me a chance to check out whether the movie had stood up as well as i remembered it has for a lot of recent hollywood movies ive reviewed here recently and given good scores to say 7 or more out of 10 i have had one quibblewould the movie have repeat viewing value in the case of many hollywood movies i liked like say transformers or iron man etal the answer would have to be no is thus getting full marks for meit has repeat viewing valuenot sure if the intro to the tv version movie toned down its openingi seem to remember the cinema release having a more gruesome scene than what i saw the other night or maybe its just not as brutal as i remembered in any case the opening serves to illustrate the brutality of a large and villainous group of criminals known as the axe gang who terrorise even the towns police forcenext we see two buddies sing played by stephen chow and bone played by chi chung lam who are small time scam artists trying to get financial advantage by pretending to be members of the axe gang they try their scam in a part of town that refuses to be intimidated by them somehow the real gang is drawn into their scam and the gang gets whipped by the residents of that part of town the rest of the movie concerns the axe gangs attempts to teach these townsfolk a lesson and the choice of sing and bone on which group to ally themselves withwatching the movie again i was reminded of how hilarious it was there were numerous laugh out loud moments for me eg the scene where sing tries to act tough with the townspeople but finds all sorts of reasons not to fight them hilariousthere is also a delightful romantic subplot concerning sing and a childhood sweetheart of his as wellthis movie deconstructsis a satire of kung fu clichs in fact whereas i found the seriousness of the unbelievable martial arts in crouching tiger hidden dragon too much to take seriously the even insaner martial arts in this movie were a positive joy its quite cartoony at times too reviews of this movie will often mention its debt to classic warner bros cartoons like the road runner etc91100,comedy
like hero house of flying daggers and crouching tiger hidden dragon this film has the spectacular and slightly ridiculous visuals as key but unlike them directorwriterstar stephen chow uses them for comedy purposes and does so very well set in the 1940s a town in china is ruled by the axe gang and sing chow desperately wants to become a member he stumbles into a slum ruled by eccentric landlords who turn out to be disguised kungfu masters sings actions eventually causes the explosive kungfu battle between the axe gang and slumlords only one side will win and only one hero will emerge as the greatest kungfu master of all also starring wah yuen as landlord leung siulung as the beast zhi hua dong as donut chi ling chiu as tailor yu xing as coolie chan kwokkwan as brother sum chi chung lam or lam tze chung as bone  sings sidekick and xiaogang feng as crocodile gang boss the visuals mostly are what made me laugh a lot including a running chase sequence with cartoon sound effects probably inspired from road runner and the battle sequences are fun to watch too a good action comedy it was nominated the bafta and golden globe for best foreign language film very good,comedy
you know those movies that you know nothing about i think i only saw one poster or something for it before i decided to see it i needed to pass some time before land of the dead and i though what they hey i like kungfu movies should be entertaining that may have been the understatement of the year i dont think i had ever laughed as hard in a theater as i did with this movie heck i dont think ive laughed that hard sincethe story revolves mostly around a failure of a criminal named sing played by director stephen chow some of the other main characters are the landlord and landlady of pig sty alley as well as the evil axe gang and of course the beast all of the characters are great and memorablethe story is very cartoony in some parts yet also a lot darker in others there are heaps of memorable scenes such as the knife throwing incident and the fights against the axe gang ive heard of it described as looney tunes meets kill bill i would have to say that is a pretty good way of summing it upand now onto the fighting man its awesome it contains many of my favourite live action fights scenes i would have to say trust me if youre looking for really cool looking fights look no further than this movietheres some good character development in the story tothis is a movie where stephen chow truly shows off every talent a director could have camedy drama action and of course random pop culture referencesalso if you like this movie you should also check out one of chows earlier movies the awesome shaolin soccer its done in pretty much the same kind of style except a lot zaniertheres not really much more i can say about this title except its one of my favourite movies and i would gladly recommend it to fans of the genre or even someone whos never seen a kungfu movie before1010,comedy
went into this one totally blind as to its contents truth is is that i was mooching round the shops yesterday and came across an asian triple pack dvd at a bargain price since one of the films was jet li starrer unleashed i thought it was worth the cheap price on offer got home and the write up on the back of the case didnt give much away as regards plot for an axe gang some guy named sing wants to be in the gang and that some creaky old residents in a place called pig sty ally are tougher than they lookwhat i got was what i can only describe as a live cartoon full of class and style the sort of flip side to the more arty asian films that have rightly become massively popular in this present decade written directed produced and starring stephen chow sing is a remarkably breathless piece of work the plot is threadbare for sure but it really matters not because chow has fused the grand old genre staple punch up with balletic comedy its quite something to behold its as loud as a face off between motorhead  iron maiden yet its just so flipping tender at the same time incredible sequences will dazzle you one moment and then have you laughing the next im quite annoyed that i didnt catch on to this film back in 2004 but even now some 4 years later this film is still a breath of fresh air on the silver screen see it and roll with it enjoy 910,comedy
this film is absolute genius no it wont win any oscars yes the acting is incredibly over the top and yes the plot and script make no senses whatsoever but if you switch off your brain and just enjoy the spectacle of it all it is wonderful the visual effects are fittingly caricatured and the characters suitably outlandish stephen chow has successfully married the comedy of buster keaton and charlie chaplin with the digital mastery of modern day effects to create something truly unique if you are a fan of old style physical comedy and jackie chan then you will love this film it is a fantastic saturday afternoon movie for all of the family,comedy
i typically dont watch kung fu movies ive seen a few jackie chan flicks but really opened me to the genre and it is mostly mostly on the basis of the humor and the plot that i appreciate it the story is based around the steven chow character a street kid who grows up trying to be a criminal while trying to ignore the fact he is really good when his actions result in the attack on a small slum and the deaths of three kung fu masters he must join up against the gang and the psychopath he helped them release from prison that there is where the movie really comes together that by accepting who you are do you ever receive inner peace its the cartoon humor and the mystical fighting styles that capture the attention without it the movie is just a message picture the plot and style highlight the movie very well and the humor is innocent making the incidents that much more funny even when they are preposterous i recommend this movie to anyone interested in seeing it,comedy
kungfu hustle is hilarious this was my first hong kong comedy film and it is definitely a recommendation to any new hk film fanstephen chow is perfectly suited for the coward he writes and directs the film flawlessly the special effects are a little on the cartoon side but i think chow wanted to portray the powers like thisthe scene with the knives is painfully funny and it shows chows comedic timingthe fight scenes are spectacular and music is just as good even if it is stereotypical music of the orientalthere is a sweet and interesting idea with the mute girl which i felt was perfectly added,comedy
in all honesty i have seen a lot of kung fu movies and think some of them are totally over the top while trying to be serious dont get me wrong i love kung fu movies but i liked this one a lot because it did not take it self serious at all it made fun of those movies that are serious but in a campy way some of the visuals really surprised me and the one that i really enjoyed was the hand in the building the fighting was good and the choreography was fun but not anything super special the parts that kept the movie from being serious was the scenes when they were just over the top with the symbolism like the butterfly coming out of the cocoon and the clouds over the asylum and i think it actually added perfectly to the theme of the movie i also like the whole classic approach that the gang had i really like the dance sequence which was totally absurd and the whole look of the ax gang overall a very enjoyable movie but not something i would watch over or a movie i would recommend to everyone but it was a fun to watch and i enjoyed it a lot more than i would have thought,comedy
i must admit im a fan of stephen chow liked many but not all of his shows i can almost say that i grew up watching his movies at one stage of his acting career i thought his shows were going downhill then came shaolin soccer  i thought that was the best now the bar was up with there was still a good amount of slapstick comedy in the show that was his trademark other than that the kung fu was fantastic the story  very well done right amount of romance to gel the hard core action so retro and so enjoyable to watch one has to sit back and just take in the silliness and at the same time be amazed by the fighting scenes,comedy
what a hilarious film great overthetop silliness it is a parody of the martial arts film genre and so will probably annoy anyone who was expecting something more err realistic most but not all of the gruesome stuff is offscreen  watch the cats shadow there were for me in the uk occasional cultureclash moments of unfunniness but perhaps that is to be expected the great special effects are mocked along with everything else overall very funny,comedy
this film is a mighty fun 90 minutesthe plot a band of hatchetwielding gangsters holds the city in terror however they leave the destitute people of the pig sty alley neighborhood alone as they have nothing worth stealing thsi peace ends when two gangsta wannabe bums sing and bone bumble into the slum and stir up trouble in the name of the gang soon the axe gang is locked in a battle with the paupers of pig sty alley and their bizarre and comical styles of kung futhis film is a very good slap stick comedy there have been parodies of kung fu movies made before but none this good the laughs are reinforced by some really crazy characters most notably the daughter of the dragon fat chainsmoking landlady who never once throughout the movie removes the curlers from her hair the film is full of references to all kinds of other films ranging from kubricks the shining to the looney tunes road runner,comedy
oddly enough i found this quirky little movie quite appealing it took me a bit to warm up to the movie but in the end i liked the nontraditionalist approach to this kungfu movie the physical humor and the verbal humor while not hilarious was still pretty funny and i think more than anything the humor was effective because it came as such a shock and a surprise just because of the timing and the kind of movie it was but this movie didnt just provide laughs it also provided some excellent fight sequences the battles in this movie easily rival some of the top kung fu movies such as iron monkey lord of the wutang and others there was a perfect blend of true martial arts hand to hand combat excellent choreography and a bit of suspended belief weapons use and super abilitythe directing and the cinematography was spectacular there were some wonderfully captured shots that drastically enhanced the movies appearance and overall style as a martial arts movie fan i really appreciated this movies ability to mix humor with some very nice and stylized fighting scenes without making a mockery of itself and other good martial arts films this movie is a pleasant surprise for any kung fu movie fans,comedy
for those who dont mind reading subtitles i highly recommend as entertainment weekly said think kill bill meets loony tunes it contains spectacular martial arts fight sequences while being refreshingly absurd about it all and though the comedy factor is very high the parody aspect doesnt keep you from attaching to the characters and caring about their plight and the resolution of the plot the script has a peculiar habit of shifting the focus so that the first time watching it you really wonder who the main character is id recommend not studying the movie cover too closely beforehand discovering whos really important is half the fun all the characters are fleshed out with adorable little quirks that make every single one of them lovable even the villains the soundtrack and cinematography were quite enjoyable as well overall is a delightful piece of art youll want to watch it again as soon as youve finished,comedy
everything changes in this fantastic movie powerful to helpless passive to proactive mediocre to genius and of course ultimate master to mere pupil the movie changes itself from gangster to dance briefly to all out action and finally passive redemption the key players at the start turn in to bystanders and the meek turn to key elements of the plot a triumph of film narrative where the effects are blended to the plot and the humour is wild brutal and subtle go see this one now you will laugh and bellow and forget to eat your popcorn gannett,comedy
recap the city is ruled by a gang called the axe gang and ordinary people live in terror while the gangster lives in luxury only poor people are left alone and in the alley of the pig sty  life is running it slow course that is until failed wannabe gangsters sing and bone happens by and poses as members of the axe gang the people in the alley wont give up that easy and soon the real axe gang is involved however the people seem capable to defend themselves quite easy this infuriates the leadership of the axe gang and they are not too happy about the impostors sing and bone eithercomment this movie is just like a long cartoon not that it is animated but a lot of the effects and characters abilities are similar to those in a cartoon and just as many cartoons are funny and entertaining this movie is too actually it is hilarious from time to time the movie possess both visual comic along with sharp twists and turns and dialog altough dubbed the directing is very good use of special effects are excessive but that is just fully in line with the rest of the movie so it is fine in short it is a good performance of all involved both in front and behind the camera the result is a really funny movie with a lot of laughs810,comedy
i just added to my dvd collection its a very worthy title indeed the film tells the story of a wannabe thug who wants to join the axe gang one of the more notorious of chinas violent street gangs from there the film opens into a melee of fantastic visuals and quirky charms that can compete with the more lackluster hollywood scene these days when it comes to most comedies i meaneverything was executed great however i found myself disappointed with what i felt was the lack of comedy that looked promising from the trailers i expected the whole movie to be filled with these funny scenes but the whole movie wasnt dedicated to comedy which threw me off however that doesnt stop it from being a creative genius in its own right a good movie to own indeed,comedy
wow i was quite surprised by this flick i was expecting something akin to kung pow enter the fist or top secret the trailer looked a little silly and i never paid it much attention it came home on video though and after watching it we all agreed that we were pleasant surprised the story unfolded much like some other asian films like hero and house of flying daggers there was emotional struggle of lost love and underdog vs overwhelming force the special effects were a bit over the top but i feel they really did fit in well with the overall concept of the plot even through all the sadness and anxiety the plot provided it all did finish up with a solid ending,comedy
gong fu  is a comedy action movie made out of different genres like western martial arts and slapstick and mixed together in an amusing mix genres are imitated genres are spoofed it takes on a simple film clich and takes a twist on it thats where all the fun comes from here and from the many reference to other moviesthe action scenes are great as they are choreographed by wooping yuen from the matrix we have adequate fight scenes but chow even makes some fun of the seriousness of theseof course this is all form and no substance except for the mild social criticism but it is still delightful entertainment if just all movies that try to entertain in a simple way would be like this,comedy
unfortunately i talked my girlfriend into going to see this based on my experience with shaolin soccer this movie is not nearly as funny nor is it really trying to be as funny  there are slapstick scenes but the action sequences are while effective not as humorous as a typical jackie chan fight i wouldnt describe this as a comedy but as an action picture with some humoralso this film is much more violent than shaolin soccer yes its a very cartoony violence and for the most part nothing that bothered me but my girlfriend cringed every time someones head was bashed through a concrete floor or whatever so it was way too violent for herso i did feel guilty and conscious of my girlfriends discomfort while watching but aside from that i really think this movie is incredibly overrated its a good kung fu movie with comedic elements its got some clever ideas and quick moving action although its comedy can get a little too overthetop sillyjust be warned if you loved shaolin soccer that is not a guarantee that you will love this one,comedy
going into the movie i wasnt sure how it would pan out having seen the trailer and expecting a cheap matrix spoof however the movie surprised me by remaining incredibly fresh and funnyjust a warning i watched the chinese version of the movie and there were quite a few jokes that i dont know would translate well to english a few puns a couple idiomatic sayings so it may be a completely different experience with the subtitlesthe first half of the movie kind of passes by in a sort of confused daze as you dont know whats going on whatsoever and the jokes are on the cheap side however towards the middle of the movie an actual plot begins to take stride and both the action and the humor picks up by the end of the movie i was simply blown away at how good the special effects were and how all the loose ends of the story were neatly tied upall in all it was an exceptionally well puttogether movie with great visual effects and decent humor even if it takes about an hour to actually get into stride,comedy
this movie was amazing comedy somewhat hackneyed effects kung fu tragedy drama love bhuddist palm i laughed i cried i kissed 8 bucks goodbye the crazy thing was that i was really at the edge of my seat during a good deal of the action and boy did i ever laugh the spiderman reference was beyond value and the butt crack ridiculous i loved this movie it was a throwback to the comedy of sammo hung and yuen biao in kung fu only the martial arts were computer animated into absurdity like a more visceral but less over the top beautiful house of flying daggers go see it i beg of you go see this movie alleluia go see this movie,comedy
i did not read about this movie before i saw it as what i usually do with lots of hong kong films however upon watching the film you realize very quickly that there isnt a story  or at the very least i should say it is extremely lacking but even then this isnt to say that the film is very entertaining and surprisingly at times very endearingif you are a fan of hong kong films and what i mean by that is by older films like those that have started and continued to spur hong kong cinema then you will notice many references to these films the first and most prominent is probably the reference to house of 72 tenants with the sassy landlord and disputes over water to her use of language as this film was a film that made hong kong cinema prominent again as opposed to mandarin cinema it might be a reference to an unconscious or conscious desire for stephen chow and others that want hong kong cinema to thrive againbut even if you havent watched old hong kong films you still can watch this film and be entertained you are engaged in this entertaining ride with fight scenes slapstick comedy subtly beautiful characters and only do you stop to question what the film is about because that is a question that people ask in every film even though the answer you find is that there really is no story or that the entertainment factors vastly outweigh the story and can be seen as a fatal flaw to a film to certain people it is still something that should be watched and then you can decide for yourself,comedy
