sad to say its a pretty bad movie do not watch it definitely does not deserve the high rating it gets on imdb there are better korean movies than this the problem with the movie for me might be that it is geared towards a preteen female audience there is nothing specialmemorable about the action sequences the story line is rather dulli did not find any of the characters to be likable the only positive i can think of is the main characters voice is very deep the whole purpose of the movie was to create a unstoppable hero this causes a problem in that it the movie loses suspense when we know that the main character is invincible the worst part of the movie has to be the forced attempt in making the protagonist as a cool guy this does not work the dude comes off as a model and for some unknown reason gets a haircut halfway through the movie i dont know what other bad things i can say about this movie,cruel
i like watching foreign films because quite frankly i get tired of the same tired actorsactresses playing the same characters in different films no matter how many times i see bruce willis he always seems to be john mcclain that is why i truly enjoyed brotherhood of the wolf and why i recommend watching this filma lot of other reviews mentioned how the plot is very similar to others but i feel it takes a different patha darker path much like 8mm and hostel this movie delves into the seedy underbelly of its environment our hero has chosen an area to disappear into where people seem to be lost and discarded without a second look even though the girl is not the cutest you find yourself sympathetic to her plight by the end you are literally wondering what else could happen to herthe hero tries hard to stay out of the chaos erupting around him but is drawn in deeper and deeper finally the only alternative is to simply jump into the pool with both feet and he does it with a vengeance the action sequences are awesome and even better believable more and more movies are trying to go over the top with their action sequences which tends to take away from the movie one reason i tend to shy away from asian films is because of the stupid fight sequences with people running across tree tops and flying at each other with swords these fight scenes reminded me more of the transporter serieseven though you find out that the hero is some military special forces guru you tend to believe in him because his character is unlike those from the same genre no big guns simply a pistol and knife no big transformation scene before the big fight simply a haircut i think it is the simplicity of the character that makes the movie greati noticed some people have trouble following the plot lines i have seen two versions of this filmone dubbed and one with subtitles i notice the plot varies a bit between the two and some of the lines are completely different watching both seemed to really put it all together i never understood the film title until i saw the subtitled versionso to wrap things up if you are an action film buff watch this movie there are a lot of cool action scenes as mentioned before in another review the follow shot out the window is awesome youll know it when you see it there are a few surprises too i have watched it three times and want to see it again,cruel
i saw this on dvd seeing that the film was invited to a few international film festivals boy it was all hype and gripe with me about this film its basically a cookiecutter action flick about some former spy who takes pity on an orphan girl who is kidnapped by gangsters i would think that in 2010 action movies would try to be a bit different than the norm but not in the man from nowhere the film is basically an excuse for won bin to be in a starring role that he is truly unfit for i mean come on hes just a pretty boy but not convincing as an action star and the plot and film are just repetition of what ive seen before in korean movies except for more action and goretrust me you do not need to see this film it is also very long at two hours and much of the footage was unnecessary save two hours of your life by skipping this dud,cruel
the man from nowhere a gruesome film written and directed by lee jeongbeom was very hard to watch at some parts however at other times this film made me feel somewhat emotional and very attached to the characters personally i did not appreciate the amount of fighting and violence within the film including lots of visual injuries and strikes however i did appreciate some of the beautiful relationships between certain characters in the film for example the relationship between the young girl kim chigon and her very kind nextdoor neighbor who decided to save her life cha taesik i would recommend this film to anyone who is not afraid of a little gore and violence and is interested in a thriller with a heartwarming background plot,cruel
i stumbled across this movie on netflix it had four stars so i decided to check it out it turned out to be an excellent decision this movie has it all great story fantastic acting well executed fight scenes and its funny moments it is hands down one of the best movies i have ever seen it won the korean version of the oscars for best male actor bin won who plays his part perfectlyit starts off at a club and the detectives are trying to get this criminal organization then jumps to the man character at his work and goes through pretty much a daily routine he owns a pawn shop at the apartments he lives at he befriends a little girl though by the way he treats her it seems like he doesnt care for her at all her mom happens to be a drug addict and stole from the wrong people they wind up kidnapping the mother and daughter and decide to use the main character chatae sik to send a message to another gang we soon find out that he used to be in a special military group and he puts his skills to usei did a very dimmed down version of about half of the movie it only gets better as it goes and the ending is superb brilliantly executed fight scene and a good ending to tie it all up this movie is somewhat similar to taken and man on fire but at the same time very different korean movies in general are pretty good but from what ive seen there are three that stand out the most this one oldboy and i saw the devil all amazing and oldboy is on the top 250 movies on imdb voted by users ive read other reviews that say the main character is somewhat invincible which is not true at all first off the military group he is in was said to be on of the most brutal trainings out there making congressmen faint from what they see he takes pain a much different way than a normal man would all in all you would have to watch the movie for yourself and believe me you will not waste your time watching it,cruel
even if i find somi you two are still deadpretty cool movie the man from nowhere is a south korean actionthriller of similar type to taken or the bourne flicks a dangerous man with a mysterious past gets caught up in a conflict with a group of criminals when a lonely young girl hes befriended is taken by them as he tracks her down we learn about his tragic past and see him put his deadly skills to use against some despicable lowlifesthe movie isnt perfect theres a lengthy period before the action starts that perhaps goes on a little too long and the dialogue at least the translated subtitles is occasionally hammy and unintentionally hilarious there are also a few too many blatant attempts to pull at the viewers heartstrings and force you to get emotionally invested in the story i always find that kind of thing to be a little annoyingso its a little derivative and it has some definite pacing problems but that doesnt stop the man from nowhere from being a movie worth checking out at its best pretty much the entire last act its an intense ride that fans of movies like taken will thoroughly enjoy bin won is believable and effective in the main role and the tidy and sure to please ending is a nice bookend for all the carnage,cruel
essentially a remake of man on fire and the professional but its very well done and if you liked those movies youll probably like this korean twist on them the tone is darker and the gore is heavier and more realistic so while this film is highly derivative it is much grittier than its obvious inspirations it feeds directly into the common male fantasy of possessing near superhuman abilities that no one around you knows about youre actually a deadly coiled snake waiting to strike yet to all outward appearances youre a worm just wait until they find out theyll live long enough to regret their misjudgment theyll pay for disrespecting you they have no idea who theyre messing with etc etc im a guy too and you know what im talking about dont bother denying itfirst cars now films korea has come a long way and is producing some top notch products although in this case not exhibiting much originality,cruel
the man from nowhere directed by jeongbeom lee is yet another example of how the south korean film industry has the market cornered on revenge thrillers despite featuring familiar a plot and character types both are sharper and a bit more selfindulgent than their american counterparts there is no conflicting vision to tone down the unhinged rage and violence the end result is unfiltered vengeance and bloodshed and undeniably thrilling while it may occasionally stretch its credibility from time to time it still boasts its share of welltimed surprises and always walks on the side of excess the relationship between our protagonist cha taesik played by bin won mother 2009 and somi played by child actress kim saeron is at the heart of the film and their bond slowly develops in the first half hour right before somi is abruptly kidnapped the rest of the film mainly focuses on chas efforts to find her having almost nothing to work with and with the police being more of a hindrance than a help we learn more about chas past as he gets closer to finding somi won bin delivers a grand performance as a highlyskilled fighter and is equally effective as an emotionally damaged vulnerable protagonist the more technical aspects of the filmproduction and cinematography are all executed with a great deal of skill the film does suffer somewhat from over complicating the story line and please enough already with clich inept police department that simply runs in circles and into each other it also does run a bit too long at times due to the overly melodramatic moments that simply drag on this korean action crime drama revels in its genres conventions a great thriller a nonstop adrenaline rush with plenty of impressive action sequences to carry one through its two hour run time the film does a decent job with character development and its backstory and the dramatic elements are admirable for an action film maybe someday american audiences will get to see the lighter side of korean cinema in the meantime theres no denying these powerful films of vengeance and revenge the man might be from nowhere but the movies could only come from korea,cruel
like toshiro mifune in yojimbo sanjuro etc or clint eastwood in a fistful of dollars for a few dollars more etc bin won in the man from nowhere is a man of few words also like mifune or eastwood in the aforementioned flicks his motivation is understandable some would argue even more so since bin wons motivation is the rescue of a little girl who reminds him that his own child was lost when his pregnant wife was murdered won looks almost like a quintessential anime character with the tall thin dapper look and the dangling hair perpetually draped over one eye not to mention the explosive violence that hes able to unleash on them as what needs explosive violence unleashed upon them if youre interested in exceptionally wellcrafted carnage with some real worldtype motivation thrown in for good measure check out the man from nowhere,cruel
2019 watched movie after reading reviews im glad i did it was very entertaining ,cruel
from watching the trailer for the man from nowhere my immediate vibe was leon the professional meets taken and although reviews here state the man from nowhere is its own identity after watching the film i think comparison to these two films is fair if you have watched both leon the professional and taken you will have a very good idea of the tone the themes and the kind of highly competent violence in the man from nowhereunkempt stoic child molester vibe pawnshop owner cha taesik has a parentlike relationship with his young neighbor jeong somi very much like as in leon the professional the character cha taesik i think is not as developed as leon though and neither is the young girl but even so the relationship feels genuine and the bond believable enough to carry the filmi would say cha taesiks martial art skill set background is not really as believable as liam neesons character in taken like i mean cha taesik is phenomenal in his movements but the reason why he is in such stellar shape having a six pack as a pawnshop broker is less believable while a retired special operative like cha taesik liam neesons character was shown to be a bodyguard theres a bit of suspension of belief in regards to cha taesiks character that does impact my rating of the film although i found these aspects easy to overlook as i consumed the great action sequencesi did feel that there were other parts of the film that did ask me to just kind of go along with it like the whole thing with the cops was a bit extraneous and like why were they even mad didnt even seem like they were mad at the organ harvesters and just at cha taesik for busting up some cops i felt like the cops couldve played either a lesser role or a more integral role to the story at some point the cop characters and the druglordorgan harvester characters just seemed to run into each other because of their similar personalities serious bossfunny sidekickbut like overlooking the extra parts and the gaps the man from nowhere does have serious heart here the feeling is very much like taken such as one man going against a very large apathetic organization i do think taken goes one step farther than the man from nowhere because it shows how the cops involved also aid the problem of human trafficking if the man from nowhere had done that i think its themes wouldve been strongeranyhow if you are going to make a film that takes its inspiration from other films then the man from nowhere is how to do it i did enjoy the message it tried to get across and i also found some moments of humor in it too in the last minutes cha taesik says something brooding and enigmatic to jeong somi and she simply asks whats that supposed to mean i do think that cha taesik did sort of say nonsensical things at times with the druglord not understanding it was kind of funny because its a bit of a cliche in asian films i thinkanyway the kind of activities the criminals do in the man from nowhere is genuinely despicable but the characters have this balance between being utter pieces of work and then like total children so theres a weird likability to the villains even though because of how destroyed they get you understand their actions are unacceptable and as it should be the man from nowhere is at once hyperbolic and absolutely serious and even poignant which is what i think differentiates it from the other two films mentioned i think the man from nowhere is closer in tone to leon the professional rather than taken because its not as gritty or realistic as the latter in terms of plot though the man from nowhere is much more inclined towards taken since it is less a relationship film than a rescue filmi thoroughly recommendi do want to mention one thing though that confused me for a great length of time a character meets jeong somis mom in the first few minutes of the film the character has the same hairstyle and build as cha taesik so i thought it was him and was trying to make this bit of background fit for the rest of the film finally i figured out cha taesik had no relationship with the mom so he was really the man from nowhere rather than the man from a few minutes before it appears im the only one who made this mistake but honestly i think the beginning of the film is relatively weak since it doesnt spotlight or foil important characters they should have started with cha taesik or something,cruel
where to startthe story is dull a mysterious man who is more than he appears goes on to defend the poor daughter of a drug addict that is abducted by the mafia this movie is a caricature of leon drive and john wick which is itself a caricature of lonesome hero movieswhat makes it worse is that they overuse dramatic events to make the drama surrounding the story more intense they made the little girl as sad as possible by inflicting her with the worst this world has to offer so much so that it becomes a joke the main actor is coming straight from the dreams of a 12 year old girl he is as unsubstantial as it gets with the charisma of a perished oyster with his impeccable abs and 100 pounds of bodyweight he will take headon about 16 bandits armed with guns with his bare hands because yes its that simple to make an action movie nowadayslet me save you the time that i have lost forever watching this movie by telling you that you will regret watching this garbage unless this is the first action movie youre about to see and youre a 12 yearold girl,cruel
while dark and violent this movie also has a certain charm mainly due to the painfully touching and charming little girl who befriends a pawnbroker who turns out to be more than he appears somewhat predictable and sometimes a bit overthetop in its grim bonecrunching violence this movie is also wellpaced and is manipulative in a good wayworth watching,cruel
one of the things they did was to give this movie a smooth translation without having the characters have oriental accents china is competing with korea for drugs the koreans set up a deal with the chinese for them to sample their wares the heroin gets stolen by a dancerdruggie who has a daughter her neighbor is a mysterious loner who operates a small time pawn shop he and the daughter become semifriends perhaps the best way to describe it the korean dea is also on the case they bad guys catch up with the dancer and kidnap her and the kid the pawn shop owner gets dragged into the mess as it turned out they picked on the wrong guy he goes walking tall to rescue the girlthe movie has one corpse nudity scene some groping and needless mf and fbombs the movie is straight forward action one scene is a little awkward where there is a chinese translator a man would say something in english and then the translator would then say it in english also just one of those foreign movie things,cruel
this movie has it all excellent plot and extremely excellent acting i was very impressed plus a nice ending some people might say a little gory but really not that bad at all actually probably just the right amount of blood and guts for those that need itlol,cruel
this is a fine movie that has both powerful action scenes and intensely emotional moments on many themes won bin is a superb actor who can develop his character more through his eyes and the quiet play of emotions across his face than most actors can do even with training what won bin does cant be taught its a gift it is also won bins last film before leaving the entertainment business 10 years ago ive read that he left at the height of his career to focus on his personal life marriage and child i have also read that he has become a mutimillionaire from doing cf and modelingboth of which im guessing are not as draining as acting in brilliant films that win lots of awardsespecially when the star is as good as won bin still i join the chorus of voices that would love to see him in another film when and if he chooses to do so,cruel
im not particuliary fan of the asan action mviesbut i saw that movie a few days ago and i still think about it loved so much the main caracters are very well defined and the girl is gorgeous i recommended  for me is the best asan movie i ever seen so pity the principal actor doesnt have done practicly nothing after that because he is so amazing,cruel
hes not an excon please fix your description imbd,cruel
man those koreansthey know cinema wish there were more available to usthe man from nowhere isnt the most original movie but its thoroughly interesting twisting and has heart oh and some kickass actiona pawn star to his little girl neighbor is thrust into the crime world apparently again when said girl is kidnapped and sold into slavery just think an animetakenyes i know this isnt japanese but i did see so much liveaction anime here especially the lead pawnshop guy with hair over one eye for half the feature its nowhere near the top of the best of korean cinema but its absolutely worth it when it gets going its either hilarious actionpacked or unbelievable where they go watch itfinal thoughts helps there were soooo many good looking asian men can never have too many of those to see for two hours,cruel
this film is so amazing  good story a lot of action the actors are greati loved it,cruel
i am a great luc besson fan but this is the film that leon  the professional aspires to the story is told in a restrained and logical fashion it is gory and gritty but as appropriate to the genrea warning to the faint hearted however it is brutal in the action scenes not gratuitous like peckinpah but still chillingly graphic its gore and grit are very appropriate to this genrei was prepared for a light illogical action flick and got a layered story with superb acting the cinematography was top notchthe police and the evil henchmen are cardboard mockups of characters which helps the viewer detach from worst of the carnage this is high on my watch again list,cruel
the heros development through the story to the end perfectly matched the title it wasnt because he was mysterious it was the fact he was the girls neighbor you dont see how much he cared for the girl until the finale he was a strangertechnically due to him a the girls relationship in the beginning that helped another he was almost like the star from the movieredemption  a hero who fell off but crawled out of itthe villians werent dumb they were an actual threat to other people around themthe license plate scene and the ruffied girlthe bad guy were just really caught off guard which is understandable because they were dealing with someone they know nothing about and underestimated they were even evil to the point that their brutal deaths gave the feel they deserved it the use of ants was even new to me as well this showed these werent the usual drug traffickers you hear aboutthe fight scenes were used well the first fight the hero had being the tip of the iceberg of what the final fight would finally be the brutality matched the emotions and situations from self defense survival and to pure rage unlike most fighting movies who has fights in every scene this actually made the wait worth it,cruel
the direction is astonishing and the cinematography is gripping enough to keep our eyes on the screen the film does an effortless job of building tension and discomfort when need be making the scenes of violence and revenge all the more gratifying the violent scenes do exhibit blood prepare for a lot of stabbing but its used sparingly enough that the film isnt in danger as being classified as shock gore,cruel
the man from nowhere lives in a pawnshop next to a mother and daughter he is a withdrawn man with no relationships and tries to keep to himself however he forms a bond with a young girl over the time they spend time together he develops a soft spot for her but then she was abducted and her mother was killed the man from nowhere goes on a quest to get her back i really enjoyed the movie the man from nowhere it had great plot development and a wonderful storyline you really got to see the characters deepen throughout the movie you learned that the man from nowhere wasnt always so dark this was one of the most interesting parts of the movie to me to find out he had a wife but not just a wife a pregnant wife that died was heart breaking to me but it really explained his character it showed why he was so scared to form connections he was just scared of getting hurt again it also had a great ending i was very much expecting for the little girl to be dead but everything worked out okay in the end although he might go to jail she was alive and thats all that mattered to me,cruel
