cha tae sik is the man from nowhere and is a introvert special ops agent who has been running a pawn shop for years a young girl somi tries to befriend him but he does not confide in her presence but little does he know that her mom is a stripper and is not much of a father figure to somi furthermore the chinese mafia and south korean gangs trade drugs and tapper with organ harvesting somis mother takes heroin from the gang and they both get kidnapped for messing with the wrong people hence chatae sik tries to save them moreover the korean gang calls chatae sik in order to settle a dispute against the chinese mafia and if he does this chatae sik will receive somi and her mother back safely however chae tae sik is deceived and the koreans kill the mother anyways and harvest her organs for sale and turn her daughter into a drug ant child drug trafficking that is why i love this film so much because it does not sugar coat anything or give anybody the hollywood hope that is really looking for it exploits the raw and cruel nature of humans using others to their advantage and not caring a growing number of south koreans are turning to the illegal websites and black markets to advertise the sale of their organs in order to overcome financial challenges and or debt furthermore police are batting an eye away from the illegal organ harvesting and illegal organ trafficking is clearly on the rise arrests relating to the practice have decreased showing an unwillingness on the part of police authorities to crack down on the problem along with economic hardship lack of donors in the country is also contributing to the rise in illegal organ trafficking because the dependent population of men and women is so high men and women ages 16  64 there is a lack of organ donors to support those in the home country of south korea since the youth population is so small thought provoking question what would you do if someone offered to give you 50000000 dollars for your organ knowing that your chances of survival are low due to the organ you are giving up is a vital organ the helps you function with your everyday activities,cruel
the film the man from nowhere is a really good film it showed that people arent always as they seem the main character cha taeshik was known as the creepy quiet neighbor and pawnshop keeper that people thought would rape young children he becomes fond of his nextdoor neighbor somi at the beginning of the film somis mother steals drugs from a drug trafficking organization this causes somi and cha taeshik to get involved the drug traffickers kidnap somi and her mother hyojeong throughout the film we see cha taeshik take many risks to get somi back and to make sure she remains alive he puts himself in major danger to save the one person he really cares about he fights to save somi from her kidnappers this shows that he isnt as he seems he is actually a kind caring person that wants to protect a young girl,cruel
movie the man from nowhere 18rating 455since i saw the films indian remake first and enjoyed it as well i will write just a brief review as most of the praise has come out in the review of the remake rocky handsomethe man from nowhere is one of the best south korean action films as it provides great action while also combining it will emotions and thrills the film is full of scenes that have gone down into the filmmaking history as classic since i already knew the entire story due to having seen the remake i wasnt surprised but was still very impressed won bin is a perfect actor and his performance will make you remember him for long kim hee won is decent and plays his part well kim saeron is quite decent in the role provided same for rest of the castthe action as i said before is great what i didnt mention is that its dynamite in impactlee jeongbeoms the man from nowhere is undoubtedly a smart action film which is entertaining of course but also quite different from most action films,cruel
for me there are a bunch of films that leave an impression later after soaking in the scenes and pondering on them for a while most of blockbuster films usually have one or more notes that comes off wrong and ruins the entire orchestra leaving a bad taste and wishing i could just forget it forever some films have less spikes and are easier to watch without getting overtly jolted some really have a nice overall tune that i would probably go as far to say i would purchase the bluray film to support the creators then there are some really well made films that fit the bill perfectly and even surprise when you least expect it yup you guessed this film is just great from beginning to end the highlights are the realistic fighting scenes that use real world gravity and the camera shots that are crystal clear the film is raw and exposes real world problems like drugs prostitution and child exploitation would be a 1010 but in reality its a 9510 due to the extreme violence that our hero retorts to for immediate justice also the hero persona more than likely caters to an asian market while in the west it may seem different overall this film needs to be played in theaters and needs some awards so that a wider audience may praise it and we may all be jolly in agreement,cruel
there are many action movies with action star and his friend who goes missing our hero in turn goes as one man army for the rescue of the friendly counterpart well the movies come to our mind are leon man on fire and takenthis movie however impresses me the most the reason is its cinematography and emotional take in its execution also unlike many action movies the action does not seem unrealmany reviewers were unhappy about the plot being complex according to me this may be because movie is korean my view is its not at all compound just that the language is something that we are not use toremake rocky handsome of this movie in bollywood nowhere stands near original,cruel
i stumbled onto this film because of insomnia amc used it as filler about 330am on a weeknight and i was mightily impressed extremely highquality movie all the way around and it takes its time building up a big head of steam then it delivers a deeply satisfying and emotionally moving payoff the only problem it has and several reviewers commented on this is the complexity of the plot and all the different characters intertwining and converging this is really only an issue because of the language barrier and it is difficult to read the subtitles and also keep track of the many characters and plot points at the same time so i bought my own dvd it was cheap and i was able to easily untangle the whole story the dvd also has a dubbedin english version if anyone is so inclined believe me the entire script is quite intelligent and very logical and it all fits together seamlessly once you catch on spoiler alert for example some reviewers couldnt figure out how somi was spared near the end ramrowan had a private sense of warriors honor or the samurai code or whatever you want to call it in him the whole time and he adored somi despite himself so he ended up killing the surgeon at the very last instant and cutting his eyes out instead of letting the surgeon cut somis eyes out he also couldve easily shot cha taeshik during the climactic battle scene but he believed it wouldve been a great dishonor if he and cha taeshik didnt settle matters mantomananyway this is one of the very finest onemanarmy revenge films that youll find anywhere i put it right up there with denzel washingtons man on fire its that good,cruel
the man from nowhere directed by lee jungbeom completely blew my expectations away going into the movie i was a little biased as an american that held a false global perspective i imagined that since this movie was produced in korea that it would not be as professional nor good as an american movie i also thought the language barrier would make the movie even more unappealing i was completely wrong this movie is one of the best movies i have ever watched the language barrier was nonexistent for it was fixed with subtitles and the annoyance was never apparent because the movie was too good the director portrayed the main character as a quite mysterious person who owns a pawn shop and lee later develops the characters backstory throughout the movie as people investigate him the ties between family and the pawn shop owners past are discovered and bring emotion into the film after his neighbor and her daughter who he has formed a connection with are taken by drug lords he attempts to save them while dodging the dea after being set up by the captor of his neighbors to fighting multiple villains we watch our main character a juggernaut as he dispenses of as many enemies as it will take to find his neighbor and her daughter eventually he manages to pinpoint the head villains and take them down one by one the ending of the last fight scene which i wont spoil is extremely satisfying and a giant relief and makes this movie even better this movie deserve a tenoutoften rating because it was incredibly enjoyable to watch and was well directed,cruel
the man from nowhere was one of the best films that i have watched this year not only was it a well put together action movie but there was also a little comedy thrown in to help spice things up it was also interesting to see how they placed the story from different perspectives as well i really enjoyed looking at things from the deas perspective as well as somis perspective one thing that did confuse me about this film was both the presence and lack of guns it seemed like all of the police were able to obtain guns and at one point so was the main character however almost no one in the drug ring had guns and when they did it was only for specific parts i dont know if thats coming from an united states perspective where guns are plenty around here but it seemed like there wasnt as many as there could have been everything else about the movie was fantastic especially the fighting sequences,cruel
this was a very intense movie to watch it had many exciting elements to it as well as many sad moments the story follows a man named cha tae shik he served as part of a special operations unit in the military and went completely under the radar after the death of his wife the only people he has left are a drug abusive dancer and her little daughter who is only a toddler when a south korean gang takes the mother and kills her to fuel their black market organ trade they take her daughter as hostage cha tae shik wont stop until he gets the dancers daughter back in the meantime the cops are also going after the gang members but they get needlessly distracted with shik this movie had many intense action scenes in it it was petty easy to watch at some points but at others it became very hard for example when the garbage truck slammed into shiks car killing his wife and unborn baby or when the trunk of one of the gangs cars is popped open revealing the dead harvested body of the mother one of my favorite scenes was in the end after cha tae shik had killed all of the bad guys and was in the parking lot out of the dark came the daughter in good health and ran towards him this relieved basically all of the suspense and tension that nearly the entire movie had built up i also noticed how clever some of the camera angles were my favorite was when shik was running into the subway station as he entered it was raining and the camera was facing down as the water droplets fell away from the viewer it created a very cool effect in my opinion,cruel
i liked the movie and the actions scenes were entertaining the main character cha tae sik has a sad make story and that is why i feel he wanted to save somi a little girl and his only friend however there was a big plot hole in the story there was a scene they put somi to sleep with drugs and it looks as if they are about to remove her eyes but they later showed us that they removed someone elses eyes even though i was happy to see her alive i was upset to how somi was conveniently free with no one else around her at the moment cha taesik was about to kill him self though the movie is already two hours long i felt that they could have made it a little longer to explain how somi got free,cruel
the movie the man from nowhere is one of the best movies i have seen in the past year that has to do with a foreign film i guess it had something to do with all of the action but i just really enjoyed watching it there are a few moments where you have to think about it and try to come to a reality where something would actually take place yet due to the main characters past and everything that he has gone through it is really hard to tell just why he does everything that he does to start it off i will go with the relationship between the man and the prostitutes daughter there will be many spoilers but to carry on with my point there are many different reasons for why the man chases after the girl after she is taken away due to her mothers involvement with the drug ring is south korea etc anyway i believe he does this due to the loss of his daughter and his wife as they were taken away so abruptly he never had a chance to save them yet now he actually does have a chance to save the little girl that he somewhat sees his wifedaughter in despite this the movie puts a view on the trafficking of body parts and the use of children as no one would suspect a child to do anything harmful they use this to their edge and due to that it is a huge problem this movie is a 9 out of 10 i would recommend anyone watches it,cruel
the man from nowhere was a great movie in my opinion following a great story line that also included chaotic yet easy to follow fight scenes the backstory behind the main character was touching but not so different to be unrelatable cha was a former special agent so he uses his unique set of combat skills in order to save his neighbor who has been kidnapped since chas pregnant wife was killed because of his line of work he always felt responsible cha feels the same way in this situation because he was not given the opportunity to raise a daughter before so he wants to do so now this film uses great cinematography especially with the closeups of chas hand with the fingernail polish on it another aspect that i enjoyed about this movie was chas motive for fighting at first he was just in it to save his neighbor and her mother once he finds out that they killed the mother and took her organs when he was set up he decides that it is his mission to take out the organization behind it then when cha realizes that the organization is using children as slaves to make and deliver drugs and stealing the organs of innocent people he then makes it his mission to kill everyone involved in these crimes overall this film provided an entertaining tearjerking action packed rollercoaster that i would suggest to anyone willing to watch a foreign movie,cruel
i really liked the film the man from nowhere i liked the amount of action and the main plot the story was based on a man who gets attached to a young girl and then fights to find her when she is kidnapped the film had a lot of good action and fighting scenes i also liked that you grew attached to the characters throughout the film as you learned their life stories i also enjoyed all the different types of good and bad guys i did not like all the gore if you are someone who isnt able to handle bloody sciences i would skip out on this movie i believe that even though the movie was not in english it was easy to understand and follow it was a well rounded movie that i would recommend,cruel
overall this was a great film that i would definitely recommend to watch in the beginning of the film i thought that the pacing went kind of slow but my perspective on the film started to change while getting more into it the main character in the film owned a pawnshop and met a young girl when she came to his shop the owner of the pawnshop taesik cha became close with the young girl when he noticed the danger that she and her mother were in taesik cha had a secret dark past which eventually effects the way he behaves the little girls mother and the girl one day get taken away by some people who are involved with drug violence and cutting people open and selling their organs illegally taesik cha wanted to save the little girl and her mother and was able to save the girl but unfortunately the mother perished the little girl in the film sees taesik cha as her own father but has troubles realizing if he will save her or not but he is able to defeat the bad guys and save himself and the little girl there was a lot of violence in the film but most american films are violent so this could be an issue to some i liked how the movie was filmed and how it showed some parts of the film as if one was actually in it but the only down part of this film is that most of the time i was very confused why certain things happened which was never explained in the film and therefore i would give this film a 45,cruel
the man from nowhere is a crazy movie in the sense of all the gory scenes and intense themes throughout the film i really liked the main character taesik cha he seemed very complex and mysterious at the beginning of the film as the viewers learned more about him i began to like him more because of the way he handled his past and the situations at the present his determined search to find avenge and eventually save the little girl who is his neighbor is honorable and very sweet i enjoyed the complex plot of this film however i found myself cringing throughout the movie due to the extreme blood and violence present during the whole movie the various groups of people involved in the plot was a bit confusing but i think the director did a good job making it clear who belonged to which group and each of their relations to each other as the movie continued overall i would say that i liked the movie especially the main character however it contained a bit more violence and gore than i would typically like to witness i would give this film 355 stars,cruel
this movie has become one of my favorites its so well doneit was such a pleasant surprise sometimes i watch the ending again both for the action and for the emotional impact its just so well done bravoi especially like the dynamic between the protagonist and the vietnamese rival he keeps having to fight overtime you can really see how the vietnamese guy grows more and more respect for his opponent until it becomes full blown awe the crescendo of the rivals own inner conflict has such a perfect pace and reaches its peak so perfectly that its almost beautiful,cruel
the story and plot is very simple a man randomly helping a girl out yet it shows love and deep compassion which really makes a difference compared to other movies it brings out the true nature of human chemistry it is very mysterious as well it keeps you thinking during the whole movieaction in this movie is the best of korean cinema of course hollywood has a bigger budget that is why i give credit to korea still on a lower budget they made an excellent movie the style of action and fighting stands out it shows intense but realistic fighting scenes a lot of people leave movies wondering how did they fight like that it doesnt make sense the action was confusing there was nothing wrong with this movie it was just flawless the movie taken is very similar to this movie with the story and plot just watch and enjoy,cruel
not a particular fan of korean movies i decided to give this one a try after a friends suggestion i must say what a surprize the pacing was good though its a bit slower than movies in the same genre the main actor gave a convincing performance with minimalist dialogues he doesnt say much and his haircut hides half of his face yet his presence is felt with impactthe plot unfolds bit by bit and keeps us breathing tight till the very endthe action sequences were convincing from the fist fights to gun fights and one excellent knife fight towards the end i highly recommend this one,cruel
the man from nowhere is an intense movie with more then just enough of the blood very well edited and marvelously acted movie however its kind of movie which would have worked better with lesser of the words at times it felt very expressive especially when characters would express their emotions using words the title lost its justification somewhere between those dialogues which brought him form nowhere into open book category fight sequences are intense and very well choreographed cinematography is good too writing could have been little better thoughgenerally a good revengechase movie,cruel
for many years now i stayed away from the japanesekung fu flicks because they dont make them like they used to but i was super blown away by this film  they had two main characters i actually cared about the fight action sequences is probably some of the best i seen in a very long time im almost certain they put tons of work into hence the reason it came across so well the plot itself wasnt hard to follow but wasnt a clich revenge plot as well now their are a few things i didnt like about this film which happens but this was things that stood out immediately 1 he shouldve died plenty of times but of course i understand hes the hero of it all but it started to make him look like a cat with nine lives 2 the little girl shouldve died as well it made no sense whatsoever that she made it out unscathed when the boss gave the order who saved her why the sudden change of heart theyve been doing it for years what made her so special all in all the film was enjoyable than i thought  i more than likely will watch it a second time,cruel
with exception of the final 15 min or so of its runtime i thought the man from nowhere was quite entertaining yes it has a few annoying qualities  namely one that its music and score sometimes just dont match the images and two one of those ridiculous fight scenes where one character singlehandedly manages to kill 20 thugs at once so you might ask whats good well some very crisp and well cut fight choreographies including major spoiler a tense welldone knife fight scene and surprisingly whats good is the core actors forged friendship  one that is paved well in the first 20 min or so of the movie i enjoyed the child actress well this is an entertaining movie despite its small weaknesses,cruel
i dont even know how i got to see this movie but it is now in my collection and i tell people to watch it all the time i have seen it many times over as the story line acting is impressive both the little girl played by saeron kim and the main character played by bin won gave extraordinary performances i now love korean movies from watching this to see the connection with the main characters was a delight and heart warming to watch as an action movie junkie i was not disappointed and unlike most western style or modern action movie the main character got hurt spoiler warning this movie gives me hope for humanity to see someone who completely detached from the worldheart melt by interacting with a someone else who wasnt even trying to change him i would love to see a sequel to this movie as i didnt want it to end i cannot say enough about this movie and how great the acting characters and action was very rare to get all three in a movie now a days also watch the making of the movie as it proves you can make an amazing movie without a big studio budget i cannot believe they made this movie for what they made it for talent director writer and actors i want to see more of these characters writer and directors,cruel
for the most part i found this movie very enjoyable some tightly created action sequences visually appealing cinematography lots of different characters and settings to keep the senses amused the film moves along at a good pace and features some disturbing scenes and effective use of gore to satisfy a sadistic film watcher like myself fighting scenes are sharp and not overly drawn out and the performance by the young girl who plays somi pulls on the heart strings and is probably the most impressive acting performance in the movie yes the entire cast may have been out acted by a 10 year oldthose are the good things a little while into the movies plot there is a strong sense of dejavu as every other action movie come flooding back to you as another reviewer said this movie would be great if you hadnt seen an action thriller for the last 20 years it is extremely formulaic and the ending is straight from the 90s hollywood vein of cheesy endings i may given this movie a solid 7 had they not gone down the sparkly gooey happy ending route which i found was an awkward contrast to 15 hours of brutality which preceded it good fun if you are an action enthusiast and not too concerned about original ideas,cruel
if youre looking for action looking for brutal violence and a mesmerizing story linethe man from nowhere has what you seek cha taesikbin won is a man of mystery he is a mild mannered pawn shop owner that comes to the rescue of a young girl that has been kidnapped by a ruthless gang of drug runners the girls mother happens to owe a large sum of money and these vicious and nasty criminals are bargaining a rough trade taesik feels compassion for the girl and after being framed by the kidnappers he will enter kickass mode to save his young admirer and seek justice the action is high octane and the violence is brutal and combustible not for the faintofheart this flick seems hellbent on grabbing you and not letting go its like a train wreckyou just cant stop gawking other players include saeron kim jongpik lee taehoon kim and do won kwak you will want to watch again just for the hell of it,cruel
