 you live only for tomorrow i only live for today korean films have been making a lot of noise in the past decade and many critics believe that they are making the best films at the moment as well i only had the opportunity to watch the host and oldboy before getting around to watching the man from nowhere oldboy is considered by many as one of the best all time korean films but i wasnt too overwhelmed by it i thought it was good but not enough to get me interested in korean films the same thing happened with the host but now i that ive seen the man from nowhere directed by jeongbeom lee i want to see more i really loved this movie and thought it was great it was a character driven action film with some powerful scenes and a memorable lead performance by bin won who also worked in mother another successful korean film this film reminded me a lot of a couple of western films like man on fire and taken but with the extra ingredient of being from korea so you would expect better fight scenes and a much darker tone the film is very dark at times and violent but it also has interesting characters and a gripping story the story isnt original weve seen it before many times but the mood of the film and the lead performance are what make it so entertaining this movie had it all my only complaint was that the melodrama was a bit over the top there were a couple dramatic scenes that didnt work too well but the spectacular fighting scenes made up for it this movie was better than i expected and loved it much more than the other korean films i had seen now i just want to watch moreas i mentioned before the plot isnt very original we have the quiet and reclusive man in this case a pawnshop owner named cha taesik bin won who has a hidden and violent past he lives a solitary life and isnt much of a talker his life changes when a neighboring little girl named somi saeron kim begins intruding his life and trying to befriend him shes a smart girl who lives with her drug addict mother hyojeong hyoseo kim when her mother decides to steal some drugs from a dangerous drug trafficking organization everything changes for cha taesik first of all hyojeong hides the drugs in a bag which she leaves at the pawnshop without chas knowledge when the dealers catch up with somis mother they kidnap both of them and force cha to deliver the drugs to another dealer cha accepts to deliver the drugs as long as they dont touch somi but what he doesnt know is that the deal is a setup to eliminate another drug ring leader and that they have no intention of letting them go cha discovers hyos body which is missing several organs and realizes that hes not only dealing with a drug trafficking cartel but an organ dealer one as well that is when cha taesik begins hunting down the men responsible for the kidnapping of somi and unleashing his merciless fury the drug dealers have messed with the wrong mandespite the story being predictable it is memorable thanks to the great action scenes which are brutal and violent at times the film also owes great deal of its success to bin won for his performance in the lead role in the same way that taken worked thanks to liam neeson or man on fire thanks to denzel washington he had the look and the qualities you would look for in this type of film bin won is one cool dude no matter how he cuts his hair yes the film has several clichs and melodramatic moments but it stands out from those average movies and delivers some memorable scenes there are great choreographed fighting scenes especially near the end of the film in the climatic final battle and there are also some great shots like one in which the camera follows bin won as he jumps out of a window from a second floor these qualities are what make the man from nowhere stand out from other similar movies and the film will stick with you long after the credits have rolled i will definitely be checking out more korean films like this one because they have a unique atmosphere and setting i really loved the dark mood of this film and how they mixed it with some humorous momentshttpestebueno10blogspotcom,cruel
the man from nowhere is not exactly unique the premise is a young girl who is kidnapped by drugdealers organ traffickers after her mother gets involved with them her neighbour is a mysterious young man who owns a pawnshop and while he doesnt show it to her face he cares deeply for her and she is his only friend in the world what follows is a riveting ride featuring the somewhat reluctant main character in his quest to bring back the young girl some may refer to this as a revenge flick however i do not think this is the case as the violence committed by the man is not undue he always attempts to get her back without fighting however obviously this does not work out the cinematography is superb as is the acting and the writing it is kind of tough to get the full feel of the film without being able to understand korean but i managed as the subtitles were for the most part accurate the characters were great i usually become annoyed with the main characters and start to quietly cheer for the antagonists however in the man from nowhere not even doubts of the main hero came across my mind shocking for someone like me you quickly become emotionally involved with the characters if you enjoy action of any sort you will love the man from nowhere bin won is great the little girl is surprisingly good and the supporting actors never detract from the movie a great sign do yourself a favour and check this movie out,cruel
the south koreans are rank 1 in the world at making movies and soon we might have english dubbed versions of their blockbuster filmsif you like movies like diehard commando and taken then this film is for you plot operating a pawn shop in a small neighborhood cha taesik now leads a quiet life his only connection to the rest of the world is a little girl somee who lives nearby a heroin addict and somis mother hyojeong smuggles drugs from a drug trafficking organization and entrusts taesik with the product without his knowledge when the traffickers find out about this they kidnap both hyojeong and somi the gang sends a number of thugs to taesiks pawn shop to retrieve the stolen drugs but is easily overpowered by taesik making his identity ambiguous however upon learning that the gang now has in their possession both hyojeong and somi taesik gives the beaten gang members what they are looking forrealizing that taesik may serve better as a mule than their former thug the brothers that lead the gang  mansik and jongsik  promise to release hyojeong and somi under the condition that taesik make a delivery for them taesik makes the decision to face the outside world in order to rescue somi however the delivery was part of a larger plot to eliminate a drug ring superior mr oh and taesik is arrested at the same time hyojeongs body with her organs harvested is discovered in the back of the car used by taesik when he made the delivery and taesik realizes that somis life may also be in danger he fights off half a dozen detectives and escapes from the police station during his escape the police are bewildered at taesiks display of power combat techniques and agility and further investigates his bio and finds out that he was once a black operation agent for the korean government with numerous commendations but dropped out of the agency after his pregnant wife was murdered by an assassin the assassin shot taesik twice but was killed by other agency officers before he could kill taesik the incident nearly drove him mad hence he went into hidingrealizing this the narcotics head contacted a weakened taesik after his encounter with a highly trained assassin who backs up the brothers now with the knowledge that somee is being used by an ant organization to secretly smuggle drugs and  in the future  might be killed for organ harvesting taesik goes on a mad killinghunting spree to locate and save somee who is his only connection to a caring worlda gore battle ensues from the antdrug manufacturing location where he was able to free the remaining children and kill off the younger of the brothers to their posh condo unit where the rest of the killing continues taesik went mad when a container that holds harvested eyes was rolled towards him believing to be somees a final standoff with the assassin ensues with taesik winning the fightafter killing off the last hoodlum in the parking lot taesik was about to resign to his fate by shooting himself when a scared and dirty somee emerged from the darkness she was saved by the assassin who took to her kindly and killed instead the surgeon accomplice  his eyes were in the container that taesik sawa police escort in the end sees taesik and somee together in the back of the detectives car while she sleeps taesik asks if they can be dropped off at the small convenience store  a surprise for somee the owner got a shock upon seeing all the police lined up around them and with the words you really messed it up big timetaesik pulls up a fancy backpack with a star and fills it up with fancy school stuff much to her delighttaesik asks if he can hug her and as they embrace he could not stop the tears as they fell from his battered bandaged faceverdict perfect score 1010 buy this one now,cruel
what happens if you put the best child actress ever called kim saeron of the wonderful drama a brand new life and the incredibly gifted actor won bin of mother and the brotherhood of war in one cast you get a masterpiece that cant be reproduced by anyone and that mixes incredible emotions with profound characters a gripping and sometimes surprising plot and tons of amazing action scenes and liberating slaughter passages its a pity for the western world but south korea produces many movies like this one while american movies of that kind happen to be ordinary stuff like getaway this film dynamically mixes elements of genres such as dramas action films and thrillers in one and doesnt forget about a few humorous and philosophical moments to give this rollercoaster ride a few breaks i wont give away any plot details because you must watch it yourself but i might mention that this film of course includes many memorable scenes the moment when the young child experiences how her mother takes drugs and is tortured by pitiless criminals was really intense the final action scene of the movie is one of the most brutal and at the same time liberating scenes of that kind ever done in cinema the best part is though the very last scene of the movie just as it should be in a perfect movie if you dont have tears in your eyes while watching this you are simply inhumanthis movie has a very good reputation but its not yet good enough it proves once again why south korea has created the best movies worldwide in the last fifteen years this film is at the same level as oldboy a tale of two sisters i saw the devil my way and so on those who dont recognize the quality of this movie dont know anything about cinema i dont want to give away any details just try anything you can to watch and purchase this masterpiece of contemporary cinema,cruel
the plot isnt anything new but as far as this genre goes lonely man saves the day this movie has to be the best one of its kind it makes taken look like childs play and the lead actors won bin charisma is off the hook even with little dialogue he is able to convey so much emotion just with his eyes great actor that needs to do more movies in my opinion also the action in this movie is flawless it has the most epic knife battle i have ever seen on screen the knife battle was truly a masterpiece and i dont usually say that one thing that sets this movie apart from taken leon man on fire is that it brings out an emotional reaction from the viewer i actually cried like a little girl during this movie its the first action movie i have ever cried in simply brilliant south korea you have done it again,cruel
the man from nowhere my best movie because it have got wonder scenario at the same time director jeong beom lee who won bins director is very successful and also movies which won bin has got many movie have got a lot of prize when i watched her performance on the a brand new life i like kim sae ron because i think she has got talented innatethis movie affected me and i proposed to my friend this movie and i propose to the people who like won bins performance ajeussi from nowhereif you want to watch the man from nowhere you will cry and be affectedi think you dont have to keep your felling because you cant escape your felling and i think you will crythis movie make think us what can ordinary girl do alone without her family,cruel
so this is a very asian story about a quiet but skillful knight going to rescue a very adorable little damsel in distress and its absolutely good and i mean everything the story is well put together albeit quite simple and very leon like the acting with very little exceptions is brilliant and the directing is on par with that if you enjoy some guns blazing combined with a very well built drama about a very real subject human trafficking and drugs and martial arts without the magical acts like in so many american and chinese movies these days this is a movie for you oh i almost forgot the soundtrack is good too especially the main title so enjoy,cruel
dont get me wrong its great stuff if you havent seen a single thriller in the past 20 years officially being south korean it is formulaic hollywood filmmaking that doesnt even work well on that level there is no distinctive style and of course its overedited an unnecessarily complicated plot for something thats devoid of substance and overall theres very little fun to be had which mostly comes from quirky sidecharacters its probably enough to have only seen tony scotts man on fire for the story of to feel stale if furthermore you have seen taken with liam neeson you have seen a similar story taken to an extreme level that borders on parody so in that case is unlikely to work for you solely based on its storyperhaps above all this another problem i had with it was the for me lack of characters to care about whenever it tries to make one care for the characters it is overdoing it with obvious scenes that have little to no other purpose and in the end those people still lack much personality apparently the viewer is basically supposed to care about the girl despite being a drag and a thief simply because she is a child and because the mother was a crack whore and for the man from nowhere one is supposed to care about because his pregnant wife got killed on the account of him and now the seclusive man is more or less nice to that aforementioned girl that gets no love and he eventually even gets out of his way to rescue the girl and even goes so far that he is about to commit suicide when he thought he failed but of course the girl shows up before he can pull the trigger becausewell hes a good man at heart and not because the two actually have much of a bond to speak ofyou can rest assured that the film doesnt miss out on using flashbacks to provide backstory for the socalled man from nowhere does it show the wife getting killed well yes its a several minutelong flashback of the tragic event that is included after we already heard several times what happened with the flashback bringing very little new to the table in moments like those and in about any scene with the little girl is so sentimental it makes spielberg look like lars von trier one user on the movies message board made a pretty telling post when he said that he doesnt normally like foreign movies but this one was really awesome after opening his post with this was a great movie for anyone like me that grew up on steven seagal and van damme movies in the 90s my rating is admittedly harsh and im looking forward to reading 0 out of 12 people found the following review useful but nowadays i just have very little patience for formulaic films that are professionally made but unengaging or lacking in anything particularly interesting,cruel
if you want to experience a simple story told in brilliant way watch this moviethis is one of my all time fav movies the acting is excellent background score set the emotionscene straight and omg the action it is just brilliant mainly because the lead are performing themselves i am fan of action  gangster movies this movie is entertaining and have heart at the right place to unfold a simple storyi thank this movie to introduce me to world of korean cinema the girl is so cute in the movie i would have done the same for her   ,cruel
an excellent action crimethriller with enough action gore story and emotion packed into it its been ages since ive seen a good actionpacked thriller with no superherofuss involved as a fellow reviewer has mentioned this makes taken look like a childrens movie its taken with the brutality of kill bill the story isnt that original a man trying to protect or find a young girl  weve all seen leon man on fire taken etc but the way man from nowhere is crafted is what makes it so gripping and entertainingthe two lead characters cha taesik and somi are so wellrounded and have enough depth to sustain your interest the associated actors give praiseworthy performances too this is won bins third brilliant performance after tae guk gi and madeo mother he carries the movie on his shoulders with such charisma though he has very few dialogues he is terrific even in his silenceyou live for tomorrow  i only live for today ill show you just how fked up that can be,cruel
it is pretty rare to watch an action movie and actually feel like there was a measure of not only reality but a little justice as well while there are parts of this film that are obviously not the civilized definition of the latter there is something very satisfying about suspending your disbelief there is really no happily ever after here which is a welcome change to me i have always felt that movies that have to wrap up everything in a neat package for you somehow cheapen any sacrifices that were made by the characters to resolve their stories obviously there is a fine line between the entertainment value the reason we watch movies in the first place and the appreciation for the gravity of what we have watched it is really nice to watch something that actually makes you feel like all the blood and stress that brought you to the end credits actually had some impact this film has that in spades and doesnt sacrifice the entertainment factor to get there there are some very graphic scenes which to me only enforces this message real fights wouldnt be pretty and people who won them wouldnt be unscathed also people who are capable of killing large amounts of people for whatever reason shouldnt immediately be put in charge of the well being of children this is a fantastic movie that got a lot of things right,cruel
the movies plots were made unreasonable just to have a good emotional aspect its a waste of time the only thing good about this movie is the acting,cruel
well i would say maybe why  because the rating reflects not objectively the true qualities of the movies but more precisely the impact made on the audiencegiven the fact that its not made in hollywood i would say the almost eight stars are quite fair stillif you are a won bin fan you definitely will like it comparing it with the role from tae guk gi you can see that this is a good actorfar from me to compare this movie to leon man on fire etc why  because the story here labelled by some as unoriginal is one very different totally i might sayno spoilers i promised to myself well how can i explain better any other way  lets seea past paced thriller close to the end a drama at the beginning and a dramatic thriller as a whole the motivation is what differentiates it from the two movies named above from flashbacks we learn what triggers he reaction and the dramatic transformation undergone at a pointi agree more with the users comparing this movie to history of violence because of shocking transformation of the herosome might be unimpressed by the final battle one against so many  well even in that scene there is a reason more likely two reasons for the clarity of the path chosen by himthe ending  hmmm i do hope this is but a bridge to a second movie with the character,cruel
taesik is quietly running a pawn shop when a neighbor who is a heroin addict sells him a camera bag which contains drugs inside which were stolen from a gang the woman is kidnapped with her little girl somi the bad guys find out quickly that taesik has bruce lee like fighting skills as he beats them silly the bosses promise to release the mother and daughter if he makes a delivery for them it is a set up which results in taes arrest he escapes the police and they discover that he was a black ops soldier for the government but left after his wife was killed somis mother is murdered and the little girl is used as a mule for running narcotics and money and she will soon have her organs harvested for the black market tae fights a couple of epic battles which frees several child mules and after killing more gangsters he must face off with the best bodyguard the have a classic return of the dragon type of winner take all martial arts karate match that does of course have a winner the man from nowhere is a korean save the kid kind of action film that leon the professional is and is equally as entertaining,cruel
whats with this korean trope  sappyfy their otherwise pulsating thrillers with weak unnecessary melodramatic wimpy crying scenes ugh its like trying to enjoy a steak dinner when a cockroach suddenly falls into your plate gross that said ill try my best to erase the sappy scenes from my memory this was a pretty wellwritten albeit somewhat complex crime thriller there were also enough bloodsoaked scenes to satisfy gore hounds such as myself if i had the banknote and was into producing movies id hire the filmmakers behind the man from nowhere they understand tension and choreography well dialog wasnt too bad either could do without the forced comedic scenes though all in all a pretty good film if you can stomach those stringheavy syrupy melodramatic crying scenes,cruel
the man from nowhere has been compared to the professional but in this case the killerchild relationship is mostly at a distance without much time for a bond to develop beyond cliches about bad mothers and cool guys who cant display positive emotions the movie has lots of great individual moments involving knives tasers bathrooms and driving ranges but most of the characters including our protagonist are too cliched to take us beyond a collection of cool action shots the police subplot slows the film dramatically this wouldve been better at 90 minutes with the cops gone almost completely and the ending is totally unsatisfying skip it unless youre specifically into korean action thrillers,cruel
a small girl is kidnapped n a mysterious guy takes upon himself to find her n later it is revealed that the mysterious guy is some military veteran ok its been done umpteen number of times but if u can pull it off with good script n acting with solid action then y notbad asses saving young kids lon the professional commando taken man on fire etcthe film has a brutal hand combat scene involving knife raid redemption oldboy repo men etc comes to mindthe acting n script is goodfirst saw this in 2011 on a dvd revisited it recently,cruel
the movie was great and made me cry i really loved it,cruel
best moviei hardly repeat watching any moviesmooth storyaction stunts feels realits a complete packagea must watch movie before you die,cruel
a hidden gem of a movie fantastic from start to finish watch it and find out,cruel
saeron kim is not only precious but also brilliant in her role as is bin won as the exblack operations soldierpawnshop keeper the film so effectively depicts the lengths criminals will go to for money it makes one shudder to think this actually does happen in real life filled with so much feeling and emotion this action packed thriller was a delight to watch  and what a beautiful ending,cruel
mysterious man befriends a little girl whos mother steals drugs from a crime boss as punishment they kidnap the girl and her mother and use them as bait to make taesuk do their bidding the police are on taesuk trail as he treks down a bloody path of drugs organ harvesting loan sharks andd children runners classic slapstick humor from cops and villians the daughter does a good job acting  highbeat ending compared to most korean thriller endings,cruel
its been years since my initial watching and i can still say that every viewing feels like the first and thats primarily due to the fact that the characters are perfectly written the action sequences are amazing executed and the cinematography is immaculately directed its honestly the biggest shame that won bin is inactive as an actor considering the fact that his performance in this film rivals some of his highly praised actingfocused celebrity peers such as lee byunghun particularly his performance in another excellent revengefilm called i saw the devil,cruel
